{"originalText": "serial JL 271728 291210 291772 291817 31 Transportation Research Part B: Methodological TRANSPORTATIONRESEARCHPARTBMETHODOLOGICAL 2013-11-15 2013-11-15 2013-11-15T20:44:22 1-s2.0-S0191261513001884 S0191-2615(13)00188-4 S0191261513001884 10.1016/S0191-2615(13)00188-4 S300 S300.1 CONTENTS-ENTRY-ONLY 1-s2.0-S0191261513X00104 2015-05-14T05:39:52.915433-04:00 0 0 20131101 20131130 2013 2013-11-15T00:00:00Z rawtext articleinfo crossmark dco dateupdated tomb dateloaded datesearch indexeddate volumelist yearnav articletitlenorm cid cids contenttype copyright dateloadedtxt docsubtype doctype doi eid ewtransactionid hubeid issn issnnorm itemstage itemtransactionid itemweight openaccess openarchive pg pgfirst pii piinorm pubdateend pubdatestart pubdatetxt pubyr sortorder srctitle srctitlenorm srctype suppl volfirst volissue webpdf webpdfpagecount articletitle alllist content subj ssids 0191-2615 01912615 false 57 57 C Volume 57 1 IFC IFC 201311 November 2013 2013-11-01 2013-11-30 2013 simple-article edb Copyright \u00a9 2013 Elsevier Ltd. All rights reserved. EDITORIALBOARD item S0191-2615(13)00188-4 S0191261513001884 1-s2.0-S0191261513001884 10.1016/S0191-2615(13)00188-4 271728 2013-11-15T17:44:37.123549-05:00 2013-11-01 2013-11-30 1-s2.0-S0191261513001884-main.pdf https://s3.amazonaws.com/prod-ucs-content-store-us-east/content/pii:S0191261513001884/MAIN/application/pdf/7ad992600eff64f61716fa9aece95127/main.pdf https://s3-eu-west-1.amazonaws.com/prod-ucs-content-store-eu-west/content/pii:S0191261513001884/MAIN/application/pdf/7ad992600eff64f61716fa9aece95127/main.pdf main.pdf pdf true 66966 MAIN 1 1-s2.0-S0191261513001884-main_1.png https://s3.amazonaws.com/prod-ucs-content-store-us-east/content/pii:S0191261513001884/PREVIEW/image/png/cec069b1a9074910f77ae512af7d30ae/main_1.png https://s3-eu-west-1.amazonaws.com/prod-ucs-content-store-eu-west/content/pii:S0191261513001884/PREVIEW/image/png/cec069b1a9074910f77ae512af7d30ae/main_1.png main_1.png png 70334 849 656 IMAGE-WEB-PDF 1 Editor-in-Chief HAI YANG Department of Civil and Environmental Engineering, The Hong Kong University of Science and Technology, Clear Water Bay, Kowloon, Hong Kong, China; e-mail: cehyang@ust.uk Transportation Research an international journal Part B: Methodological Associate Editors RICHARD ARNOTT Department of Economics, 4106 Sproul Hall, University of California, Riverside, CA 92521, USA e-mail: richard.arnott@ucr.edu CHANDRA BHAT Department of Civil Engineering, Ernest Cockrell Jr. Hall, 6.810, The University of Texas, Austin 78712, USA e-mail: bhat@mail.utexas.edu MALACHY CAREY Institute for Transport Studies, University of Leeds, Leeds LS2 9JT, UK, and Ulster Business School, University of Ulster, Newtownabbey BT37 0QB, UK e-mail: m.carey@its.leeds.ac.uk; m.carey@ulster.ac.uk CARLOS DAGANZO Department of Civil Engineering and Institute of Transportation Studies, University of California, Berkeley, CA 94720, USA e-mail: daganzo@ce.berkeley.edu TERRY FRIESZ Department of Industrial Engineering, The Pennsylvania State University, University Park, PA 16807 e-mail: tfriesz@psu.edu FRED MANNERING School of Civil Engineering, Purdue University, West Lafayette, IN 47906, USA e-mail: flm@purdue.edu MICHAEL ZHANG Department of Civil and Environmental Engineering, University of California, Davis, CA 95616, USA e-mail: hmzhang@ucdavis.edu Editorial Advisory Board NICOLE ADLER, Hebrew University, Jerusalem, Israel SOYOUNG AHN, Tempe, AZ, USA HILLEL BAR-GERA, Be\u00e2\u20ac\u2122er-Sheva, Israel MICHAEL BELL, London, UK MICHEL BIERLAIRE, Lausanne, Switzerland MICHEL BLIEMER, NSW, Australia DAVID BOYCE, Evanston, IL WERNER BRILON, Bochum, Germany DAVID BROWNSTONE, Irvine, CA, USA JAMES CAMPBELL, St. Louis, MO, USA MICHAEL CASSIDY, Berkeley, CA, USA ANTHONY CHEN, Logan, UT, USA ELISABETTA CHERCHI, London, UK BENJAMIN COIFMAN, Columbus, OH, USA MAGED DESSOUKY, Los Angeles, CA, USA LILY ELEFTERIADOU, Gainsville, FL, USA MOGENS FOSGERAU, Bygningstorvet Building Square, Denmark PETER FURTH, Boston, MA, USA LAURIE A. GARROW, Atlanta, GA, USA NIKOLAOS GEROLIMINIS, Lausanne, Switzerland KOSTAS GOULIAS, Santa Barbara, CA, USA INGO HANSEN, Delft, The Netherlands MARTIN HAZELTON, Palmerston North, New Zealand DIRK HELBING, Dresden, Germany STEPHANE HESS, Leeds, UK BENJAMIN HEYDECKER, London, UK SERGE HOOGENDOORN, Delft, The Netherlands HAI-JUN HUANG, Beijing, China WENLONG JIN, Irvine, CA, USA KARA KOCKELMAN, Austin, TX, USA FRANK KOPPELMAN, Evanston, IL, USA JORGE LAVAL, Atlanta, GA, USA JEAN-PATRICK LEBAQUE, Arcueil, France LUDOVIC LECLERCQ, Vaulx-en-Velin Cedex, France BAIBING LI, Loughborough, UK ROBIN LINDSEY, Edmonton, Canada HONG K. LO, Kowloon, Hong Kong HENRY X. LIU, Minneapolis, MN, USA MIKE MAHER, Edinburgh, UK ELISE MILLER-HOOKS, University of Maryland, College Park, MD, USA JUAN CARLOS MUNOZ, Santiago, Chile YU (MARCO)NIE, Evanston, IL, USA DEBBIE NIEMEIER, Davis, CA, USA JUAN DE DIOS ORTUZAR, Santiago, Chile YANFENG OUYANG, Urbana-Champaign, IL, USA ANDREA PAPOLA, Napoli, Italy MICHAEL PATRIKSSON, Gothenburg, Sweden SRINIVAS PEETA, West Lafayette, IN, USA STEF PROOST, Leuven, Belgium AMELIA REGAN, Irvine, CA, USA VENKY SHANKAR, PA, USA KENNETH SMALL, Irvine, CA, USA KAREN SMILOWITZ, Evanston, IL SIVA SRINIVASAN, Gainesville, FL, USA AGACHI SUMALEE, Hong Kong, China JOFFRE SWAIT, University of Technology Sydney, Sydney, Australia SATISH UKKUSURI, West Lafayette, IN, USA GUDMUNDUR F. ULFARSSON, Reykjav\u00c4\u00b1\u00c2\u00b4 k, Iceland JOAN WALKER, University of California, Berkeley, CA, USA BRUCE WANG, Texas, USA DAVID WATLING, Leeds, UK S.C. WONG, Pokfulam, Hong Kong YAFENG YIN, GAINESVILLE, FL, USA Advertising information: If you are interested in advertising or other commercial opportunities please e-mail Commercialsales@elsevier.com and your enquiry will be passed to the correct person who will respond to you within 48 hours. Publication information: Transportation Research: Part B (ISSN 0191-2615). For 2013, volumes 47\u00e2\u20ac\u201c58 (12 issues) are scheduled for publication. Subscription prices are available upon request from the Publisher or from the Elsevier Customer Service Department nearest you or from this journal\u00e2\u20ac\u2122s website (http://www.elsevier.com/locate/trb). Further information is available on this journal and other Elsevier products through Elsevier\u00e2\u20ac\u2122s website (http://www.elsevier.com). Subscriptions are accepted on a prepaid basis only and are entered on a calendar year basis. Issues are sent by standard mail (surface within Europe, air delivery outside Europe). Priority rates are available upon request. Claims for missing issues should be made within six months of the date of dispatch. Orders, claims, and journal enquiries: please contact the Elsevier Customer Service Department nearest you: St. Louis: Elsevier Customer Service Department, 3251 Riverport Lane, Maryland Heights, MO 63043, USA; phone: (877) 8397126 [toll free within the USA]; (+1) (314) 4478878 [outside the USA]; fax: (+1) (314) 4478077; e-mail: JournalCustomerService-usa@elsevier.com Oxford: Elsevier Customer Service Department, The Boulevard, Langford Lane, Kidlington, Oxford OX5 1GB, UK; phone: (+44) (1865) 843434; fax: (+44) (1865) 843970; e-mail: JournalsCustomerServiceEMEA@elsevier.com Tokyo: Elsevier Customer Service Department, 4F Higashi-Azabu, 1-Chome Bldg, 1-9-15 Higashi-Azabu, Minato-ku, Tokyo 106-0044, Japan; phone: (+81) (3) 5561 5037; fax: (+81) (3) 5561 5047; e-mail: JournalsCustomerServiceJapan@elsevier.com Singapore: Elsevier Customer Service Department, 3 Killiney Road, #08-01 Winsland House I, Singapore 239519; phone: (+65) 63490222; fax: (+65) 67331510; e-mail: JournalsCustomerServiceAPAC@elsevier.com Past Editor-in-Chief FRED L. MANNERING Founding Editor FRANK A. HAIGHT um, Germany DAVID BROWNSTONE, Irvine, CA, USA JAMES CAMPBELL, St. Louis, MO, USA MICHAEL CASSIDY, Berkeley, CA, USA ANTHONY CHEN, Logan, UT, USA ELISABETTA CHERCHI, London, UK BENJAMIN COIFMAN, Columbus, OH, USA MAGED DESSOUKY, Los Angeles, CA, USA LILY ELEFTERIADOU, Gainsville, FL, USA MOGENS FOSGERAU, Bygningstorvet Building Square, Denmark PETER FURTH, Boston, MA, USA LAURIE A. GARROW, Atlanta, GA, USA NIKOLAOS GEROLIMINIS, Lausanne, Switzerland KOSTAS GOULIAS, Santa Barbara, CA, USA INGO HANSEN, Delft, The Netherlands MARTIN HAZELTON, Palmerston North, New Zealand DIRK HELBING, Dresden, Germany STEPHANE HESS, Leeds, UK BENJAMIN HEYDECKER, London, UK SERGE HOOGENDOORN, Delft, The Netherlands HAI-JUN HUANG, Beijing, China WENLONG JIN, Irvine, CA, USA KARA KOCKELMAN, Austin, TX, USA FRANK KOPPELMAN, Evanston, IL, USA JORGE LAVAL, Atlanta, GA, USA JEAN-PATRICK LEBAQUE, Arcueil, France LUDOVIC LECLERCQ, Vaulx-en-Velin Cedex, France BAIBING LI, Loughborough, UK ROBIN LINDSEY, Edmonton, Canada HONG K. LO, Kowloon, Hong Kong HENRY X. LIU, Minneapolis, MN, USA MIKE MAHER, Edinburgh, UK ELISE MILLER-HOOKS, University of Maryland, College Park, MD, USA JUAN CARLOS MUNOZ, Santiago, Chile YU (MARCO)NIE, Evanston, IL, USA DEBBIE NIEMEIER, Davis, CA, USA JUAN DE DIOS ORTUZAR, Santiago, Chile YANFENG OUYANG, Urbana-Champaign, IL, USA ANDREA PAPOLA, Napoli, Italy MICHAEL PATRIKSSON, Gothenburg, Sweden SRINIVAS PEETA, West Lafayette, IN, USA STEF PROOST, Leuven, Belgium AMELIA REGAN, Irvine, CA, USA VENKY SHANKAR, PA, USA KENNETH SMALL, Irvine, CA, USA KAREN SMILOWITZ, Evanston, IL SIVA SRINIVASAN, Gainesville, FL, USA AGACHI SUMALEE, Hong Kong, China JOFFRE SWAIT, University of Technology Sydney, Sydney, Australia SATISH UKKUSURI, West Lafayette, IN, USA GUDMUNDUR F. ULFARSSON, Reykjav\u00c4\u00b1\u00c2\u00b4 k, Iceland JOAN WALKER, University of California, Berkeley, CA, USA BRUCE WANG, Texas, USA DAVID WATLING, Leeds, UK S.C. WONG, Pokfulam, Hong Kong YAFENG YIN, GAINESVILLE, FL, USA Advertising information: If you are interested in advertising or other commercial opportunities please e-mail Commercialsales@elsevier.com and your enquiry will be passed to the correct person who will respond to you within 48 hours. Publication information: Transportation Research: Part B (ISSN 0191-2615). For 2013, volumes 47\u00e2\u20ac\u201c58 (12 issues) are scheduled for publication. Subscription prices are available upon request from the Publisher or from the Elsevier Cust TRB 80001418 S0191-2615(13)00188-4 10.1016/S0191-2615(13)00188-4 Elsevier Ltd Editorial Board", "coredata": {"eid": "1-s2.0-S0191261513001884", "dc:description": null, "openArchiveArticle": "false", "prism:coverDate": "2013-11-30", "openaccessUserLicense": null, "prism:aggregationType": "Journal", "prism:url": "https://api.elsevier.com/content/article/pii/S0191261513001884", "link": [{"@_fa": "true", "@rel": "self", "@href": "https://api.elsevier.com/content/article/pii/S0191261513001884"}, {"@_fa": "true", "@rel": "scidir", "@href": "https://www.sciencedirect.com/science/article/pii/S0191261513001884"}], "dc:format": "application/json", "openaccessType": null, "pii": "S0191-2615(13)00188-4", "prism:volume": "57", "prism:publisher": "Elsevier Ltd.", "dc:title": "Editorial Board", "prism:copyright": "Copyright \u00a9 2013 Elsevier Ltd. All rights reserved.", "openaccess": "0", "prism:issn": "01912615", "openaccessArticle": "false", "prism:publicationName": "Transportation Research Part B: Methodological", "openaccessSponsorType": null, "prism:pageRange": "IFC", "prism:coverDisplayDate": "November 2013", "prism:doi": "10.1016/S0191-2615(13)00188-4", "prism:startingPage": "IFC", "dc:identifier": "doi:10.1016/S0191-2615(13)00188-4", "openaccessSponsorName": null}}