{"scopus-eid": "2-s2.0-37849186644", "originalText": "serial JL 271743 291210 291728 291780 291840 31 Ecological Modelling ECOLOGICALMODELLING 2006-08-22 2006-08-22 2010-10-08T02:45:02 1-s2.0-S0304380006003371 S0304-3800(06)00337-1 S0304380006003371 10.1016/j.ecolmodel.2006.07.012 S300 S300.1 FULL-TEXT 1-s2.0-S0304380006X04295 2015-05-14T06:43:49.314216-04:00 0 0 20070110 2007 2006-08-22T00:00:00Z articleinfo crossmark dco dateupdated tomb dateloaded datesearch indexeddate issuelist volumelist yearnav articletitlenorm authfirstinitialnorm authfirstsurnamenorm cid cids contenttype copyright dateloadedtxt docsubtype doctype doi eid ewtransactionid hubeid issfirst issn issnnorm itemstage itemtransactionid itemweight openaccess openarchive pg pgfirst pglast pii piinorm pubdatestart pubdatetxt pubyr sectiontitle sortorder srctitle srctitlenorm srctype subheadings volfirst volissue webpdf webpdfpagecount figure body mmlmath acknowledge affil articletitle auth authfirstini authfull authkeywords authlast primabst ref alllist content subj ssids 0304-3800 03043800 200 200 1 2 1 2 Volume 200, Issues 1\u20132 19 189 192 189 192 20070110 10 January 2007 2007-01-10 2007 Research papers article fla Copyright \u00a9 2006 Elsevier B.V. All rights reserved. APEAKEDFUNCTIONFORMODELINGTEMPERATUREDEPENDENCEPLANTPRODUCTIVITY ALEXANDROV G 1 Introduction 2 Model 2.1 Normalized Arrhenius function 2.2 Generalized Arrhenius function 2.3 Calibration techniques 2.4 Case study 3 Concluding remarks Acknowledgments References ADAMS 2004 353 391 B ALEXANDROV 2005 135 142 G ALEXANDROV 2004 437 447 G ALEXANDROV 2002 293 306 G BERRY 1980 491 543 J BIRKY 2001 43 58 A HUNTINGFORD 2000 41 58 C ITO 2002 143 176 A KRAPIVIN 1993 103 127 V JANECEK 1989 101 124 A JOHNSON 1942 247 268 F JORGENSEN 2004 S TOWARDSATHERMODYNAMICTHEORYFORECOLOGICALSYSTEMS MEDLYN 2002 1167 1179 B SVIREZHEV 1997 79 95 Y VITALE 2003 123 134 M ALEXANDROVX2007X189 ALEXANDROVX2007X189X192 ALEXANDROVX2007X189XG ALEXANDROVX2007X189X192XG item S0304-3800(06)00337-1 S0304380006003371 1-s2.0-S0304380006003371 10.1016/j.ecolmodel.2006.07.012 271743 2010-11-08T17:29:59.240994-05:00 2007-01-10 1-s2.0-S0304380006003371-main.pdf https://s3.amazonaws.com/prod-ucs-content-store-us-east/content/pii:S0304380006003371/MAIN/application/pdf/8e28c20a0dbf83e54535db58abea9f52/main.pdf https://s3-eu-west-1.amazonaws.com/prod-ucs-content-store-eu-west/content/pii:S0304380006003371/MAIN/application/pdf/8e28c20a0dbf83e54535db58abea9f52/main.pdf main.pdf pdf true 349663 MAIN 4 1-s2.0-S0304380006003371-main_1.png https://s3.amazonaws.com/prod-ucs-content-store-us-east/content/pii:S0304380006003371/PREVIEW/image/png/6e3cb084e682c97ff5cbf781f8bcbf64/main_1.png https://s3-eu-west-1.amazonaws.com/prod-ucs-content-store-eu-west/content/pii:S0304380006003371/PREVIEW/image/png/6e3cb084e682c97ff5cbf781f8bcbf64/main_1.png main_1.png png 48597 849 656 IMAGE-WEB-PDF 1 1-s2.0-S0304380006003371-si22.gif https://s3.amazonaws.com/prod-ucs-content-store-us-east/content/pii:S0304380006003371/STRIPIN/image/gif/03719c851b52383c6b6b5ea9d0a664b8/si22.gif https://s3-eu-west-1.amazonaws.com/prod-ucs-content-store-eu-west/content/pii:S0304380006003371/STRIPIN/image/gif/03719c851b52383c6b6b5ea9d0a664b8/si22.gif si22 si22.gif gif 1364 49 382 ALTIMG 1-s2.0-S0304380006003371-si21.gif https://s3.amazonaws.com/prod-ucs-content-store-us-east/content/pii:S0304380006003371/STRIPIN/image/gif/82de6be084952e4379d9041ababb9021/si21.gif https://s3-eu-west-1.amazonaws.com/prod-ucs-content-store-eu-west/content/pii:S0304380006003371/STRIPIN/image/gif/82de6be084952e4379d9041ababb9021/si21.gif si21 si21.gif gif 1523 49 378 ALTIMG 1-s2.0-S0304380006003371-si9.gif https://s3.amazonaws.com/prod-ucs-content-store-us-east/content/pii:S0304380006003371/STRIPIN/image/gif/d9a649739c9e9fecba54384288946765/si9.gif https://s3-eu-west-1.amazonaws.com/prod-ucs-content-store-eu-west/content/pii:S0304380006003371/STRIPIN/image/gif/d9a649739c9e9fecba54384288946765/si9.gif si9 si9.gif gif 961 40 177 ALTIMG 1-s2.0-S0304380006003371-si8.gif https://s3.amazonaws.com/prod-ucs-content-store-us-east/content/pii:S0304380006003371/STRIPIN/image/gif/e196f47ef22fdcaca8833501295e5429/si8.gif https://s3-eu-west-1.amazonaws.com/prod-ucs-content-store-eu-west/content/pii:S0304380006003371/STRIPIN/image/gif/e196f47ef22fdcaca8833501295e5429/si8.gif si8 si8.gif gif 2002 40 451 ALTIMG 1-s2.0-S0304380006003371-si7.gif https://s3.amazonaws.com/prod-ucs-content-store-us-east/content/pii:S0304380006003371/STRIPIN/image/gif/1b6b9849d542b8c754dfdb88abd00a5c/si7.gif https://s3-eu-west-1.amazonaws.com/prod-ucs-content-store-eu-west/content/pii:S0304380006003371/STRIPIN/image/gif/1b6b9849d542b8c754dfdb88abd00a5c/si7.gif si7 si7.gif gif 356 36 53 ALTIMG 1-s2.0-S0304380006003371-si6.gif https://s3.amazonaws.com/prod-ucs-content-store-us-east/content/pii:S0304380006003371/STRIPIN/image/gif/195842b4cddb666401f1526b983c3dca/si6.gif https://s3-eu-west-1.amazonaws.com/prod-ucs-content-store-eu-west/content/pii:S0304380006003371/STRIPIN/image/gif/195842b4cddb666401f1526b983c3dca/si6.gif si6 si6.gif gif 979 37 237 ALTIMG 1-s2.0-S0304380006003371-si5.gif https://s3.amazonaws.com/prod-ucs-content-store-us-east/content/pii:S0304380006003371/STRIPIN/image/gif/74600cd13202ded2554787f66294a49d/si5.gif https://s3-eu-west-1.amazonaws.com/prod-ucs-content-store-eu-west/content/pii:S0304380006003371/STRIPIN/image/gif/74600cd13202ded2554787f66294a49d/si5.gif si5 si5.gif gif 1903 39 329 ALTIMG 1-s2.0-S0304380006003371-si4.gif https://s3.amazonaws.com/prod-ucs-content-store-us-east/content/pii:S0304380006003371/STRIPIN/image/gif/70ea9f31ae4249e67a38f53fee8a53b5/si4.gif https://s3-eu-west-1.amazonaws.com/prod-ucs-content-store-eu-west/content/pii:S0304380006003371/STRIPIN/image/gif/70ea9f31ae4249e67a38f53fee8a53b5/si4.gif si4 si4.gif gif 1146 39 253 ALTIMG 1-s2.0-S0304380006003371-si3.gif https://s3.amazonaws.com/prod-ucs-content-store-us-east/content/pii:S0304380006003371/STRIPIN/image/gif/2fe8681c62ade94f9fb7552d99b61c82/si3.gif https://s3-eu-west-1.amazonaws.com/prod-ucs-content-store-eu-west/content/pii:S0304380006003371/STRIPIN/image/gif/2fe8681c62ade94f9fb7552d99b61c82/si3.gif si3 si3.gif gif 2716 90 350 ALTIMG 1-s2.0-S0304380006003371-si24.gif https://s3.amazonaws.com/prod-ucs-content-store-us-east/content/pii:S0304380006003371/STRIPIN/image/gif/e72e1c31b645c7099847b2fdb46f3b23/si24.gif https://s3-eu-west-1.amazonaws.com/prod-ucs-content-store-eu-west/content/pii:S0304380006003371/STRIPIN/image/gif/e72e1c31b645c7099847b2fdb46f3b23/si24.gif si24 si24.gif gif 520 37 85 ALTIMG 1-s2.0-S0304380006003371-si23.gif https://s3.amazonaws.com/prod-ucs-content-store-us-east/content/pii:S0304380006003371/STRIPIN/image/gif/7e87480f90dda46b7af3240d58271ce8/si23.gif https://s3-eu-west-1.amazonaws.com/prod-ucs-content-store-eu-west/content/pii:S0304380006003371/STRIPIN/image/gif/7e87480f90dda46b7af3240d58271ce8/si23.gif si23 si23.gif gif 466 17 117 ALTIMG 1-s2.0-S0304380006003371-si20.gif https://s3.amazonaws.com/prod-ucs-content-store-us-east/content/pii:S0304380006003371/STRIPIN/image/gif/745b932b0c2b705edf3213d3e487c40e/si20.gif https://s3-eu-west-1.amazonaws.com/prod-ucs-content-store-eu-west/content/pii:S0304380006003371/STRIPIN/image/gif/745b932b0c2b705edf3213d3e487c40e/si20.gif si20 si20.gif gif 1504 59 308 ALTIMG 1-s2.0-S0304380006003371-si2.gif https://s3.amazonaws.com/prod-ucs-content-store-us-east/content/pii:S0304380006003371/STRIPIN/image/gif/ba4c372514f40fd78d2922f75f95cb97/si2.gif https://s3-eu-west-1.amazonaws.com/prod-ucs-content-store-eu-west/content/pii:S0304380006003371/STRIPIN/image/gif/ba4c372514f40fd78d2922f75f95cb97/si2.gif si2 si2.gif gif 730 40 116 ALTIMG 1-s2.0-S0304380006003371-si19.gif https://s3.amazonaws.com/prod-ucs-content-store-us-east/content/pii:S0304380006003371/STRIPIN/image/gif/82750f816ce38c60b05a84331079c9da/si19.gif https://s3-eu-west-1.amazonaws.com/prod-ucs-content-store-eu-west/content/pii:S0304380006003371/STRIPIN/image/gif/82750f816ce38c60b05a84331079c9da/si19.gif si19 si19.gif gif 435 16 112 ALTIMG 1-s2.0-S0304380006003371-si18.gif https://s3.amazonaws.com/prod-ucs-content-store-us-east/content/pii:S0304380006003371/STRIPIN/image/gif/5a6e478a373dfd4ce13579fde847639b/si18.gif https://s3-eu-west-1.amazonaws.com/prod-ucs-content-store-eu-west/content/pii:S0304380006003371/STRIPIN/image/gif/5a6e478a373dfd4ce13579fde847639b/si18.gif si18 si18.gif gif 230 16 38 ALTIMG 1-s2.0-S0304380006003371-si17.gif https://s3.amazonaws.com/prod-ucs-content-store-us-east/content/pii:S0304380006003371/STRIPIN/image/gif/23af8cf5217c3ebaa1a1674836e59e9e/si17.gif https://s3-eu-west-1.amazonaws.com/prod-ucs-content-store-eu-west/content/pii:S0304380006003371/STRIPIN/image/gif/23af8cf5217c3ebaa1a1674836e59e9e/si17.gif si17 si17.gif gif 279 14 52 ALTIMG 1-s2.0-S0304380006003371-si16.gif https://s3.amazonaws.com/prod-ucs-content-store-us-east/content/pii:S0304380006003371/STRIPIN/image/gif/80662bef6b473b0518fda6688f5c1279/si16.gif https://s3-eu-west-1.amazonaws.com/prod-ucs-content-store-eu-west/content/pii:S0304380006003371/STRIPIN/image/gif/80662bef6b473b0518fda6688f5c1279/si16.gif si16 si16.gif gif 1562 59 312 ALTIMG 1-s2.0-S0304380006003371-si15.gif https://s3.amazonaws.com/prod-ucs-content-store-us-east/content/pii:S0304380006003371/STRIPIN/image/gif/9f18d4fa424d580c9abe4d04b2703c31/si15.gif https://s3-eu-west-1.amazonaws.com/prod-ucs-content-store-eu-west/content/pii:S0304380006003371/STRIPIN/image/gif/9f18d4fa424d580c9abe4d04b2703c31/si15.gif si15 si15.gif gif 1780 39 406 ALTIMG 1-s2.0-S0304380006003371-si14.gif https://s3.amazonaws.com/prod-ucs-content-store-us-east/content/pii:S0304380006003371/STRIPIN/image/gif/ff3fb3398ad0185a910f083a02278ecf/si14.gif https://s3-eu-west-1.amazonaws.com/prod-ucs-content-store-eu-west/content/pii:S0304380006003371/STRIPIN/image/gif/ff3fb3398ad0185a910f083a02278ecf/si14.gif si14 si14.gif gif 255 14 52 ALTIMG 1-s2.0-S0304380006003371-si13.gif https://s3.amazonaws.com/prod-ucs-content-store-us-east/content/pii:S0304380006003371/STRIPIN/image/gif/b2436473f7b786168631494d458fe256/si13.gif https://s3-eu-west-1.amazonaws.com/prod-ucs-content-store-eu-west/content/pii:S0304380006003371/STRIPIN/image/gif/b2436473f7b786168631494d458fe256/si13.gif si13 si13.gif gif 269 14 52 ALTIMG 1-s2.0-S0304380006003371-si12.gif https://s3.amazonaws.com/prod-ucs-content-store-us-east/content/pii:S0304380006003371/STRIPIN/image/gif/5afd9f6bcb28a302578fa623fb4b9b43/si12.gif https://s3-eu-west-1.amazonaws.com/prod-ucs-content-store-eu-west/content/pii:S0304380006003371/STRIPIN/image/gif/5afd9f6bcb28a302578fa623fb4b9b43/si12.gif si12 si12.gif gif 563 16 147 ALTIMG 1-s2.0-S0304380006003371-si11.gif https://s3.amazonaws.com/prod-ucs-content-store-us-east/content/pii:S0304380006003371/STRIPIN/image/gif/25bb951e7f4086450cec5026ec05c7ea/si11.gif https://s3-eu-west-1.amazonaws.com/prod-ucs-content-store-eu-west/content/pii:S0304380006003371/STRIPIN/image/gif/25bb951e7f4086450cec5026ec05c7ea/si11.gif si11 si11.gif gif 606 16 165 ALTIMG 1-s2.0-S0304380006003371-si10.gif https://s3.amazonaws.com/prod-ucs-content-store-us-east/content/pii:S0304380006003371/STRIPIN/image/gif/1b950941caf19c27f587386fceaa1adb/si10.gif https://s3-eu-west-1.amazonaws.com/prod-ucs-content-store-eu-west/content/pii:S0304380006003371/STRIPIN/image/gif/1b950941caf19c27f587386fceaa1adb/si10.gif si10 si10.gif gif 512 16 125 ALTIMG 1-s2.0-S0304380006003371-si1.gif https://s3.amazonaws.com/prod-ucs-content-store-us-east/content/pii:S0304380006003371/STRIPIN/image/gif/9b82438bf4324dd7fa02a21ad60ea28e/si1.gif https://s3-eu-west-1.amazonaws.com/prod-ucs-content-store-eu-west/content/pii:S0304380006003371/STRIPIN/image/gif/9b82438bf4324dd7fa02a21ad60ea28e/si1.gif si1 si1.gif gif 739 40 137 ALTIMG 1-s2.0-S0304380006003371-gr1.jpg https://s3.amazonaws.com/prod-ucs-content-store-us-east/content/pii:S0304380006003371/gr1/DOWNSAMPLED/image/jpeg/2765528c0fe100f10a1d37a59af8ce7b/gr1.jpg https://s3-eu-west-1.amazonaws.com/prod-ucs-content-store-eu-west/content/pii:S0304380006003371/gr1/DOWNSAMPLED/image/jpeg/2765528c0fe100f10a1d37a59af8ce7b/gr1.jpg gr1 gr1.jpg jpg 21366 153 339 IMAGE-DOWNSAMPLED 1-s2.0-S0304380006003371-gr1.sml https://s3.amazonaws.com/prod-ucs-content-store-us-east/content/pii:S0304380006003371/gr1/THUMBNAIL/image/gif/b4ba07540bef5a201671b216c2e8b03d/gr1.sml https://s3-eu-west-1.amazonaws.com/prod-ucs-content-store-eu-west/content/pii:S0304380006003371/gr1/THUMBNAIL/image/gif/b4ba07540bef5a201671b216c2e8b03d/gr1.sml gr1 gr1.sml sml 2298 56 125 IMAGE-THUMBNAIL 1-s2.0-S0304380006003371-gr2.jpg https://s3.amazonaws.com/prod-ucs-content-store-us-east/content/pii:S0304380006003371/gr2/DOWNSAMPLED/image/jpeg/19878b5174c10382972b305438cbcc4e/gr2.jpg https://s3-eu-west-1.amazonaws.com/prod-ucs-content-store-eu-west/content/pii:S0304380006003371/gr2/DOWNSAMPLED/image/jpeg/19878b5174c10382972b305438cbcc4e/gr2.jpg gr2 gr2.jpg jpg 34518 231 329 IMAGE-DOWNSAMPLED 1-s2.0-S0304380006003371-gr2.sml https://s3.amazonaws.com/prod-ucs-content-store-us-east/content/pii:S0304380006003371/gr2/THUMBNAIL/image/gif/03466fad367adb260338c44a2bb0071a/gr2.sml https://s3-eu-west-1.amazonaws.com/prod-ucs-content-store-eu-west/content/pii:S0304380006003371/gr2/THUMBNAIL/image/gif/03466fad367adb260338c44a2bb0071a/gr2.sml gr2 gr2.sml sml 2948 88 125 IMAGE-THUMBNAIL 1-s2.0-S0304380006003371-gr3.jpg https://s3.amazonaws.com/prod-ucs-content-store-us-east/content/pii:S0304380006003371/gr3/DOWNSAMPLED/image/jpeg/d529db46beaf508a8fbc2fc262c24d93/gr3.jpg https://s3-eu-west-1.amazonaws.com/prod-ucs-content-store-eu-west/content/pii:S0304380006003371/gr3/DOWNSAMPLED/image/jpeg/d529db46beaf508a8fbc2fc262c24d93/gr3.jpg gr3 gr3.jpg jpg 32575 218 327 IMAGE-DOWNSAMPLED 1-s2.0-S0304380006003371-gr3.sml https://s3.amazonaws.com/prod-ucs-content-store-us-east/content/pii:S0304380006003371/gr3/THUMBNAIL/image/gif/008d059fce67e63e880da67b624a7b2e/gr3.sml https://s3-eu-west-1.amazonaws.com/prod-ucs-content-store-eu-west/content/pii:S0304380006003371/gr3/THUMBNAIL/image/gif/008d059fce67e63e880da67b624a7b2e/gr3.sml gr3 gr3.sml sml 3035 83 125 IMAGE-THUMBNAIL ECOMOD 4463 S0304-3800(06)00337-1 10.1016/j.ecolmodel.2006.07.012 Elsevier B.V. Fig. 1 Temperature dependence of enzyme-mediated reactions: a cause\u2013effect diagram. Fig. 2 The curves of temperature response: (a) G A function with E a =65kJmol\u22121, T opt =45\u00b0C, and \u03b7 =36 (solid line), (b) G A function with E a =65kJmol\u22121, T opt =25\u00b0C, and \u03b7 =2 (dotted line) and (c) f A function with E a =65kJmol\u22121 and T opt =45\u00b0C (dashed line). Fig. 3 Temperature response of the hot desert grass Tidestromia oblongifolia (Berry and Bj\u00f6rkman, 1980) grown in hot (triangles) and cold (diamonds) environment plotted against the curves of G A function calibrated to fit the data. A peaked function for modeling temperature dependence of plant productivity Georgii A. Alexandrov \u204e g.alexandrov@nies.go.jp Yoshiki Yamagata National Institute for Environmental Studies, CGER/NIES, Onogawa 16-2, Tsukuba, Ibaraki 305-8506, Japan \u204e Corresponding author. Tel.: +81 298 50 2974; fax: +81 298 50 2960. Abstract We suggests that temperature response of plant productivity can be modeled by the Arrhenius function modified to describe the effect of temperature on enzyme activity: G A(T)=2f(T)/(1+ f 2(T)), where f(T)=exp(E a/RT opt \u2212 E a/RT), R the universal gas constant, E a the activation energy and T opt is the optimal temperature. In common with other functions used for modeling the temperature response of plant productivity, the curve of function G is almost symmetrical and bell-shaped. The special convenience of G A is that it relates the width of the \u201cbell\u201d to thermodynamic concepts, such as activation energy of chemical reactions converting carbon dioxide and water to carbohydrates. Keywords Plant response to environment Photosynthesis Temperature response Arrhenius function Calibration 1 Introduction Temperature response of plant productivity is normally modeled by a peaked function (Adams et al., 2004; Vitale et al., 2003; Alexandrov et al., 2002; Ito and Oikawa, 2002; Birky, 2001; Huntingford et al., 2000; Svirezhev and von Bloh, 1997; Krapivin, 1993; Janecek et al., 1989) that often has no biophysical meaning by itself. It can be a polynomial, a Gaussian, or other ad hoc function expressing in mathematical form the basic idea that plant productivity starts decrease when temperature exceeds some critical value. Here we suggest certain theoretical ground for this basic idea: the theory of enzyme-mediated reactions. Since the synthesis of organic matter is a complex sequence of enzyme-mediated reactions, we suppose that this theory can serve as a guide for modeling temperature response of plant productivity. We proceed from the Arrhenius function modified to describe the effect of temperature on enzyme activity. This function, proposed by Johnson et al. (1942), has two drawbacks: it is awkward-to-handle, and it contains parameters that are difficult to calibrate either from theoretical speculations or from experimental data (Medlyn et al., 2002). We express this function in more convenient form and propose a transparent technique for calibrating its parameters. 2 Model 2.1 Normalized Arrhenius function Temperature dependence of a chemical reaction is often parameterized by the Arrhenius function: k = k 0 exp \u2212 E a R T where k is the rate coefficient, E a the activation energy, R the universal gas constant and T is the absolute temperature. If k =1 when T = T 0 then k 0 = exp E a R T 0 and hence k = exp E a R T 0 exp \u2212 E a R T = exp E a R T 0 \u2212 E a R T = exp E a ( T \u2212 T 0 ) T R T 0 Converting Kelvin to Celsius we obtain the alternative expression of the Arrhenius function, so called, the normalized Arrhenius function: (1) f A ( T ) = exp E a ( T \u2212 T 0 ) ( T + 273 ) R ( T 0 + 273 ) where T 0 is the temperature at which the function is equal to 1 (i.e., f A(T 0)=1). 2.2 Generalized Arrhenius function Enzyme-mediated reactions response to temperature in more complicated manner: high temperatures reduce the catalytic effect exerted by enzymes (Fig. 1 ). Therefore, the Arrhenius function is applicable only at relatively low temperatures. Johnson et al. (1942) modified the Arrhenius function to describe the effect of temperature on enzyme activity: (2) k = k opt H d exp [ H a ( T \u2212 T opt ) / T R T opt ] H d \u2212 H a ( 1 \u2212 exp [ H d ( T \u2212 T opt ) / T R T opt ] ) where T is absolute temperature, H a and H d are interpreted as the levels of activation energy below and above enzyme's temperature (T opt), respectively, and (3) T opt = H d \u0394 S \u2212 R log [ H a / ( H d \u2212 H a ) ] where \u0394S is known as an entropy factor \u201cbut is not readily interpreted\u201d (Medlyn et al., 2002). Let us denote \u03b7 = H d H a Then we may rewrite the Eq. (2) as k = k opt \u03b7 H a f A \u03b7 H a \u2212 H a ( 1 \u2212 f A \u03b7 ) = k opt \u03b7 f A \u03b7 \u2212 ( 1 \u2212 f A \u03b7 ) = k opt \u03b7 f A ( \u03b7 \u2212 1 ) + f A \u03b7 and define the generalized Arrhenius function (4) G A ( T ) = \u03b7 f A ( T ) ( \u03b7 \u2212 1 ) + f A \u03b7 ( T ) which is equal to 1 when f A =1 (i.e., at T 0 = T opt). At low temperatures, this function is no different from an Arrhenius function. For example, the curve of f A (E a =65kJmol\u22121 and T 0 =45\u00b0C) shown in Fig. 2 by dashed line is well approximated by the curve of G A (shown by solid line) with the same activation energy, T opt =45\u00b0C, and \u03b7 =36, when the temperature is lower than 45\u00b0C. However, the curves diverge sharply at higher temperature: f A(T) smoothly increases, whereas G A(T) drops to display denaturing of enzymes at the temperature above 45\u00b0C. The optimal temperature of an enzyme-mediated reaction is not always close to the temperature of enzyme denaturing. The temperature response of photosynthesis is often drawn as a bell-shaped curve centered somewhere between 20 and 30\u00b0C. This type of temperature response can be modeled with G A, if \u03b7 =2 (Fig. 2, dotted line). 2.3 Calibration techniques Let us imagine that we measured the rate of light-saturated photosynthesis (p), which is indeed described by the function p ( T ) = p opt G A ( T ) n times at m levels of temperature (T j , j =1, 2, \u2026, m), but the measurements are disturbed by a noise (\u025b jk , k =1, 2, \u2026, n). Then, we have a series of n \u00d7 m numbers p j , k = p opt G A ( T j ) + \u03b5 j , k containing information about the values of E a and T opt. In order to restore E a and T opt from the measurements we may use the mean values p \u02c6 j = p opt G A ( T j ) + \u03b5 \u02c6 j and thus reduce the noise. If p opt is known and \u03b7 =2, then we need only two points { T 1 , p \u02c6 1 } and { T 2 , p \u02c6 2 } to estimate E a and T opt (5) E \u02c6 a = log ( y 1 / y 2 ) ( 1 / R T 2 ) \u2212 ( 1 / R T 1 ) ; T \u02c6 opt = T 1 1 + ( R T 1 / E \u02c6 a ) log ( y 1 ) ; where y i = p opt p \u02c6 i 1 \u2212 1 \u2212 p \u02c6 i p opt 2 , i = 1 , 2. If p opt is not known, then we need a third point { T 3 , p \u02c6 3 } for testing a guess about the true value of p opt and coming to the estimate ( p \u02c6 opt ) that minimize p \u02c6 3 \u2212 p \u02c6 opt G A ( T 3 ) . In that case, y i = p \u02c6 opt p \u02c6 i 1 \u2212 1 \u2212 p \u02c6 i p \u02c6 opt 2 , i = 1 , 2 2.4 Case study The proposed technique may be illustrated with the measured rates of light-saturated photosynthesis for the hot desert grass Tidestromia oblongifolia (Berry and Bj\u00f6rkman, 1980) grown in hot environment (Fig. 3 ). If one will take the points {31.9, 39.5} and {40.7, 53.7} for estimating E a and T opt under given p opt, and point {49.5, 45.5} for testing a guess about the true value of p opt, then the coefficients of the function will be as follows p \u02c6 opt = 54 ( \u03bc mol C O 2 ) m \u2212 2 s \u2212 1 ; E \u02c6 a = 66.2 kJ mo l \u2212 1 ; T \u02c6 opt = 41.9 \u00b0 C and the curve of the function will go through these three points. Similarly, in case of the grass grown in cold environment, choosing the points {23.5, 8.4}, {28.0, 9.8} and {37.0, 7.5}, one will obtain p \u02c6 opt = 9.9 ( \u03bc mol C O 2 ) m \u2212 2 s \u2212 1 ; E \u02c6 a = 77.6 kJ mo l \u2212 1 ; T \u02c6 opt = 29 \u00b0 C 3 Concluding remarks In most cases the measurements are not precise, and hence the results of calibration depends on the choice of { T i , p \u02c6 i } , ( i = 1 , 3 \u00af ) . The proposed technique makes the relation between the accuracy of measurements and the accuracy of estimates to be transparent, shows how large is the variety of curves that may equally well fit the data. Even if the measurements are precise, the points lying at low and high temperatures may reflect not only response of the photosynthetic system but also the loss of system integrity. Therefore, it would be better to use the points lying somewhere between the optimum and extremes and to restrict the domain of the model to a relevant temperature range. In this connection it should be noted that the calibration technique proposed here is to provide some empirical justification for the use of G A function in carbon cycle models, not to prove that temperature response of photosynthesis must follow the pattern suggested by the proposed function. The latter goes beyond the scope of this study and needs specially designed experiments. The proposed function offers certain advantage over polynomial, Gaussian, or other ad hoc functions applied to modeling temperature response of plant productivity. It expresses the informal postulates and empirical generalizations in terms of chemical thermodynamics and links them to the thermodynamic theory of ecological systems (J\u00f8rgensen and Svirezhev, 2004). Thus, the informal postulate that the curve of temperature response should be almost symmetrical is expressed in the form of mathematical relationship between temperature, entropy and energy (Eq. (3), \u03b7 =2): T opt \u0394 S E a \u2248 2 , that turns the postulate into the object of theoretical studies challenging the J\u00f8rgensen\u2013Svirezhev theory (JST). This link to JST may play important role in reducing current uncertainties in quantifying climate feedbacks from terrestrial ecosystems. What is the temperature threshold at which ecosystems switch from net carbon sink to net carbon source? Models differ on this matter (Alexandrov and Yamagata, 2004). Moreover, the bulk of CO2 flux measurements cannot resolve per se the problem of quantifying climate impact on the productivity of terrestrial ecosystems (Alexandrov et al., 2005). One needs a theory that may serve as a basis for combining models and observations. JST seems to be the most appropriate candidate for this role in the context of computational and conceptual framework presented here. Acknowledgments This work was conducted partly in connection to the project \u201cIntegrated Study for Terrestrial Carbon Management of Asia in the 21st Century Based on Scientific Advancement\u201d which is sponsored by the Global Environmental Research Fund of the Ministry of Environment, Japan. The data on temperature response of Tidestromia oblongifolia (Fig. 3) were digitized by Tsuguki Kinoshita (NIES). References Adams et al., 2004 B. Adams A. White T.M. Lenton An analysis of some diverse approaches to modelling terrestrial net primary productivity Ecol. Model. 177 2004 353 391 Alexandrov et al., 2005 G.A. Alexandrov Y. Yamagata T. Oikawa N. Saigusa Re-calibrating TsuBiMo with eddy-covariance measurements at Takayama Agric. Forest Meteorol. 134 2005 135 142 Alexandrov and Yamagata, 2004 G.A. Alexandrov Y. Yamagata Verification of carbon sink assessment: can we exclude natural sinks? Climatic Change 67 2004 437 447 Alexandrov et al., 2002 G.A. Alexandrov T. Oikawa Y. Yamagata The scheme for globalization of a process-based model explaining gradations in terrestrial NPP and its application Ecol. Model. 148 2002 293 306 Berry and Bj\u00f6rkman, 1980 J. Berry O. Bj\u00f6rkman Photosynthetic response and adaptation to temperature in higher plants Ann. Rev. Plant Physiol. 31 1980 491 543 Birky, 2001 A.K. Birky NDVI and a simple model of deciduous forest seasonal dynamics Ecol. Model. 143 2001 43 58 Huntingford et al., 2000 C. Huntingford P.M. Cox T.M. Lenton Contrasting responses of a simple terrestrial ecosystem model to global change Ecol. Model. 134 2000 41 58 Ito and Oikawa, 2002 A. Ito T. Oikawa A simulation model of the carbon cycle in land ecosystems (Sim-CYCLE): a description based on dry-matter production theory and plot-scale validation Ecol. Model. 151 2002 143 176 Krapivin, 1993 V.F. Krapivin Mathematical model for global ecological investigations Ecol. Model. 67 1993 103 127 Janecek et al., 1989 A. Janecek G. Benderoth M.K.B. Ludeke J. Kindermann G.H. Kohlmaier Model of the seasonal and perennial carbon dynamics in deciduous-type forests controlled by climatic variables Ecol. Model. 49 1989 101 124 Johnson et al., 1942 F. Johnson H. Eyring R. Williams The nature of enzyme inhibitions in bacterial luminescence: sulphalamide, urethane, temperature, pressure J. Cell Comp. Physiol. 20 1942 247 268 J\u00f8rgensen and Svirezhev, 2004 S.E. J\u00f8rgensen Y.M. Svirezhev Towards a Thermodynamic Theory for Ecological Systems 2004 Elsevier Amsterdam 366 p. Medlyn et al., 2002 B.E. Medlyn E. Dreyer D. Ellsworth M. Forstreuter P.C. Harley M.U.F. Kirschbaum X. Le Roux P. Montpied J. Strassemeyer A. Walcroft K. Wang D. Loustau Temperature response of parameters of a biochemically based model of photosynthesis. II. A review of experimental data Plant Cell Environ. 25 2002 1167 1179 Svirezhev and von Bloh, 1997 Y.M. Svirezhev W. von Bloh Climate, vegetation, and global carbon cycle: the simplest zero-dimensional model Ecol. Model. 101 1997 79 95 Vitale et al., 2003 M. Vitale M. Scimone E. Feoli F. Manes Modelling leaf gas exchanges to predict functional trends in Mediterranean Quercus ilex forest under climatic changes in temperature Ecol. Model. 166 2003 123 134", "scopus-id": "37849186644", "coredata": {"eid": "1-s2.0-S0304380006003371", "dc:description": "Abstract We suggests that temperature response of plant productivity can be modeled by the Arrhenius function modified to describe the effect of temperature on enzyme activity: G A(T)=2f(T)/(1+ f 2(T)), where f(T)=exp(E a/RT opt \u2212 E a/RT), R the universal gas constant, E a the activation energy and T opt is the optimal temperature. In common with other functions used for modeling the temperature response of plant productivity, the curve of function G is almost symmetrical and bell-shaped. The special convenience of G A is that it relates the width of the \u201cbell\u201d to thermodynamic concepts, such as activation energy of chemical reactions converting carbon dioxide and water to carbohydrates.", "openArchiveArticle": "false", "prism:coverDate": "2007-01-10", "openaccessUserLicense": null, "prism:aggregationType": "Journal", "prism:url": "https://api.elsevier.com/content/article/pii/S0304380006003371", "dc:creator": [{"@_fa": "true", "$": "Alexandrov, Georgii A."}, {"@_fa": "true", "$": "Yamagata, Yoshiki"}], "link": [{"@_fa": "true", "@rel": "self", "@href": "https://api.elsevier.com/content/article/pii/S0304380006003371"}, {"@_fa": "true", "@rel": "scidir", "@href": "https://www.sciencedirect.com/science/article/pii/S0304380006003371"}], "dc:format": "application/json", "openaccessType": null, "pii": "S0304-3800(06)00337-1", "prism:volume": "200", "prism:publisher": "Elsevier B.V.", "dc:title": "A peaked function for modeling temperature dependence of plant productivity", "prism:copyright": "Copyright \u00a9 2006 Elsevier B.V. All rights reserved.", "openaccess": "0", "prism:issn": "03043800", "prism:issueIdentifier": "1-2", "dcterms:subject": [{"@_fa": "true", "$": "Plant response to environment"}, {"@_fa": "true", "$": "Photosynthesis"}, {"@_fa": "true", "$": "Temperature response"}, {"@_fa": "true", "$": "Arrhenius function"}, {"@_fa": "true", "$": "Calibration"}], "openaccessArticle": "false", "prism:publicationName": "Ecological Modelling", "prism:number": "1-2", "openaccessSponsorType": null, "prism:pageRange": "189-192", "prism:endingPage": "192", "prism:coverDisplayDate": "10 January 2007", "prism:doi": "10.1016/j.ecolmodel.2006.07.012", "prism:startingPage": "189", "dc:identifier": "doi:10.1016/j.ecolmodel.2006.07.012", "openaccessSponsorName": null}, "objects": {"object": [{"@category": "thumbnail", "@height": "49", "@width": "382", "@_fa": "true", "$": "https://api.elsevier.com/content/object/eid/1-s2.0-S0304380006003371-si22.gif?httpAccept=%2A%2F%2A", "@multimediatype": "GIF image file", "@type": "ALTIMG", "@size": "1364", "@ref": "si22", "@mimetype": "image/gif"}, {"@category": "thumbnail", "@height": "49", "@width": "378", "@_fa": "true", "$": "https://api.elsevier.com/content/object/eid/1-s2.0-S0304380006003371-si21.gif?httpAccept=%2A%2F%2A", "@multimediatype": "GIF image file", "@type": "ALTIMG", "@size": "1523", "@ref": "si21", "@mimetype": "image/gif"}, {"@category": "thumbnail", "@height": "40", "@width": "177", "@_fa": "true", "$": "https://api.elsevier.com/content/object/eid/1-s2.0-S0304380006003371-si9.gif?httpAccept=%2A%2F%2A", "@multimediatype": "GIF image file", "@type": "ALTIMG", "@size": "961", "@ref": "si9", "@mimetype": "image/gif"}, {"@category": "thumbnail", "@height": "40", "@width": "451", "@_fa": "true", "$": "https://api.elsevier.com/content/object/eid/1-s2.0-S0304380006003371-si8.gif?httpAccept=%2A%2F%2A", "@multimediatype": "GIF image file", "@type": "ALTIMG", "@size": "2002", "@ref": "si8", "@mimetype": "image/gif"}, {"@category": "thumbnail", "@height": "36", "@width": "53", "@_fa": "true", "$": "https://api.elsevier.com/content/object/eid/1-s2.0-S0304380006003371-si7.gif?httpAccept=%2A%2F%2A", "@multimediatype": "GIF image file", "@type": "ALTIMG", "@size": "356", "@ref": "si7", "@mimetype": "image/gif"}, {"@category": "thumbnail", "@height": "37", "@width": "237", "@_fa": "true", "$": "https://api.elsevier.com/content/object/eid/1-s2.0-S0304380006003371-si6.gif?httpAccept=%2A%2F%2A", "@multimediatype": "GIF image file", "@type": "ALTIMG", "@size": "979", "@ref": "si6", "@mimetype": "image/gif"}, {"@category": "thumbnail", "@height": "39", "@width": "329", "@_fa": "true", "$": "https://api.elsevier.com/content/object/eid/1-s2.0-S0304380006003371-si5.gif?httpAccept=%2A%2F%2A", "@multimediatype": "GIF image file", "@type": "ALTIMG", "@size": "1903", "@ref": "si5", "@mimetype": "image/gif"}, {"@category": "thumbnail", "@height": "39", "@width": "253", "@_fa": "true", "$": "https://api.elsevier.com/content/object/eid/1-s2.0-S0304380006003371-si4.gif?httpAccept=%2A%2F%2A", "@multimediatype": "GIF image file", "@type": "ALTIMG", "@size": "1146", "@ref": "si4", "@mimetype": "image/gif"}, {"@category": "thumbnail", "@height": "90", "@width": "350", "@_fa": "true", "$": "https://api.elsevier.com/content/object/eid/1-s2.0-S0304380006003371-si3.gif?httpAccept=%2A%2F%2A", "@multimediatype": "GIF image file", "@type": "ALTIMG", "@size": "2716", "@ref": "si3", "@mimetype": "image/gif"}, {"@category": "thumbnail", "@height": "37", "@width": "85", "@_fa": "true", "$": "https://api.elsevier.com/content/object/eid/1-s2.0-S0304380006003371-si24.gif?httpAccept=%2A%2F%2A", "@multimediatype": "GIF image file", "@type": "ALTIMG", "@size": "520", "@ref": "si24", "@mimetype": "image/gif"}, {"@category": "thumbnail", "@height": "17", "@width": "117", "@_fa": "true", "$": "https://api.elsevier.com/content/object/eid/1-s2.0-S0304380006003371-si23.gif?httpAccept=%2A%2F%2A", "@multimediatype": "GIF image file", "@type": "ALTIMG", "@size": "466", "@ref": "si23", "@mimetype": "image/gif"}, {"@category": "thumbnail", "@height": "59", "@width": "308", "@_fa": "true", "$": "https://api.elsevier.com/content/object/eid/1-s2.0-S0304380006003371-si20.gif?httpAccept=%2A%2F%2A", "@multimediatype": "GIF image file", "@type": "ALTIMG", "@size": "1504", "@ref": "si20", "@mimetype": "image/gif"}, {"@category": "thumbnail", "@height": "40", "@width": "116", "@_fa": "true", "$": "https://api.elsevier.com/content/object/eid/1-s2.0-S0304380006003371-si2.gif?httpAccept=%2A%2F%2A", "@multimediatype": "GIF image file", "@type": "ALTIMG", "@size": "730", "@ref": "si2", "@mimetype": "image/gif"}, {"@category": "thumbnail", "@height": "16", "@width": "112", "@_fa": "true", "$": "https://api.elsevier.com/content/object/eid/1-s2.0-S0304380006003371-si19.gif?httpAccept=%2A%2F%2A", "@multimediatype": "GIF image file", "@type": "ALTIMG", "@size": "435", "@ref": "si19", "@mimetype": "image/gif"}, {"@category": "thumbnail", "@height": "16", "@width": "38", "@_fa": "true", "$": "https://api.elsevier.com/content/object/eid/1-s2.0-S0304380006003371-si18.gif?httpAccept=%2A%2F%2A", "@multimediatype": "GIF image file", "@type": "ALTIMG", "@size": "230", "@ref": "si18", "@mimetype": "image/gif"}, {"@category": "thumbnail", "@height": "14", "@width": "52", "@_fa": "true", "$": "https://api.elsevier.com/content/object/eid/1-s2.0-S0304380006003371-si17.gif?httpAccept=%2A%2F%2A", "@multimediatype": "GIF image file", "@type": "ALTIMG", "@size": "279", "@ref": "si17", "@mimetype": "image/gif"}, {"@category": "thumbnail", "@height": "59", "@width": "312", "@_fa": "true", "$": "https://api.elsevier.com/content/object/eid/1-s2.0-S0304380006003371-si16.gif?httpAccept=%2A%2F%2A", "@multimediatype": "GIF image file", "@type": "ALTIMG", "@size": "1562", "@ref": "si16", "@mimetype": "image/gif"}, {"@category": "thumbnail", "@height": "39", "@width": "406", "@_fa": "true", "$": "https://api.elsevier.com/content/object/eid/1-s2.0-S0304380006003371-si15.gif?httpAccept=%2A%2F%2A", "@multimediatype": "GIF image file", "@type": "ALTIMG", "@size": "1780", "@ref": "si15", "@mimetype": "image/gif"}, {"@category": "thumbnail", "@height": "14", "@width": "52", "@_fa": "true", "$": "https://api.elsevier.com/content/object/eid/1-s2.0-S0304380006003371-si14.gif?httpAccept=%2A%2F%2A", "@multimediatype": "GIF image file", "@type": "ALTIMG", "@size": "255", "@ref": "si14", "@mimetype": "image/gif"}, {"@category": "thumbnail", "@height": "14", "@width": "52", "@_fa": "true", "$": "https://api.elsevier.com/content/object/eid/1-s2.0-S0304380006003371-si13.gif?httpAccept=%2A%2F%2A", "@multimediatype": "GIF image file", "@type": "ALTIMG", "@size": "269", "@ref": "si13", "@mimetype": "image/gif"}, {"@category": "thumbnail", "@height": "16", "@width": "147", "@_fa": "true", "$": "https://api.elsevier.com/content/object/eid/1-s2.0-S0304380006003371-si12.gif?httpAccept=%2A%2F%2A", "@multimediatype": "GIF image file", "@type": "ALTIMG", "@size": "563", "@ref": "si12", "@mimetype": "image/gif"}, {"@category": "thumbnail", "@height": "16", "@width": "165", "@_fa": "true", "$": "https://api.elsevier.com/content/object/eid/1-s2.0-S0304380006003371-si11.gif?httpAccept=%2A%2F%2A", "@multimediatype": "GIF image file", "@type": "ALTIMG", "@size": "606", "@ref": "si11", "@mimetype": "image/gif"}, {"@category": "thumbnail", "@height": "16", "@width": "125", "@_fa": "true", "$": "https://api.elsevier.com/content/object/eid/1-s2.0-S0304380006003371-si10.gif?httpAccept=%2A%2F%2A", "@multimediatype": "GIF image file", "@type": "ALTIMG", "@size": "512", "@ref": "si10", "@mimetype": "image/gif"}, {"@category": "thumbnail", "@height": "40", "@width": "137", "@_fa": "true", "$": "https://api.elsevier.com/content/object/eid/1-s2.0-S0304380006003371-si1.gif?httpAccept=%2A%2F%2A", "@multimediatype": "GIF image file", "@type": "ALTIMG", "@size": "739", "@ref": "si1", "@mimetype": "image/gif"}, {"@category": "standard", "@height": "153", "@width": "339", "@_fa": "true", "$": "https://api.elsevier.com/content/object/eid/1-s2.0-S0304380006003371-gr1.jpg?httpAccept=%2A%2F%2A", "@multimediatype": "JPEG image file", "@type": "IMAGE-DOWNSAMPLED", "@size": "21366", "@ref": "gr1", "@mimetype": "image/jpeg"}, {"@category": "thumbnail", "@height": "56", "@width": "125", "@_fa": "true", "$": "https://api.elsevier.com/content/object/eid/1-s2.0-S0304380006003371-gr1.sml?httpAccept=%2A%2F%2A", "@multimediatype": "GIF image file", "@type": "IMAGE-THUMBNAIL", "@size": "2298", "@ref": "gr1", "@mimetype": "image/gif"}, {"@category": "standard", "@height": "231", "@width": "329", "@_fa": "true", "$": "https://api.elsevier.com/content/object/eid/1-s2.0-S0304380006003371-gr2.jpg?httpAccept=%2A%2F%2A", "@multimediatype": "JPEG image file", "@type": "IMAGE-DOWNSAMPLED", "@size": "34518", "@ref": "gr2", "@mimetype": "image/jpeg"}, {"@category": "thumbnail", "@height": "88", "@width": "125", "@_fa": "true", "$": "https://api.elsevier.com/content/object/eid/1-s2.0-S0304380006003371-gr2.sml?httpAccept=%2A%2F%2A", "@multimediatype": "GIF image file", "@type": "IMAGE-THUMBNAIL", "@size": "2948", "@ref": "gr2", "@mimetype": "image/gif"}, {"@category": "standard", "@height": "218", "@width": "327", "@_fa": "true", "$": "https://api.elsevier.com/content/object/eid/1-s2.0-S0304380006003371-gr3.jpg?httpAccept=%2A%2F%2A", "@multimediatype": "JPEG image file", "@type": "IMAGE-DOWNSAMPLED", "@size": "32575", "@ref": "gr3", "@mimetype": "image/jpeg"}, {"@category": "thumbnail", "@height": "83", "@width": "125", "@_fa": "true", "$": "https://api.elsevier.com/content/object/eid/1-s2.0-S0304380006003371-gr3.sml?httpAccept=%2A%2F%2A", "@multimediatype": "GIF image file", "@type": "IMAGE-THUMBNAIL", "@size": "3035", "@ref": "gr3", "@mimetype": "image/gif"}]}, "link": {"@rel": "abstract", "@href": "https://api.elsevier.com/content/abstract/scopus_id/37849186644"}}