{"originalText": "serial JL 271743 291210 291728 291780 291840 31 Ecological Modelling ECOLOGICALMODELLING 2003-10-21 2003-10-21 2016-06-14T09:57:22 1-s2.0-0304380095900454 0304-3800(95)90045-4 0304380095900454 10.1016/0304-3800(95)90045-4 S350 S350.1 CONTENTS-ENTRY-ONLY 1-s2.0-S0304380000X00154 2016-06-14T09:46:27.275559-04:00 0 0 19950701 19950731 1995 2003-10-21T00:00:00Z rawtext articleinfo articletitlenorm cid cids contenttype copyright crossmark dateloaded dateloadedtxt datesearch datesort dateupdated dco docsubtype doctype doi eid ewtransactionid hubeid indexeddate issfirst issn issnnorm issuelist itemstage itemtransactionid itemweight openaccess openarchive pg pgfirst pii piinorm pubdateend pubdatestart pubdatetxt pubyr sortorder srctitle srctitlenorm srctype ssids alllist content subj tomb volfirst volissue volumelist webpdf webpdfpagecount yearnav articletitle 0304-3800 03043800 false 80 80 2 3 2 3 Volume 80, Issues 2\u20133 19 304 304 199507 July 1995 1995-07-01 1995-07-31 1995 converted-article mis Copyright \u00a9 1995 Published by Elsevier B.V. All rights reserved. AUTHORINDEX item 0304-3800(95)90045-4 0304380095900454 1-s2.0-0304380095900454 10.1016/0304-3800(95)90045-4 271743 2016-06-14T09:46:27.275559-04:00 1995-07-01 1995-07-31 1-s2.0-0304380095900454-main.pdf https://s3-eu-west-1.amazonaws.com/prod-ucs-content-store-eu-west/content/pii:0304380095900454/MAIN/application/pdf/d3effc51e9f2c10ed3b1e12648e20863/main.pdf https://s3.amazonaws.com/prod-ucs-content-store-us-east/content/pii:0304380095900454/MAIN/application/pdf/d3effc51e9f2c10ed3b1e12648e20863/main.pdf main.pdf pdf true 28003 MAIN 1 1-s2.0-0304380095900454-main_1.png https://s3-eu-west-1.amazonaws.com/prod-ucs-content-store-eu-west/content/pii:0304380095900454/PREVIEW/image/png/b59d63b614fed6feba3c89fcc7f5e9ef/main_1.png https://s3.amazonaws.com/prod-ucs-content-store-us-east/content/pii:0304380095900454/PREVIEW/image/png/b59d63b614fed6feba3c89fcc7f5e9ef/main_1.png main_1.png png 24333 849 656 IMAGE-WEB-PDF 1 ELSEVIER Ecological Modelling 80 (1995) 304 E(OLO61(RL mODELLIn6 Author Index Baveco, J.M. 161 Chapelle, A. 131 Coquillard, P. 97 DeAngelis, D.L. 149, 161 Dejak, C. 69 Forsythe, W.C. 87 Franco, D. 69 Gersev, V.I. 41 Gerseva, V.V. 41 Heard, S.B. 57 Kalabokidis, K.D. 47 Karjalainen, T. 113 Kellom~tki, S. 237 Kendal, W.S. 293 Kleinhenz, B. 197 Loreau, M. 149 Marzolf, E.R. 149 Massman, W.J. 205 McClanahan, T.R. 1, 21 Miao, S. 187 Mulho|land, P.J. 149 Neergaard, D. 149 Nikolov, N.T. 205 Omi, P.N. 47 Pastres, R. 69 Pecenik, G. 69 Piepho, H.-P. 251 Power, G. 171 Power, M. 171 Ramo, M.P. 113 Rokem, J.S. 257 Rose, K.A. 161 Rykiel Jr., E.J. 87 Safronov, A.M. 41 Scheffer, M. 161 Schoettle, A.W. 205 Schoolfield, R.M. 87 Selhorst, Th. 27, 197 ~engonca, (~. 197 Solidoro, C. 69 Spivak, I.R. 257 Stahl, R.S. 87 Strandman, H. 237 Stiibing-Martinez, G. 113 Tu, S. 187 Us6-Domenech, J.L. 113 Van Nes, E.H. 161 Villacampa-Esteve, Y. 113 Wang, J. 279 Webb, J.N. 35 Wu, H.-i. 87 ECOMOD 95900454 0304-3800(95)90045-4 10.1016/0304-3800(95)90045-4 Author index", "coredata": {"eid": "1-s2.0-0304380095900454", "dc:description": null, "openArchiveArticle": "false", "prism:coverDate": "1995-07-31", "openaccessUserLicense": null, "prism:aggregationType": "Journal", "prism:url": "https://api.elsevier.com/content/article/pii/0304380095900454", "link": [{"@_fa": "true", "@rel": "self", "@href": "https://api.elsevier.com/content/article/pii/0304380095900454"}, {"@_fa": "true", "@rel": "scidir", "@href": "https://www.sciencedirect.com/science/article/pii/0304380095900454"}], "dc:format": "application/json", "openaccessType": null, "pii": "0304-3800(95)90045-4", "prism:volume": "80", "prism:publisher": "Published by Elsevier B.V.", "dc:title": "Author index", "prism:copyright": "Copyright \u00a9 1995 Published by Elsevier B.V. All rights reserved.", "openaccess": "0", "prism:issn": "03043800", "prism:issueIdentifier": "2-3", "openaccessArticle": "false", "prism:publicationName": "Ecological Modelling", "prism:number": "2-3", "openaccessSponsorType": null, "prism:pageRange": "304", "prism:coverDisplayDate": "July 1995", "prism:doi": "10.1016/0304-3800(95)90045-4", "prism:startingPage": "304", "dc:identifier": "doi:10.1016/0304-3800(95)90045-4", "openaccessSponsorName": null}}