{"originalText": "serial JL 271743 291210 291728 291780 291840 31 Ecological Modelling ECOLOGICALMODELLING 2003-10-21 2003-10-21 2016-06-14T09:57:22 1-s2.0-0304380095900462 0304-3800(95)90046-2 0304380095900462 10.1016/0304-3800(95)90046-2 S350 S350.1 CONTENTS-ENTRY-ONLY 1-s2.0-S0304380000X00154 2016-06-14T09:46:27.23684-04:00 0 0 19950701 19950731 1995 2003-10-21T00:00:00Z rawtext articleinfo articletitlenorm cid cids contenttype copyright crossmark dateloaded dateloadedtxt datesearch datesort dateupdated dco docsubtype doctype doi eid ewtransactionid hubeid indexeddate issfirst issn issnnorm issuelist itemstage itemtransactionid itemweight openaccess openarchive pg pgfirst pglast pii piinorm pubdateend pubdatestart pubdatetxt pubyr sortorder srctitle srctitlenorm srctype ssids alllist content subj tomb volfirst volissue volumelist webpdf webpdfpagecount yearnav articletitle 0304-3800 03043800 false 80 80 2 3 2 3 Volume 80, Issues 2\u20133 20 305 306 305 306 199507 July 1995 1995-07-01 1995-07-31 1995 converted-article mis Copyright \u00a9 1995 Published by Elsevier B.V. All rights reserved. CONTENTSVOL80 item 0304-3800(95)90046-2 0304380095900462 1-s2.0-0304380095900462 10.1016/0304-3800(95)90046-2 271743 2016-06-14T09:46:27.23684-04:00 1995-07-01 1995-07-31 1-s2.0-0304380095900462-main.pdf https://s3-eu-west-1.amazonaws.com/prod-ucs-content-store-eu-west/content/pii:0304380095900462/MAIN/application/pdf/f88e30fee9ef75ac464aaa87b8ab8844/main.pdf https://s3.amazonaws.com/prod-ucs-content-store-us-east/content/pii:0304380095900462/MAIN/application/pdf/f88e30fee9ef75ac464aaa87b8ab8844/main.pdf main.pdf pdf true 94539 MAIN 2 1-s2.0-0304380095900462-main_1.png https://s3-eu-west-1.amazonaws.com/prod-ucs-content-store-eu-west/content/pii:0304380095900462/PREVIEW/image/png/238eea4a09677aa7b140cf7fa781c989/main_1.png https://s3.amazonaws.com/prod-ucs-content-store-us-east/content/pii:0304380095900462/PREVIEW/image/png/238eea4a09677aa7b140cf7fa781c989/main_1.png main_1.png png 55628 849 656 IMAGE-WEB-PDF 1 ELSEVIER Ecological Modelling 80 (1995) 305-306 E(OLOGI(DL mODELLInG Contents of Ecological Modelling, Vol. 80 VOL. 80 NO. 1 JUNE 1995 A coral reef ecosystem-fisheries model: impacts of fishing intensity and catch selection on reef structure and processes T.R. McClanahan (Gainesville, FL, USA; Mombasa, Kenya) ............................... 1 Harvesting in an uncertain world: impact of resource competition on harvesting dynamics T.R. McClanahan (Mombasa, Kenya) .............................................. 21 Modelling the temperature effect on bimodally distributed life times Th. Selhorst (Bonn, Germany) .................................................. 27 Hamilton's variational principle and ecological models J.N. Webb (Suffolk, UK) ...................................................... 35 Population as a freely oscillating system V.I. Gersev, A.M. Safronov and V.V. Gerseva (Rybinsk, Russian Federation) .................... 41 Isarithmic analysis of forest fire fuelbed arrays K.D. Kalabokidis and P.N. Omi (Fort Collins, CO, USA) ................................. 47 Short-term dynamics of processing chain systems S.B. Heard (Philadelphia, PA, USA) .............................................. 57 Using parallel computers in environmental modelling: a working example R. Pastres, D. Franco, G. Pecenik, C. Solidoro and C. Dejak (Venice, Italy) ..................... 69 A model comparison for daylength as a function of latitude and day of year W.C. Forsythe, E.J. Rykiel Jr., R.S. Stahl, H.-i. Wu (College Station, TX, USA) and R.M. Schoolfield (Austin, TX, USA) .......................................................... 87 VOL. 80 NOS. 2-3 JULY 1995 Simulation of the cyclical process of heathlands: induction of mosaic structures, evolution to irreversible states P. Coquillard (Clermont-Ferrand, France) ........................................... 97 MARIOLA: a model for calculating the response of mediterranean bush ecosystem to climatic variations J.L. Us6-Domenech (Castell6n, Spain), Y. Villacampa-Esteve (Alicante, Spain), G. Stiibing-Martinez (Valencia, Spain), T. Karjalainen (Joensuu, Finland) and M.P. Ramo (Castell6n, Spain) ............. 113 A preliminary model of nutrient cycling in sediments of a Mediterranean lagoon A. Chapelle (Plouzan6, France) .................................................. 131 Modelling nutrient-periphyton dynamics in streams: the importance of transient storage zones D.L. DeAngelis (Oak Ridge, USA), M. Loreau (Brussels, Belgium), D. Neergaard (Knoxville, USA), P.J. Mulholland (Oak Ridge, USA) and E.R. Marzolf (Oak Ridge, USA) .......................... 149 Super-individuals a simple solution for modelling large populations on an individual basis M. Scheffer (Lelystad, Netherlands), J.M. Baveco (Amsterdam, Netherlands), D.L. DeAngelis, K.A. Rose (Oak Ridge, USA) and E.H. Van Nes (Lelystad, Netherlands) .............................. 161 A modelling framework for analyzing anthropogenic stresses on brook trout (Salvelinus fontinalis) populations M. Power (Winnipeg, Canada) and G. Power (Waterloo, Canada) ............................ 171 306 Contents of Ecological Modelling, Vol. 80 Modeling thermal effect on growth of chinese shrimp, Penaeus chinensis (Osbeck) S. Miao and S. Tu (Keelung, Taiwan, ROC) .......................................... 187 Modelling the effect of temperature on the longevity of the grain aphid, Sitobion avenae (F.) (Horn., Aphididae) Th. Selhorst, B. Kleinhenz and ~. ~engonca (Bonn, Germany) .............................. 197 Coupling biochemical and biophysical processes at the leaf level: an equilibrium photosynthesis model for leaves of C3 plants N.T. Nikolov, W.J. Massman and A.W. Schoettle (Fort Collins, CO, USA) ...................... 205 A model for the structural growth of young Scots pine crowns based on light interception by shoots S. Kellom[iki and H. Strandman (Joensuu, Finland) ..................................... 237 Implications of a simple competition model for the stability of an intercropping system H.-P. Piepho (Witzenhausen, Germany) ............................................ 251 Analyses of possible steady states for mixed culture grown on natural gas I.R. Spivak and J.S. Rokem (Jerusalem, Israel) ........................................ 257 The models of niche and their application J. Wang (Utrecht, Netherlands) .................................................. 279 A probabilistic model for the variance to mean power law in ecology W.S. Kendal (Toronto, Ont., Canada) .............................................. 293 Book Reviews ............................................................... 299 Keyword Index .............................................................. 303 Author Index ............................................................... 304 Contents of Ecological Modelling, Volume 80 ........................................... 305 B. Heard (Philadelphia, PA, USA) .............................................. 57 Using parallel computers in environmental modelling: a working example R. Pastres, D. Franco, G. Pecenik, C. Solidoro and C. Dejak (Venice, Italy) ..................... 69 A model comparison for daylength as a function of latitude and day of year W.C. Forsythe, E.J. Rykiel Jr., R.S. Stahl, H.-i. Wu (College Station, TX, USA) and R.M. Schoolfield (Austin, TX, USA) .......................................................... 87 VOL. 80 NOS. 2-3 JULY 1995 Simulation of the cyclical process of heathlands: induction of mosaic structures, evolution to irreversible states P. Coquillard (Clermont-Ferrand, France) ........................................... 97 MARIOLA: a model for calculating the response of mediterranean bush ecosystem to climatic variations J.L. Us6-Domenech (Castell6n, Spain), Y. Villacampa-Esteve (Alicante, Spain), G. Stiibing-Martinez (Valencia, Spain), T. Karjalainen (Joensuu, Finland) and M.P. Ramo (Castell6n, Spain) ............. 113 A preliminary model of nutrient cycling in sediments of a Mediterranean lagoon A. Chapelle (Plouzan6, France) .................................................. 131 Modelling nutrient-periphyton dynamics in streams: the importance of transient storage zones D.L. DeAngelis (Oak Ridge, USA), M. Loreau (Brussels, Belgium), D. Neergaard (Knoxville, USA), P.J. Mulholland (Oak Ridge, USA) and E.R. Marzolf (Oak Ridge, USA) .......................... 149 Super-individuals a simple solution for modelling large populations on an individual basis M. Scheffer (Lelystad, Netherlands), J.M. Baveco (Amsterdam, Netherlands), D.L. DeAngelis, K.A. Rose (Oak Ridge, USA) and E.H. Van Nes (Lelystad, Netherlands) .............................. 161 A modelling framework for analyzing anthropogenic stresses on brook trout (Salvelinus fontinalis) populations M. Power (Winnipeg, Canada) and G. Power (Waterloo, Canada) ............................ 171 306 Contents of Ecological Modelling, Vol. 80 Modeling thermal effect on growth of chinese shrimp, Penaeus chinensis (Osbeck) S. Miao and S. Tu (Keelung, Taiwan, ROC) .......................................... 187 Modelling the effect of temperature on the longevity of the grain aphid, Sitobion avenae (F.) (Horn., Aphididae) Th. Selhorst, B. Kleinhenz and ~. ~engonca (Bonn, Germany) .............................. 197 Coupling biochemical and biophysical processes at the ECOMOD 95900462 0304-3800(95)90046-2 10.1016/0304-3800(95)90046-2 Contents of vol. 80", "coredata": {"eid": "1-s2.0-0304380095900462", "dc:description": null, "openArchiveArticle": "false", "prism:coverDate": "1995-07-31", "openaccessUserLicense": null, "prism:aggregationType": "Journal", "prism:url": "https://api.elsevier.com/content/article/pii/0304380095900462", "link": [{"@_fa": "true", "@rel": "self", "@href": "https://api.elsevier.com/content/article/pii/0304380095900462"}, {"@_fa": "true", "@rel": "scidir", "@href": "https://www.sciencedirect.com/science/article/pii/0304380095900462"}], "dc:format": "application/json", "openaccessType": null, "pii": "0304-3800(95)90046-2", "prism:volume": "80", "prism:publisher": "Published by Elsevier B.V.", "dc:title": "Contents of vol. 80", "prism:copyright": "Copyright \u00a9 1995 Published by Elsevier B.V. All rights reserved.", "openaccess": "0", "prism:issn": "03043800", "prism:issueIdentifier": "2-3", "openaccessArticle": "false", "prism:publicationName": "Ecological Modelling", "prism:number": "2-3", "openaccessSponsorType": null, "prism:pageRange": "305-306", "prism:endingPage": "306", "prism:coverDisplayDate": "July 1995", "prism:doi": "10.1016/0304-3800(95)90046-2", "prism:startingPage": "305", "dc:identifier": "doi:10.1016/0304-3800(95)90046-2", "openaccessSponsorName": null}}