{"scopus-eid": "2-s2.0-85012097947", "originalText": "serial JL 271728 291210 291772 291817 31 Transportation Research Part B: Methodological TRANSPORTATIONRESEARCHPARTBMETHODOLOGICAL 2017-02-14 2017-02-14 2017-02-14 2017-02-14 2017-05-12T21:40:58 1-s2.0-S0191261516302648 S0191-2615(16)30264-8 S0191261516302648 10.1016/j.trb.2017.01.016 S300 S300.1 FULL-TEXT 1-s2.0-S0191261517X00039 2017-05-12T18:41:30.443932-04:00 0 0 20170601 20170630 2017 2017-02-14T03:12:05.633498Z articleinfo articletitlenorm authfirstinitialnorm authfirstsurnamenorm cid cids contenttype copyright crossmark dateloaded dateloadedtxt datesearch datesort dateupdated dco docsubtype doctype doi eid ewtransactionid hubeid indexeddate issn issnnorm itemstage itemtransactionid itemweight openaccess openarchive pg pgfirst pglast pii piinorm pubdateend pubdatestart pubdatetxt pubyr sortorder srctitle srctitlenorm srctype ssids alllist content subj subheadings suppl tomb volfirst volissue volumelist webpdf webpdfpagecount yearnav figure table body mmlmath affil articletitle auth authfirstini authfull authlast footnotes highlightsabst primabst ref 0191-2615 01912615 true 100 100 C Volume 100 6 82 92 82 92 201706 June 2017 2017-06-01 2017-06-30 2017 article fla \u00a9 2017 Elsevier Ltd. All rights reserved. OFFSETOPTIMIZATIONINSIGNALIZEDTRAFFICNETWORKSVIASEMIDEFINITERELAXATION COOGAN S 1 Introduction 2 Preliminaries 3 Problem formulation 4 Sinusoidal approximation of arrivals, departures, and queues 4.1 Entry links 4.2 Non-entry links 4.3 Queueing process 4.4 Performance metric 5 Optimizing traffic signal offsets 5.1 Offset optimization problem and a convex relaxation 6 Case studies 6.1 Grid network 6.2 Arterial corridor in Arcadia, California 7 Conclusions References ALLSOP 1968 1 13 R ALLSOP 1971 164 185 R ANDERSEN 2015 M CVXOPTAPYTHONPACKAGEFORCONVEXOPTIMIZATION BOYD 2011 1 122 S COOGAN 2015 2187 2192 S IEEECONFERENCEDECISIONCONTROL OFFSETOPTIMIZATIONFORANETWORKSIGNALIZEDINTERSECTIONSVIASEMIDEFINITERELAXATION GARTNER 1975 58 69 N GARTNER 2002 657 671 N GARTNER 2004 77 86 N GARTNER 2009 345 364 N TRANSPORTATIONTRAFFICTHEORY2009GOLDENJUBILEE HARMONICANALYSISOPTIMIZATIONTRAFFICSIGNALSYSTEMS GARTNER 1975 321 343 N GOMES 2015 1977 1988 G KORSAK 1973 225 239 A LITTLE 1981 J LOW 2014 15 27 S LUO 2010 20 34 Z MURALIDHARAN 2016 101 112 A MURALIDHARAN 2015 81 90 A SINGER 2011 20 36 A SO 2007 93 110 A SOJOUDI 2014 1746 1778 S TRAFFICRESEARCHCORPORATION 1966 SIGOPTRAFFICSIGNALOPTIMIZATIONPROGRAMACOMPUTERPROGRAMCALCULATEOPTIMUMCOORDINATIONINAGRIDNETWORKSYNCHRONIZEDTRAFFICSIGNALS VARAIYA 2013 27 66 P ADVANCESINDYNAMICNETWORKMODELINGINCOMPLEXTRANSPORTATIONSYSTEMS MAXPRESSURECONTROLLERFORARBITRARYNETWORKSSIGNALIZEDINTERSECTIONS WONG 1995 303 327 S WONG 1996 217 244 S COOGANX2017X82 COOGANX2017X82X92 COOGANX2017X82XS COOGANX2017X82X92XS 2019-02-14T00:00:00.000Z UnderEmbargo http://creativecommons.org/licenses/by-nc-nd/4.0/ \u00a9 2017 Elsevier Ltd. All rights reserved. item S0191-2615(16)30264-8 S0191261516302648 1-s2.0-S0191261516302648 10.1016/j.trb.2017.01.016 271728 2017-05-12T18:41:30.443932-04:00 2017-06-01 2017-06-30 1-s2.0-S0191261516302648-main.pdf https://s3-eu-west-1.amazonaws.com/prod-ucs-content-store-eu-west/content/pii:S0191261516302648/MAIN/application/pdf/8fbee410eab445efffa859d338651549/main.pdf https://s3.amazonaws.com/prod-ucs-content-store-us-east/content/pii:S0191261516302648/MAIN/application/pdf/8fbee410eab445efffa859d338651549/main.pdf main.pdf pdf true 753415 MAIN 11 1-s2.0-S0191261516302648-main_1.png https://s3-eu-west-1.amazonaws.com/prod-ucs-content-store-eu-west/content/pii:S0191261516302648/PREVIEW/image/png/0f017a9d58c11ab694a8b837dffe7a7b/main_1.png https://s3.amazonaws.com/prod-ucs-content-store-us-east/content/pii:S0191261516302648/PREVIEW/image/png/0f017a9d58c11ab694a8b837dffe7a7b/main_1.png main_1.png png 47819 849 656 IMAGE-WEB-PDF 1 1-s2.0-S0191261516302648-gr1.sml https://s3-eu-west-1.amazonaws.com/prod-ucs-content-store-eu-west/content/pii:S0191261516302648/gr1/THUMBNAIL/image/gif/95c37770a2562fb9f01f7c21b9a3a93a/gr1.sml https://s3.amazonaws.com/prod-ucs-content-store-us-east/content/pii:S0191261516302648/gr1/THUMBNAIL/image/gif/95c37770a2562fb9f01f7c21b9a3a93a/gr1.sml gr1 gr1.sml sml 7244 134 219 IMAGE-THUMBNAIL 1-s2.0-S0191261516302648-gr2.sml https://s3-eu-west-1.amazonaws.com/prod-ucs-content-store-eu-west/content/pii:S0191261516302648/gr2/THUMBNAIL/image/gif/02a4dbddb0944987d038b5b9b4d384a9/gr2.sml https://s3.amazonaws.com/prod-ucs-content-store-us-east/content/pii:S0191261516302648/gr2/THUMBNAIL/image/gif/02a4dbddb0944987d038b5b9b4d384a9/gr2.sml gr2 gr2.sml sml 9032 101 219 IMAGE-THUMBNAIL 1-s2.0-S0191261516302648-gr3.sml https://s3-eu-west-1.amazonaws.com/prod-ucs-content-store-eu-west/content/pii:S0191261516302648/gr3/THUMBNAIL/image/gif/22dbe6163f683c2f527954c8fba0f571/gr3.sml https://s3.amazonaws.com/prod-ucs-content-store-us-east/content/pii:S0191261516302648/gr3/THUMBNAIL/image/gif/22dbe6163f683c2f527954c8fba0f571/gr3.sml gr3 gr3.sml sml 6931 140 219 IMAGE-THUMBNAIL 1-s2.0-S0191261516302648-gr4.sml https://s3-eu-west-1.amazonaws.com/prod-ucs-content-store-eu-west/content/pii:S0191261516302648/gr4/THUMBNAIL/image/gif/f32b3120ec087f1d9eedbaa0c2c3447d/gr4.sml https://s3.amazonaws.com/prod-ucs-content-store-us-east/content/pii:S0191261516302648/gr4/THUMBNAIL/image/gif/f32b3120ec087f1d9eedbaa0c2c3447d/gr4.sml gr4 gr4.sml sml 7448 164 164 IMAGE-THUMBNAIL 1-s2.0-S0191261516302648-gr5.sml https://s3-eu-west-1.amazonaws.com/prod-ucs-content-store-eu-west/content/pii:S0191261516302648/gr5/THUMBNAIL/image/gif/09c05b576df278bdf69d45fa0caa4ec8/gr5.sml https://s3.amazonaws.com/prod-ucs-content-store-us-east/content/pii:S0191261516302648/gr5/THUMBNAIL/image/gif/09c05b576df278bdf69d45fa0caa4ec8/gr5.sml gr5 gr5.sml sml 10322 81 219 IMAGE-THUMBNAIL 1-s2.0-S0191261516302648-gr1.jpg https://s3-eu-west-1.amazonaws.com/prod-ucs-content-store-eu-west/content/pii:S0191261516302648/gr1/DOWNSAMPLED/image/jpeg/6b4236dffe5bd1d9ac3eee62cb090d47/gr1.jpg https://s3.amazonaws.com/prod-ucs-content-store-us-east/content/pii:S0191261516302648/gr1/DOWNSAMPLED/image/jpeg/6b4236dffe5bd1d9ac3eee62cb090d47/gr1.jpg gr1 gr1.jpg jpg 11819 150 244 IMAGE-DOWNSAMPLED 1-s2.0-S0191261516302648-gr2.jpg https://s3-eu-west-1.amazonaws.com/prod-ucs-content-store-eu-west/content/pii:S0191261516302648/gr2/DOWNSAMPLED/image/jpeg/ea3adb8c49125b3b3ed00dc0835bd26e/gr2.jpg https://s3.amazonaws.com/prod-ucs-content-store-us-east/content/pii:S0191261516302648/gr2/DOWNSAMPLED/image/jpeg/ea3adb8c49125b3b3ed00dc0835bd26e/gr2.jpg gr2 gr2.jpg jpg 51510 302 654 IMAGE-DOWNSAMPLED 1-s2.0-S0191261516302648-gr3.jpg https://s3-eu-west-1.amazonaws.com/prod-ucs-content-store-eu-west/content/pii:S0191261516302648/gr3/DOWNSAMPLED/image/jpeg/cabc0928baca6fab06baf7de7c6347a0/gr3.jpg https://s3.amazonaws.com/prod-ucs-content-store-us-east/content/pii:S0191261516302648/gr3/DOWNSAMPLED/image/jpeg/cabc0928baca6fab06baf7de7c6347a0/gr3.jpg gr3 gr3.jpg jpg 19830 240 375 IMAGE-DOWNSAMPLED 1-s2.0-S0191261516302648-gr4.jpg https://s3-eu-west-1.amazonaws.com/prod-ucs-content-store-eu-west/content/pii:S0191261516302648/gr4/DOWNSAMPLED/image/jpeg/dd9c89776b9d7aa1f223c5794869d5e9/gr4.jpg https://s3.amazonaws.com/prod-ucs-content-store-us-east/content/pii:S0191261516302648/gr4/DOWNSAMPLED/image/jpeg/dd9c89776b9d7aa1f223c5794869d5e9/gr4.jpg gr4 gr4.jpg jpg 19976 280 280 IMAGE-DOWNSAMPLED 1-s2.0-S0191261516302648-gr5.jpg https://s3-eu-west-1.amazonaws.com/prod-ucs-content-store-eu-west/content/pii:S0191261516302648/gr5/DOWNSAMPLED/image/jpeg/f363f7522bd862695107c0ce4adc724b/gr5.jpg https://s3.amazonaws.com/prod-ucs-content-store-us-east/content/pii:S0191261516302648/gr5/DOWNSAMPLED/image/jpeg/f363f7522bd862695107c0ce4adc724b/gr5.jpg gr5 gr5.jpg jpg 30193 208 563 IMAGE-DOWNSAMPLED 1-s2.0-S0191261516302648-gr1_lrg.jpg https://s3-eu-west-1.amazonaws.com/prod-ucs-content-store-eu-west/content/pii:S0191261516302648/gr1/HIGHRES/image/jpeg/d3e0dfec602ddf1f125368011557fd5b/gr1_lrg.jpg https://s3.amazonaws.com/prod-ucs-content-store-us-east/content/pii:S0191261516302648/gr1/HIGHRES/image/jpeg/d3e0dfec602ddf1f125368011557fd5b/gr1_lrg.jpg gr1 gr1_lrg.jpg jpg 54302 662 1080 IMAGE-HIGH-RES 1-s2.0-S0191261516302648-gr2_lrg.jpg https://s3-eu-west-1.amazonaws.com/prod-ucs-content-store-eu-west/content/pii:S0191261516302648/gr2/HIGHRES/image/jpeg/eeaa57c80f2b309800ffd8e5afd9ef5d/gr2_lrg.jpg https://s3.amazonaws.com/prod-ucs-content-store-us-east/content/pii:S0191261516302648/gr2/HIGHRES/image/jpeg/eeaa57c80f2b309800ffd8e5afd9ef5d/gr2_lrg.jpg gr2 gr2_lrg.jpg jpg 360122 1338 2897 IMAGE-HIGH-RES 1-s2.0-S0191261516302648-gr3_lrg.jpg https://s3-eu-west-1.amazonaws.com/prod-ucs-content-store-eu-west/content/pii:S0191261516302648/gr3/HIGHRES/image/jpeg/d1c3b57c67fec4d49b5928ef08ac3002/gr3_lrg.jpg https://s3.amazonaws.com/prod-ucs-content-store-us-east/content/pii:S0191261516302648/gr3/HIGHRES/image/jpeg/d1c3b57c67fec4d49b5928ef08ac3002/gr3_lrg.jpg gr3 gr3_lrg.jpg jpg 120895 1063 1661 IMAGE-HIGH-RES 1-s2.0-S0191261516302648-gr4_lrg.jpg https://s3-eu-west-1.amazonaws.com/prod-ucs-content-store-eu-west/content/pii:S0191261516302648/gr4/HIGHRES/image/jpeg/7b748167be47c354739d077aeefc36bd/gr4_lrg.jpg https://s3.amazonaws.com/prod-ucs-content-store-us-east/content/pii:S0191261516302648/gr4/HIGHRES/image/jpeg/7b748167be47c354739d077aeefc36bd/gr4_lrg.jpg gr4 gr4_lrg.jpg jpg 113742 1240 1240 IMAGE-HIGH-RES 1-s2.0-S0191261516302648-gr5_lrg.jpg https://s3-eu-west-1.amazonaws.com/prod-ucs-content-store-eu-west/content/pii:S0191261516302648/gr5/HIGHRES/image/jpeg/0e94d24ae6bcba6a6276cfc593f2d415/gr5_lrg.jpg https://s3.amazonaws.com/prod-ucs-content-store-us-east/content/pii:S0191261516302648/gr5/HIGHRES/image/jpeg/0e94d24ae6bcba6a6276cfc593f2d415/gr5_lrg.jpg gr5 gr5_lrg.jpg jpg 251733 922 2492 IMAGE-HIGH-RES 1-s2.0-S0191261516302648-si10.gif https://s3-eu-west-1.amazonaws.com/prod-ucs-content-store-eu-west/content/pii:S0191261516302648/STRIPIN/image/gif/7f3d4a9e86839356e4fce5e486f87fca/si10.gif https://s3.amazonaws.com/prod-ucs-content-store-us-east/content/pii:S0191261516302648/STRIPIN/image/gif/7f3d4a9e86839356e4fce5e486f87fca/si10.gif si10 si10.gif gif 235 14 45 ALTIMG 1-s2.0-S0191261516302648-si20.gif https://s3-eu-west-1.amazonaws.com/prod-ucs-content-store-eu-west/content/pii:S0191261516302648/STRIPIN/image/gif/b236bed61a73388d54ab06e51c594a1c/si20.gif https://s3.amazonaws.com/prod-ucs-content-store-us-east/content/pii:S0191261516302648/STRIPIN/image/gif/b236bed61a73388d54ab06e51c594a1c/si20.gif si20 si20.gif gif 151 13 14 ALTIMG 1-s2.0-S0191261516302648-si30.gif https://s3-eu-west-1.amazonaws.com/prod-ucs-content-store-eu-west/content/pii:S0191261516302648/STRIPIN/image/gif/8f6dd7c83261d8f811ef46a2db6186df/si30.gif https://s3.amazonaws.com/prod-ucs-content-store-us-east/content/pii:S0191261516302648/STRIPIN/image/gif/8f6dd7c83261d8f811ef46a2db6186df/si30.gif si30 si30.gif gif 400 13 114 ALTIMG 1-s2.0-S0191261516302648-si40.gif https://s3-eu-west-1.amazonaws.com/prod-ucs-content-store-eu-west/content/pii:S0191261516302648/STRIPIN/image/gif/b5fa2118486e73340af89b1dd9c3e12f/si40.gif https://s3.amazonaws.com/prod-ucs-content-store-us-east/content/pii:S0191261516302648/STRIPIN/image/gif/b5fa2118486e73340af89b1dd9c3e12f/si40.gif si40 si40.gif gif 233 16 58 ALTIMG 1-s2.0-S0191261516302648-si60.gif https://s3-eu-west-1.amazonaws.com/prod-ucs-content-store-eu-west/content/pii:S0191261516302648/STRIPIN/image/gif/a370295c504a3095430cb1ace209f9f3/si60.gif https://s3.amazonaws.com/prod-ucs-content-store-us-east/content/pii:S0191261516302648/STRIPIN/image/gif/a370295c504a3095430cb1ace209f9f3/si60.gif si60 si60.gif gif 351 17 72 ALTIMG 1-s2.0-S0191261516302648-si70.gif https://s3-eu-west-1.amazonaws.com/prod-ucs-content-store-eu-west/content/pii:S0191261516302648/STRIPIN/image/gif/15d3f1e9641cfdb2c75498401ab42c47/si70.gif https://s3.amazonaws.com/prod-ucs-content-store-us-east/content/pii:S0191261516302648/STRIPIN/image/gif/15d3f1e9641cfdb2c75498401ab42c47/si70.gif si70 si70.gif gif 2212 24 564 ALTIMG 1-s2.0-S0191261516302648-si80.gif https://s3-eu-west-1.amazonaws.com/prod-ucs-content-store-eu-west/content/pii:S0191261516302648/STRIPIN/image/gif/80d749a382202220c1c6547d280e75a9/si80.gif https://s3.amazonaws.com/prod-ucs-content-store-us-east/content/pii:S0191261516302648/STRIPIN/image/gif/80d749a382202220c1c6547d280e75a9/si80.gif si80 si80.gif gif 1634 41 275 ALTIMG 1-s2.0-S0191261516302648-si90.gif https://s3-eu-west-1.amazonaws.com/prod-ucs-content-store-eu-west/content/pii:S0191261516302648/STRIPIN/image/gif/b7e10b662919273a9f068615aea17359/si90.gif https://s3.amazonaws.com/prod-ucs-content-store-us-east/content/pii:S0191261516302648/STRIPIN/image/gif/b7e10b662919273a9f068615aea17359/si90.gif si90 si90.gif gif 440 16 101 ALTIMG 1-s2.0-S0191261516302648-si1.gif https://s3-eu-west-1.amazonaws.com/prod-ucs-content-store-eu-west/content/pii:S0191261516302648/STRIPIN/image/gif/4cc8d8cac7fbcb290e4444855fe99052/si1.gif https://s3.amazonaws.com/prod-ucs-content-store-us-east/content/pii:S0191261516302648/STRIPIN/image/gif/4cc8d8cac7fbcb290e4444855fe99052/si1.gif si1 si1.gif gif 251 16 51 ALTIMG 1-s2.0-S0191261516302648-si50.gif https://s3-eu-west-1.amazonaws.com/prod-ucs-content-store-eu-west/content/pii:S0191261516302648/STRIPIN/image/gif/3a64cc00846a8174ee1a36ab96e32f74/si50.gif https://s3.amazonaws.com/prod-ucs-content-store-us-east/content/pii:S0191261516302648/STRIPIN/image/gif/3a64cc00846a8174ee1a36ab96e32f74/si50.gif si50 si50.gif gif 306 15 69 ALTIMG 1-s2.0-S0191261516302648-si100.gif https://s3-eu-west-1.amazonaws.com/prod-ucs-content-store-eu-west/content/pii:S0191261516302648/STRIPIN/image/gif/0be04c0152a4725bc60bfc00cb70a6c6/si100.gif https://s3.amazonaws.com/prod-ucs-content-store-us-east/content/pii:S0191261516302648/STRIPIN/image/gif/0be04c0152a4725bc60bfc00cb70a6c6/si100.gif si100 si100.gif gif 259 18 34 ALTIMG 1-s2.0-S0191261516302648-si110.gif https://s3-eu-west-1.amazonaws.com/prod-ucs-content-store-eu-west/content/pii:S0191261516302648/STRIPIN/image/gif/425aabae9e3bd6a222afdd604c6204a6/si110.gif https://s3.amazonaws.com/prod-ucs-content-store-us-east/content/pii:S0191261516302648/STRIPIN/image/gif/425aabae9e3bd6a222afdd604c6204a6/si110.gif si110 si110.gif gif 296 15 72 ALTIMG 1-s2.0-S0191261516302648-si13.gif https://s3-eu-west-1.amazonaws.com/prod-ucs-content-store-eu-west/content/pii:S0191261516302648/STRIPIN/image/gif/057b79c9e72f345fd1e37c002d4db98a/si13.gif https://s3.amazonaws.com/prod-ucs-content-store-us-east/content/pii:S0191261516302648/STRIPIN/image/gif/057b79c9e72f345fd1e37c002d4db98a/si13.gif si13 si13.gif gif 659 17 177 ALTIMG 1-s2.0-S0191261516302648-si14.gif https://s3-eu-west-1.amazonaws.com/prod-ucs-content-store-eu-west/content/pii:S0191261516302648/STRIPIN/image/gif/c7c8d35d0f0b02e8397fd0f148cda15c/si14.gif https://s3.amazonaws.com/prod-ucs-content-store-us-east/content/pii:S0191261516302648/STRIPIN/image/gif/c7c8d35d0f0b02e8397fd0f148cda15c/si14.gif si14 si14.gif gif 256 16 50 ALTIMG 1-s2.0-S0191261516302648-si15.gif https://s3-eu-west-1.amazonaws.com/prod-ucs-content-store-eu-west/content/pii:S0191261516302648/STRIPIN/image/gif/a7ce51ffc2b2e892ac6928ea4fc06304/si15.gif https://s3.amazonaws.com/prod-ucs-content-store-us-east/content/pii:S0191261516302648/STRIPIN/image/gif/a7ce51ffc2b2e892ac6928ea4fc06304/si15.gif si15 si15.gif gif 422 16 87 ALTIMG 1-s2.0-S0191261516302648-si16.gif https://s3-eu-west-1.amazonaws.com/prod-ucs-content-store-eu-west/content/pii:S0191261516302648/STRIPIN/image/gif/797efe8cd40380b299b52fdf44dc543e/si16.gif https://s3.amazonaws.com/prod-ucs-content-store-us-east/content/pii:S0191261516302648/STRIPIN/image/gif/797efe8cd40380b299b52fdf44dc543e/si16.gif si16 si16.gif gif 351 16 73 ALTIMG 1-s2.0-S0191261516302648-si17.gif https://s3-eu-west-1.amazonaws.com/prod-ucs-content-store-eu-west/content/pii:S0191261516302648/STRIPIN/image/gif/dc9422fc3f2a71d10cfd311b7c780daf/si17.gif https://s3.amazonaws.com/prod-ucs-content-store-us-east/content/pii:S0191261516302648/STRIPIN/image/gif/dc9422fc3f2a71d10cfd311b7c780daf/si17.gif si17 si17.gif gif 294 17 58 ALTIMG 1-s2.0-S0191261516302648-si18.gif https://s3-eu-west-1.amazonaws.com/prod-ucs-content-store-eu-west/content/pii:S0191261516302648/STRIPIN/image/gif/212d1c5d5192c13436b8531853316f31/si18.gif https://s3.amazonaws.com/prod-ucs-content-store-us-east/content/pii:S0191261516302648/STRIPIN/image/gif/212d1c5d5192c13436b8531853316f31/si18.gif si18 si18.gif gif 167 16 18 ALTIMG 1-s2.0-S0191261516302648-si19.gif https://s3-eu-west-1.amazonaws.com/prod-ucs-content-store-eu-west/content/pii:S0191261516302648/STRIPIN/image/gif/09891f79512a81994cc52ee01551d827/si19.gif https://s3.amazonaws.com/prod-ucs-content-store-us-east/content/pii:S0191261516302648/STRIPIN/image/gif/09891f79512a81994cc52ee01551d827/si19.gif si19 si19.gif gif 313 16 52 ALTIMG 1-s2.0-S0191261516302648-si2.gif https://s3-eu-west-1.amazonaws.com/prod-ucs-content-store-eu-west/content/pii:S0191261516302648/STRIPIN/image/gif/a19260b9216fe895f9d2a2769e05d4da/si2.gif https://s3.amazonaws.com/prod-ucs-content-store-us-east/content/pii:S0191261516302648/STRIPIN/image/gif/a19260b9216fe895f9d2a2769e05d4da/si2.gif si2 si2.gif gif 144 13 12 ALTIMG 1-s2.0-S0191261516302648-si21.gif https://s3-eu-west-1.amazonaws.com/prod-ucs-content-store-eu-west/content/pii:S0191261516302648/STRIPIN/image/gif/ac42c2ce9b26dfe1ac8ab55d8a38b209/si21.gif https://s3.amazonaws.com/prod-ucs-content-store-us-east/content/pii:S0191261516302648/STRIPIN/image/gif/ac42c2ce9b26dfe1ac8ab55d8a38b209/si21.gif si21 si21.gif gif 277 16 53 ALTIMG 1-s2.0-S0191261516302648-si22.gif https://s3-eu-west-1.amazonaws.com/prod-ucs-content-store-eu-west/content/pii:S0191261516302648/STRIPIN/image/gif/46611b5d98940b5f543f70eb3a9b0c0b/si22.gif https://s3.amazonaws.com/prod-ucs-content-store-us-east/content/pii:S0191261516302648/STRIPIN/image/gif/46611b5d98940b5f543f70eb3a9b0c0b/si22.gif si22 si22.gif gif 265 16 53 ALTIMG 1-s2.0-S0191261516302648-si23.gif https://s3-eu-west-1.amazonaws.com/prod-ucs-content-store-eu-west/content/pii:S0191261516302648/STRIPIN/image/gif/19d16fad910bf5792cce63c7895e2441/si23.gif https://s3.amazonaws.com/prod-ucs-content-store-us-east/content/pii:S0191261516302648/STRIPIN/image/gif/19d16fad910bf5792cce63c7895e2441/si23.gif si23 si23.gif gif 250 16 49 ALTIMG 1-s2.0-S0191261516302648-si24.gif https://s3-eu-west-1.amazonaws.com/prod-ucs-content-store-eu-west/content/pii:S0191261516302648/STRIPIN/image/gif/90fa40bab32e5747c8d665667b4754c6/si24.gif https://s3.amazonaws.com/prod-ucs-content-store-us-east/content/pii:S0191261516302648/STRIPIN/image/gif/90fa40bab32e5747c8d665667b4754c6/si24.gif si24 si24.gif gif 321 16 63 ALTIMG 1-s2.0-S0191261516302648-si3.gif https://s3-eu-west-1.amazonaws.com/prod-ucs-content-store-eu-west/content/pii:S0191261516302648/STRIPIN/image/gif/702758ce170fef770573e5054415f313/si3.gif https://s3.amazonaws.com/prod-ucs-content-store-us-east/content/pii:S0191261516302648/STRIPIN/image/gif/702758ce170fef770573e5054415f313/si3.gif si3 si3.gif gif 254 16 49 ALTIMG 1-s2.0-S0191261516302648-si25.gif https://s3-eu-west-1.amazonaws.com/prod-ucs-content-store-eu-west/content/pii:S0191261516302648/STRIPIN/image/gif/41607b81ea8e34966eb982d7ac1a1c85/si25.gif https://s3.amazonaws.com/prod-ucs-content-store-us-east/content/pii:S0191261516302648/STRIPIN/image/gif/41607b81ea8e34966eb982d7ac1a1c85/si25.gif si25 si25.gif gif 307 16 63 ALTIMG 1-s2.0-S0191261516302648-si26.gif https://s3-eu-west-1.amazonaws.com/prod-ucs-content-store-eu-west/content/pii:S0191261516302648/STRIPIN/image/gif/148d6802899fe03eb4e3e469a1cf62a6/si26.gif https://s3.amazonaws.com/prod-ucs-content-store-us-east/content/pii:S0191261516302648/STRIPIN/image/gif/148d6802899fe03eb4e3e469a1cf62a6/si26.gif si26 si26.gif gif 149 13 14 ALTIMG 1-s2.0-S0191261516302648-si27.gif https://s3-eu-west-1.amazonaws.com/prod-ucs-content-store-eu-west/content/pii:S0191261516302648/STRIPIN/image/gif/b513471abd4520ef9159dbf01ebac3ca/si27.gif https://s3.amazonaws.com/prod-ucs-content-store-us-east/content/pii:S0191261516302648/STRIPIN/image/gif/b513471abd4520ef9159dbf01ebac3ca/si27.gif si27 si27.gif gif 248 14 51 ALTIMG 1-s2.0-S0191261516302648-si28.gif https://s3-eu-west-1.amazonaws.com/prod-ucs-content-store-eu-west/content/pii:S0191261516302648/STRIPIN/image/gif/958c1bea59d9b40924e76c8b5ed65fe1/si28.gif https://s3.amazonaws.com/prod-ucs-content-store-us-east/content/pii:S0191261516302648/STRIPIN/image/gif/958c1bea59d9b40924e76c8b5ed65fe1/si28.gif si28 si28.gif gif 322 13 87 ALTIMG 1-s2.0-S0191261516302648-si29.gif https://s3-eu-west-1.amazonaws.com/prod-ucs-content-store-eu-west/content/pii:S0191261516302648/STRIPIN/image/gif/692f8da1738c0ce3676d4b4d7cfff076/si29.gif https://s3.amazonaws.com/prod-ucs-content-store-us-east/content/pii:S0191261516302648/STRIPIN/image/gif/692f8da1738c0ce3676d4b4d7cfff076/si29.gif si29 si29.gif gif 434 16 106 ALTIMG 1-s2.0-S0191261516302648-si31.gif https://s3-eu-west-1.amazonaws.com/prod-ucs-content-store-eu-west/content/pii:S0191261516302648/STRIPIN/image/gif/cbad0748e8fad20a0b2bf91c9e10f237/si31.gif https://s3.amazonaws.com/prod-ucs-content-store-us-east/content/pii:S0191261516302648/STRIPIN/image/gif/cbad0748e8fad20a0b2bf91c9e10f237/si31.gif si31 si31.gif gif 476 17 92 ALTIMG 1-s2.0-S0191261516302648-si32.gif https://s3-eu-west-1.amazonaws.com/prod-ucs-content-store-eu-west/content/pii:S0191261516302648/STRIPIN/image/gif/760ded49d611f4c383a66a3d24ce3025/si32.gif https://s3.amazonaws.com/prod-ucs-content-store-us-east/content/pii:S0191261516302648/STRIPIN/image/gif/760ded49d611f4c383a66a3d24ce3025/si32.gif si32 si32.gif gif 700 17 170 ALTIMG 1-s2.0-S0191261516302648-si33.gif https://s3-eu-west-1.amazonaws.com/prod-ucs-content-store-eu-west/content/pii:S0191261516302648/STRIPIN/image/gif/d65a48b0bb5f683ada3ccafa4c7b11e1/si33.gif https://s3.amazonaws.com/prod-ucs-content-store-us-east/content/pii:S0191261516302648/STRIPIN/image/gif/d65a48b0bb5f683ada3ccafa4c7b11e1/si33.gif si33 si33.gif gif 460 16 109 ALTIMG 1-s2.0-S0191261516302648-si34.gif https://s3-eu-west-1.amazonaws.com/prod-ucs-content-store-eu-west/content/pii:S0191261516302648/STRIPIN/image/gif/7f3c7d8a42fbb759313529fc7b5335b5/si34.gif https://s3.amazonaws.com/prod-ucs-content-store-us-east/content/pii:S0191261516302648/STRIPIN/image/gif/7f3c7d8a42fbb759313529fc7b5335b5/si34.gif si34 si34.gif gif 487 17 135 ALTIMG 1-s2.0-S0191261516302648-si35.gif https://s3-eu-west-1.amazonaws.com/prod-ucs-content-store-eu-west/content/pii:S0191261516302648/STRIPIN/image/gif/4d52234e94c4bba2f8f13010c11a5639/si35.gif https://s3.amazonaws.com/prod-ucs-content-store-us-east/content/pii:S0191261516302648/STRIPIN/image/gif/4d52234e94c4bba2f8f13010c11a5639/si35.gif si35 si35.gif gif 238 16 51 ALTIMG 1-s2.0-S0191261516302648-si36.gif https://s3-eu-west-1.amazonaws.com/prod-ucs-content-store-eu-west/content/pii:S0191261516302648/STRIPIN/image/gif/fcd434839c81710c0790b29c10c6f8f2/si36.gif https://s3.amazonaws.com/prod-ucs-content-store-us-east/content/pii:S0191261516302648/STRIPIN/image/gif/fcd434839c81710c0790b29c10c6f8f2/si36.gif si36 si36.gif gif 51 2 21 ALTIMG 1-s2.0-S0191261516302648-si37.gif https://s3-eu-west-1.amazonaws.com/prod-ucs-content-store-eu-west/content/pii:S0191261516302648/STRIPIN/image/gif/0257a8cb84a6158cb6a59c4dd991641e/si37.gif https://s3.amazonaws.com/prod-ucs-content-store-us-east/content/pii:S0191261516302648/STRIPIN/image/gif/0257a8cb84a6158cb6a59c4dd991641e/si37.gif si37 si37.gif gif 321 16 71 ALTIMG 1-s2.0-S0191261516302648-si38.gif https://s3-eu-west-1.amazonaws.com/prod-ucs-content-store-eu-west/content/pii:S0191261516302648/STRIPIN/image/gif/0cf08bbcdd3fb16df9de6a04e81e830c/si38.gif https://s3.amazonaws.com/prod-ucs-content-store-us-east/content/pii:S0191261516302648/STRIPIN/image/gif/0cf08bbcdd3fb16df9de6a04e81e830c/si38.gif si38 si38.gif gif 663 21 187 ALTIMG 1-s2.0-S0191261516302648-si39.gif https://s3-eu-west-1.amazonaws.com/prod-ucs-content-store-eu-west/content/pii:S0191261516302648/STRIPIN/image/gif/4df3765c45293408ca20768458f27fe4/si39.gif https://s3.amazonaws.com/prod-ucs-content-store-us-east/content/pii:S0191261516302648/STRIPIN/image/gif/4df3765c45293408ca20768458f27fe4/si39.gif si39 si39.gif gif 266 16 52 ALTIMG 1-s2.0-S0191261516302648-si4.gif https://s3-eu-west-1.amazonaws.com/prod-ucs-content-store-eu-west/content/pii:S0191261516302648/STRIPIN/image/gif/89ebf822de8a7f99eb63e59e7a597a6a/si4.gif https://s3.amazonaws.com/prod-ucs-content-store-us-east/content/pii:S0191261516302648/STRIPIN/image/gif/89ebf822de8a7f99eb63e59e7a597a6a/si4.gif si4 si4.gif gif 315 16 70 ALTIMG 1-s2.0-S0191261516302648-si41.gif https://s3-eu-west-1.amazonaws.com/prod-ucs-content-store-eu-west/content/pii:S0191261516302648/STRIPIN/image/gif/4bf4d29c8c02f4be538f64af739797c8/si41.gif https://s3.amazonaws.com/prod-ucs-content-store-us-east/content/pii:S0191261516302648/STRIPIN/image/gif/4bf4d29c8c02f4be538f64af739797c8/si41.gif si41 si41.gif gif 268 16 56 ALTIMG 1-s2.0-S0191261516302648-si42.gif https://s3-eu-west-1.amazonaws.com/prod-ucs-content-store-eu-west/content/pii:S0191261516302648/STRIPIN/image/gif/3bdc20656c0ca84f099126aed523cc46/si42.gif https://s3.amazonaws.com/prod-ucs-content-store-us-east/content/pii:S0191261516302648/STRIPIN/image/gif/3bdc20656c0ca84f099126aed523cc46/si42.gif si42 si42.gif gif 440 19 98 ALTIMG 1-s2.0-S0191261516302648-si43.gif https://s3-eu-west-1.amazonaws.com/prod-ucs-content-store-eu-west/content/pii:S0191261516302648/STRIPIN/image/gif/48379a64f26fcbc2d54c9c087c146033/si43.gif https://s3.amazonaws.com/prod-ucs-content-store-us-east/content/pii:S0191261516302648/STRIPIN/image/gif/48379a64f26fcbc2d54c9c087c146033/si43.gif si43 si43.gif gif 428 16 100 ALTIMG 1-s2.0-S0191261516302648-si44.gif https://s3-eu-west-1.amazonaws.com/prod-ucs-content-store-eu-west/content/pii:S0191261516302648/STRIPIN/image/gif/1a0b52af915d5716ffd627c11afcde69/si44.gif https://s3.amazonaws.com/prod-ucs-content-store-us-east/content/pii:S0191261516302648/STRIPIN/image/gif/1a0b52af915d5716ffd627c11afcde69/si44.gif si44 si44.gif gif 314 16 69 ALTIMG 1-s2.0-S0191261516302648-si45.gif https://s3-eu-west-1.amazonaws.com/prod-ucs-content-store-eu-west/content/pii:S0191261516302648/STRIPIN/image/gif/01cf25cd9c1e2a2c72437fd7c9a9d0cc/si45.gif https://s3.amazonaws.com/prod-ucs-content-store-us-east/content/pii:S0191261516302648/STRIPIN/image/gif/01cf25cd9c1e2a2c72437fd7c9a9d0cc/si45.gif si45 si45.gif gif 470 16 103 ALTIMG 1-s2.0-S0191261516302648-si46.gif https://s3-eu-west-1.amazonaws.com/prod-ucs-content-store-eu-west/content/pii:S0191261516302648/STRIPIN/image/gif/7c180ebd1f73506598ff766da16e7d88/si46.gif https://s3.amazonaws.com/prod-ucs-content-store-us-east/content/pii:S0191261516302648/STRIPIN/image/gif/7c180ebd1f73506598ff766da16e7d88/si46.gif si46 si46.gif gif 780 41 159 ALTIMG 1-s2.0-S0191261516302648-si47.gif https://s3-eu-west-1.amazonaws.com/prod-ucs-content-store-eu-west/content/pii:S0191261516302648/STRIPIN/image/gif/e442fa96bf2dfc19598c336c2dda75ca/si47.gif https://s3.amazonaws.com/prod-ucs-content-store-us-east/content/pii:S0191261516302648/STRIPIN/image/gif/e442fa96bf2dfc19598c336c2dda75ca/si47.gif si47 si47.gif gif 990 17 255 ALTIMG 1-s2.0-S0191261516302648-si48.gif https://s3-eu-west-1.amazonaws.com/prod-ucs-content-store-eu-west/content/pii:S0191261516302648/STRIPIN/image/gif/1c4f8c4c844cd3db19894d57055385e0/si48.gif https://s3.amazonaws.com/prod-ucs-content-store-us-east/content/pii:S0191261516302648/STRIPIN/image/gif/1c4f8c4c844cd3db19894d57055385e0/si48.gif si48 si48.gif gif 476 20 111 ALTIMG 1-s2.0-S0191261516302648-si49.gif https://s3-eu-west-1.amazonaws.com/prod-ucs-content-store-eu-west/content/pii:S0191261516302648/STRIPIN/image/gif/82c5d6c9539b830f6017ad58d415f5ad/si49.gif https://s3.amazonaws.com/prod-ucs-content-store-us-east/content/pii:S0191261516302648/STRIPIN/image/gif/82c5d6c9539b830f6017ad58d415f5ad/si49.gif si49 si49.gif gif 806 19 185 ALTIMG 1-s2.0-S0191261516302648-si5.gif https://s3-eu-west-1.amazonaws.com/prod-ucs-content-store-eu-west/content/pii:S0191261516302648/STRIPIN/image/gif/b776c29861ef9a90e00876e33a796df0/si5.gif https://s3.amazonaws.com/prod-ucs-content-store-us-east/content/pii:S0191261516302648/STRIPIN/image/gif/b776c29861ef9a90e00876e33a796df0/si5.gif si5 si5.gif gif 192 13 48 ALTIMG 1-s2.0-S0191261516302648-si51.gif https://s3-eu-west-1.amazonaws.com/prod-ucs-content-store-eu-west/content/pii:S0191261516302648/STRIPIN/image/gif/7fb5018e54967aad364b461ac49afd1a/si51.gif https://s3.amazonaws.com/prod-ucs-content-store-us-east/content/pii:S0191261516302648/STRIPIN/image/gif/7fb5018e54967aad364b461ac49afd1a/si51.gif si51 si51.gif gif 279 17 39 ALTIMG 1-s2.0-S0191261516302648-si52.gif https://s3-eu-west-1.amazonaws.com/prod-ucs-content-store-eu-west/content/pii:S0191261516302648/STRIPIN/image/gif/23589accb001b2aad2a1c877a08d99ba/si52.gif https://s3.amazonaws.com/prod-ucs-content-store-us-east/content/pii:S0191261516302648/STRIPIN/image/gif/23589accb001b2aad2a1c877a08d99ba/si52.gif si52 si52.gif gif 372 15 78 ALTIMG 1-s2.0-S0191261516302648-si53.gif https://s3-eu-west-1.amazonaws.com/prod-ucs-content-store-eu-west/content/pii:S0191261516302648/STRIPIN/image/gif/367b0ad883a582a8ce17f7207e881031/si53.gif https://s3.amazonaws.com/prod-ucs-content-store-us-east/content/pii:S0191261516302648/STRIPIN/image/gif/367b0ad883a582a8ce17f7207e881031/si53.gif si53 si53.gif gif 1052 26 242 ALTIMG 1-s2.0-S0191261516302648-si54.gif https://s3-eu-west-1.amazonaws.com/prod-ucs-content-store-eu-west/content/pii:S0191261516302648/STRIPIN/image/gif/76e5a46da4981458b3af02cfc8b7bf1e/si54.gif https://s3.amazonaws.com/prod-ucs-content-store-us-east/content/pii:S0191261516302648/STRIPIN/image/gif/76e5a46da4981458b3af02cfc8b7bf1e/si54.gif si54 si54.gif gif 377 16 73 ALTIMG 1-s2.0-S0191261516302648-si55.gif https://s3-eu-west-1.amazonaws.com/prod-ucs-content-store-eu-west/content/pii:S0191261516302648/STRIPIN/image/gif/b37b1950a063eb24f21926b7f0ee5bad/si55.gif https://s3.amazonaws.com/prod-ucs-content-store-us-east/content/pii:S0191261516302648/STRIPIN/image/gif/b37b1950a063eb24f21926b7f0ee5bad/si55.gif si55 si55.gif gif 901 26 199 ALTIMG 1-s2.0-S0191261516302648-si56.gif https://s3-eu-west-1.amazonaws.com/prod-ucs-content-store-eu-west/content/pii:S0191261516302648/STRIPIN/image/gif/236302b1643bfb671aab6995d4c74ed2/si56.gif https://s3.amazonaws.com/prod-ucs-content-store-us-east/content/pii:S0191261516302648/STRIPIN/image/gif/236302b1643bfb671aab6995d4c74ed2/si56.gif si56 si56.gif gif 1279 22 328 ALTIMG 1-s2.0-S0191261516302648-si57.gif https://s3-eu-west-1.amazonaws.com/prod-ucs-content-store-eu-west/content/pii:S0191261516302648/STRIPIN/image/gif/2fc6e180b273df9d4fb75233ed98d1f0/si57.gif https://s3.amazonaws.com/prod-ucs-content-store-us-east/content/pii:S0191261516302648/STRIPIN/image/gif/2fc6e180b273df9d4fb75233ed98d1f0/si57.gif si57 si57.gif gif 811 24 178 ALTIMG 1-s2.0-S0191261516302648-si58.gif https://s3-eu-west-1.amazonaws.com/prod-ucs-content-store-eu-west/content/pii:S0191261516302648/STRIPIN/image/gif/ea4c4a35e4c88c76b2accc98d0657027/si58.gif https://s3.amazonaws.com/prod-ucs-content-store-us-east/content/pii:S0191261516302648/STRIPIN/image/gif/ea4c4a35e4c88c76b2accc98d0657027/si58.gif si58 si58.gif gif 479 19 118 ALTIMG 1-s2.0-S0191261516302648-si59.gif https://s3-eu-west-1.amazonaws.com/prod-ucs-content-store-eu-west/content/pii:S0191261516302648/STRIPIN/image/gif/3546eb01b71d45631e43c6b644bf87db/si59.gif https://s3.amazonaws.com/prod-ucs-content-store-us-east/content/pii:S0191261516302648/STRIPIN/image/gif/3546eb01b71d45631e43c6b644bf87db/si59.gif si59 si59.gif gif 442 17 90 ALTIMG 1-s2.0-S0191261516302648-si6.gif https://s3-eu-west-1.amazonaws.com/prod-ucs-content-store-eu-west/content/pii:S0191261516302648/STRIPIN/image/gif/1afdc238772330459afb74a383707656/si6.gif https://s3.amazonaws.com/prod-ucs-content-store-us-east/content/pii:S0191261516302648/STRIPIN/image/gif/1afdc238772330459afb74a383707656/si6.gif si6 si6.gif gif 335 17 94 ALTIMG 1-s2.0-S0191261516302648-si61.gif https://s3-eu-west-1.amazonaws.com/prod-ucs-content-store-eu-west/content/pii:S0191261516302648/STRIPIN/image/gif/888512cdb4a5272dee4879d4eb804e97/si61.gif https://s3.amazonaws.com/prod-ucs-content-store-us-east/content/pii:S0191261516302648/STRIPIN/image/gif/888512cdb4a5272dee4879d4eb804e97/si61.gif si61 si61.gif gif 340 17 67 ALTIMG 1-s2.0-S0191261516302648-si62.gif https://s3-eu-west-1.amazonaws.com/prod-ucs-content-store-eu-west/content/pii:S0191261516302648/STRIPIN/image/gif/ecfb83ac535968f8a6904fd2a8900b34/si62.gif https://s3.amazonaws.com/prod-ucs-content-store-us-east/content/pii:S0191261516302648/STRIPIN/image/gif/ecfb83ac535968f8a6904fd2a8900b34/si62.gif si62 si62.gif gif 1681 41 379 ALTIMG 1-s2.0-S0191261516302648-si63.gif https://s3-eu-west-1.amazonaws.com/prod-ucs-content-store-eu-west/content/pii:S0191261516302648/STRIPIN/image/gif/21773969c26ef410d37d3bb8396a647a/si63.gif https://s3.amazonaws.com/prod-ucs-content-store-us-east/content/pii:S0191261516302648/STRIPIN/image/gif/21773969c26ef410d37d3bb8396a647a/si63.gif si63 si63.gif gif 651 41 119 ALTIMG 1-s2.0-S0191261516302648-si64.gif https://s3-eu-west-1.amazonaws.com/prod-ucs-content-store-eu-west/content/pii:S0191261516302648/STRIPIN/image/gif/ddbc6f075db16f84d064b34986636b11/si64.gif https://s3.amazonaws.com/prod-ucs-content-store-us-east/content/pii:S0191261516302648/STRIPIN/image/gif/ddbc6f075db16f84d064b34986636b11/si64.gif si64 si64.gif gif 1158 41 275 ALTIMG 1-s2.0-S0191261516302648-si65.gif https://s3-eu-west-1.amazonaws.com/prod-ucs-content-store-eu-west/content/pii:S0191261516302648/STRIPIN/image/gif/e46cf117cefe517f41f53e779c6774b5/si65.gif https://s3.amazonaws.com/prod-ucs-content-store-us-east/content/pii:S0191261516302648/STRIPIN/image/gif/e46cf117cefe517f41f53e779c6774b5/si65.gif si65 si65.gif gif 451 16 98 ALTIMG 1-s2.0-S0191261516302648-si66.gif https://s3-eu-west-1.amazonaws.com/prod-ucs-content-store-eu-west/content/pii:S0191261516302648/STRIPIN/image/gif/12e3d2bb7529e75a362c348b62c90392/si66.gif https://s3.amazonaws.com/prod-ucs-content-store-us-east/content/pii:S0191261516302648/STRIPIN/image/gif/12e3d2bb7529e75a362c348b62c90392/si66.gif si66 si66.gif gif 476 19 112 ALTIMG 1-s2.0-S0191261516302648-si67.gif https://s3-eu-west-1.amazonaws.com/prod-ucs-content-store-eu-west/content/pii:S0191261516302648/STRIPIN/image/gif/27531fdeaec4ae7df6048fb7e0c777c5/si67.gif https://s3.amazonaws.com/prod-ucs-content-store-us-east/content/pii:S0191261516302648/STRIPIN/image/gif/27531fdeaec4ae7df6048fb7e0c777c5/si67.gif si67 si67.gif gif 1372 24 370 ALTIMG 1-s2.0-S0191261516302648-si68.gif https://s3-eu-west-1.amazonaws.com/prod-ucs-content-store-eu-west/content/pii:S0191261516302648/STRIPIN/image/gif/10cc85b08f41ae10c7b778eb8d79b5ff/si68.gif https://s3.amazonaws.com/prod-ucs-content-store-us-east/content/pii:S0191261516302648/STRIPIN/image/gif/10cc85b08f41ae10c7b778eb8d79b5ff/si68.gif si68 si68.gif gif 1350 24 352 ALTIMG 1-s2.0-S0191261516302648-si69.gif https://s3-eu-west-1.amazonaws.com/prod-ucs-content-store-eu-west/content/pii:S0191261516302648/STRIPIN/image/gif/a7af7fb0e77adbb36dc03ec3e10d0022/si69.gif https://s3.amazonaws.com/prod-ucs-content-store-us-east/content/pii:S0191261516302648/STRIPIN/image/gif/a7af7fb0e77adbb36dc03ec3e10d0022/si69.gif si69 si69.gif gif 342 16 57 ALTIMG 1-s2.0-S0191261516302648-si7.gif https://s3-eu-west-1.amazonaws.com/prod-ucs-content-store-eu-west/content/pii:S0191261516302648/STRIPIN/image/gif/cc4df8ccd9973c28f5f00432c9919f5e/si7.gif https://s3.amazonaws.com/prod-ucs-content-store-us-east/content/pii:S0191261516302648/STRIPIN/image/gif/cc4df8ccd9973c28f5f00432c9919f5e/si7.gif si7 si7.gif gif 451 17 109 ALTIMG 1-s2.0-S0191261516302648-si71.gif https://s3-eu-west-1.amazonaws.com/prod-ucs-content-store-eu-west/content/pii:S0191261516302648/STRIPIN/image/gif/edf28c120e892d145700a3fb7d18f080/si71.gif https://s3.amazonaws.com/prod-ucs-content-store-us-east/content/pii:S0191261516302648/STRIPIN/image/gif/edf28c120e892d145700a3fb7d18f080/si71.gif si71 si71.gif gif 2445 24 636 ALTIMG 1-s2.0-S0191261516302648-si72.gif https://s3-eu-west-1.amazonaws.com/prod-ucs-content-store-eu-west/content/pii:S0191261516302648/STRIPIN/image/gif/c520dc1120d3c33fca3202687e70fdeb/si72.gif https://s3.amazonaws.com/prod-ucs-content-store-us-east/content/pii:S0191261516302648/STRIPIN/image/gif/c520dc1120d3c33fca3202687e70fdeb/si72.gif si72 si72.gif gif 1145 24 272 ALTIMG 1-s2.0-S0191261516302648-si73.gif https://s3-eu-west-1.amazonaws.com/prod-ucs-content-store-eu-west/content/pii:S0191261516302648/STRIPIN/image/gif/74d6494fbb9c59124ae3a4a523c5e69c/si73.gif https://s3.amazonaws.com/prod-ucs-content-store-us-east/content/pii:S0191261516302648/STRIPIN/image/gif/74d6494fbb9c59124ae3a4a523c5e69c/si73.gif si73 si73.gif gif 535 17 112 ALTIMG 1-s2.0-S0191261516302648-si74.gif https://s3-eu-west-1.amazonaws.com/prod-ucs-content-store-eu-west/content/pii:S0191261516302648/STRIPIN/image/gif/b9e17593f7e59fa788cde32138e51b43/si74.gif https://s3.amazonaws.com/prod-ucs-content-store-us-east/content/pii:S0191261516302648/STRIPIN/image/gif/b9e17593f7e59fa788cde32138e51b43/si74.gif si74 si74.gif gif 390 21 68 ALTIMG 1-s2.0-S0191261516302648-si75.gif https://s3-eu-west-1.amazonaws.com/prod-ucs-content-store-eu-west/content/pii:S0191261516302648/STRIPIN/image/gif/b5b95f116a5ceff260f0de69dee5e154/si75.gif https://s3.amazonaws.com/prod-ucs-content-store-us-east/content/pii:S0191261516302648/STRIPIN/image/gif/b5b95f116a5ceff260f0de69dee5e154/si75.gif si75 si75.gif gif 1426 18 375 ALTIMG 1-s2.0-S0191261516302648-si76.gif https://s3-eu-west-1.amazonaws.com/prod-ucs-content-store-eu-west/content/pii:S0191261516302648/STRIPIN/image/gif/65cc2436f06387555c0a4cdce89c7a0f/si76.gif https://s3.amazonaws.com/prod-ucs-content-store-us-east/content/pii:S0191261516302648/STRIPIN/image/gif/65cc2436f06387555c0a4cdce89c7a0f/si76.gif si76 si76.gif gif 791 21 157 ALTIMG 1-s2.0-S0191261516302648-si77.gif https://s3-eu-west-1.amazonaws.com/prod-ucs-content-store-eu-west/content/pii:S0191261516302648/STRIPIN/image/gif/40cd99cd15ed7b9e2dc38a7b87d3c02d/si77.gif https://s3.amazonaws.com/prod-ucs-content-store-us-east/content/pii:S0191261516302648/STRIPIN/image/gif/40cd99cd15ed7b9e2dc38a7b87d3c02d/si77.gif si77 si77.gif gif 457 17 89 ALTIMG 1-s2.0-S0191261516302648-si78.gif https://s3-eu-west-1.amazonaws.com/prod-ucs-content-store-eu-west/content/pii:S0191261516302648/STRIPIN/image/gif/fdf06619a02d8c8d43d6e2d3d80d96ae/si78.gif https://s3.amazonaws.com/prod-ucs-content-store-us-east/content/pii:S0191261516302648/STRIPIN/image/gif/fdf06619a02d8c8d43d6e2d3d80d96ae/si78.gif si78 si78.gif gif 641 16 175 ALTIMG 1-s2.0-S0191261516302648-si79.gif https://s3-eu-west-1.amazonaws.com/prod-ucs-content-store-eu-west/content/pii:S0191261516302648/STRIPIN/image/gif/83c1ca9076ac73fac61f12144452fa19/si79.gif https://s3.amazonaws.com/prod-ucs-content-store-us-east/content/pii:S0191261516302648/STRIPIN/image/gif/83c1ca9076ac73fac61f12144452fa19/si79.gif si79 si79.gif gif 378 20 65 ALTIMG 1-s2.0-S0191261516302648-si8.gif https://s3-eu-west-1.amazonaws.com/prod-ucs-content-store-eu-west/content/pii:S0191261516302648/STRIPIN/image/gif/d1a52866a96c081cfcbbb1e168a2328b/si8.gif https://s3.amazonaws.com/prod-ucs-content-store-us-east/content/pii:S0191261516302648/STRIPIN/image/gif/d1a52866a96c081cfcbbb1e168a2328b/si8.gif si8 si8.gif gif 235 13 45 ALTIMG 1-s2.0-S0191261516302648-si81.gif https://s3-eu-west-1.amazonaws.com/prod-ucs-content-store-eu-west/content/pii:S0191261516302648/STRIPIN/image/gif/23ebc742d06d0010135c8f9d6849c8ab/si81.gif https://s3.amazonaws.com/prod-ucs-content-store-us-east/content/pii:S0191261516302648/STRIPIN/image/gif/23ebc742d06d0010135c8f9d6849c8ab/si81.gif si81 si81.gif gif 1025 17 313 ALTIMG 1-s2.0-S0191261516302648-si82.gif https://s3-eu-west-1.amazonaws.com/prod-ucs-content-store-eu-west/content/pii:S0191261516302648/STRIPIN/image/gif/b19f196f09529583103ce52128dd5e75/si82.gif https://s3.amazonaws.com/prod-ucs-content-store-us-east/content/pii:S0191261516302648/STRIPIN/image/gif/b19f196f09529583103ce52128dd5e75/si82.gif si82 si82.gif gif 374 20 85 ALTIMG 1-s2.0-S0191261516302648-si83.gif https://s3-eu-west-1.amazonaws.com/prod-ucs-content-store-eu-west/content/pii:S0191261516302648/STRIPIN/image/gif/0549dcac40af9bd8e536b4dafa56b506/si83.gif https://s3.amazonaws.com/prod-ucs-content-store-us-east/content/pii:S0191261516302648/STRIPIN/image/gif/0549dcac40af9bd8e536b4dafa56b506/si83.gif si83 si83.gif gif 252 15 52 ALTIMG 1-s2.0-S0191261516302648-si84.gif https://s3-eu-west-1.amazonaws.com/prod-ucs-content-store-eu-west/content/pii:S0191261516302648/STRIPIN/image/gif/1d2a5411ddc606f39667224e8e421116/si84.gif https://s3.amazonaws.com/prod-ucs-content-store-us-east/content/pii:S0191261516302648/STRIPIN/image/gif/1d2a5411ddc606f39667224e8e421116/si84.gif si84 si84.gif gif 321 14 74 ALTIMG 1-s2.0-S0191261516302648-si85.gif https://s3-eu-west-1.amazonaws.com/prod-ucs-content-store-eu-west/content/pii:S0191261516302648/STRIPIN/image/gif/01a1a261a58e8fd1ed92245eaa88cd44/si85.gif https://s3.amazonaws.com/prod-ucs-content-store-us-east/content/pii:S0191261516302648/STRIPIN/image/gif/01a1a261a58e8fd1ed92245eaa88cd44/si85.gif si85 si85.gif gif 239 16 41 ALTIMG 1-s2.0-S0191261516302648-si86.gif https://s3-eu-west-1.amazonaws.com/prod-ucs-content-store-eu-west/content/pii:S0191261516302648/STRIPIN/image/gif/ed91e402678649388432a8a429a25c1c/si86.gif https://s3.amazonaws.com/prod-ucs-content-store-us-east/content/pii:S0191261516302648/STRIPIN/image/gif/ed91e402678649388432a8a429a25c1c/si86.gif si86 si86.gif gif 1046 16 322 ALTIMG 1-s2.0-S0191261516302648-si87.gif https://s3-eu-west-1.amazonaws.com/prod-ucs-content-store-eu-west/content/pii:S0191261516302648/STRIPIN/image/gif/c0c4a47c51d8e92f6d0d702bc13710a2/si87.gif https://s3.amazonaws.com/prod-ucs-content-store-us-east/content/pii:S0191261516302648/STRIPIN/image/gif/c0c4a47c51d8e92f6d0d702bc13710a2/si87.gif si87 si87.gif gif 598 15 153 ALTIMG 1-s2.0-S0191261516302648-si88.gif https://s3-eu-west-1.amazonaws.com/prod-ucs-content-store-eu-west/content/pii:S0191261516302648/STRIPIN/image/gif/0100e631bd35f93607193ad42dc7997f/si88.gif https://s3.amazonaws.com/prod-ucs-content-store-us-east/content/pii:S0191261516302648/STRIPIN/image/gif/0100e631bd35f93607193ad42dc7997f/si88.gif si88 si88.gif gif 1888 68 319 ALTIMG 1-s2.0-S0191261516302648-si89.gif https://s3-eu-west-1.amazonaws.com/prod-ucs-content-store-eu-west/content/pii:S0191261516302648/STRIPIN/image/gif/86f9e0b67a0ec6b005488098db28491b/si89.gif https://s3.amazonaws.com/prod-ucs-content-store-us-east/content/pii:S0191261516302648/STRIPIN/image/gif/86f9e0b67a0ec6b005488098db28491b/si89.gif si89 si89.gif gif 333 16 73 ALTIMG 1-s2.0-S0191261516302648-si9.gif https://s3-eu-west-1.amazonaws.com/prod-ucs-content-store-eu-west/content/pii:S0191261516302648/STRIPIN/image/gif/c55d513df954ef9070b9c7276ba79168/si9.gif https://s3.amazonaws.com/prod-ucs-content-store-us-east/content/pii:S0191261516302648/STRIPIN/image/gif/c55d513df954ef9070b9c7276ba79168/si9.gif si9 si9.gif gif 229 13 47 ALTIMG 1-s2.0-S0191261516302648-si91.gif https://s3-eu-west-1.amazonaws.com/prod-ucs-content-store-eu-west/content/pii:S0191261516302648/STRIPIN/image/gif/768cf993dc292954c4dd19e4693fbb98/si91.gif https://s3.amazonaws.com/prod-ucs-content-store-us-east/content/pii:S0191261516302648/STRIPIN/image/gif/768cf993dc292954c4dd19e4693fbb98/si91.gif si91 si91.gif gif 1287 41 239 ALTIMG 1-s2.0-S0191261516302648-si92.gif https://s3-eu-west-1.amazonaws.com/prod-ucs-content-store-eu-west/content/pii:S0191261516302648/STRIPIN/image/gif/0a48e5cdc4c7b1bfab696ba9c001f4e9/si92.gif https://s3.amazonaws.com/prod-ucs-content-store-us-east/content/pii:S0191261516302648/STRIPIN/image/gif/0a48e5cdc4c7b1bfab696ba9c001f4e9/si92.gif si92 si92.gif gif 412 20 75 ALTIMG 1-s2.0-S0191261516302648-si93.gif https://s3-eu-west-1.amazonaws.com/prod-ucs-content-store-eu-west/content/pii:S0191261516302648/STRIPIN/image/gif/5328c0faef68e4aa3cf78c1eb30bdec3/si93.gif https://s3.amazonaws.com/prod-ucs-content-store-us-east/content/pii:S0191261516302648/STRIPIN/image/gif/5328c0faef68e4aa3cf78c1eb30bdec3/si93.gif si93 si93.gif gif 653 19 159 ALTIMG 1-s2.0-S0191261516302648-si94.gif https://s3-eu-west-1.amazonaws.com/prod-ucs-content-store-eu-west/content/pii:S0191261516302648/STRIPIN/image/gif/8e113708fe257b785f586a56ac0cf6f2/si94.gif https://s3.amazonaws.com/prod-ucs-content-store-us-east/content/pii:S0191261516302648/STRIPIN/image/gif/8e113708fe257b785f586a56ac0cf6f2/si94.gif si94 si94.gif gif 414 16 95 ALTIMG 1-s2.0-S0191261516302648-si95.gif https://s3-eu-west-1.amazonaws.com/prod-ucs-content-store-eu-west/content/pii:S0191261516302648/STRIPIN/image/gif/d132569d131b7bfd756ca4ab13972991/si95.gif https://s3.amazonaws.com/prod-ucs-content-store-us-east/content/pii:S0191261516302648/STRIPIN/image/gif/d132569d131b7bfd756ca4ab13972991/si95.gif si95 si95.gif gif 460 16 98 ALTIMG 1-s2.0-S0191261516302648-si96.gif https://s3-eu-west-1.amazonaws.com/prod-ucs-content-store-eu-west/content/pii:S0191261516302648/STRIPIN/image/gif/d111665e43e942e9ab994de019bcc2a9/si96.gif https://s3.amazonaws.com/prod-ucs-content-store-us-east/content/pii:S0191261516302648/STRIPIN/image/gif/d111665e43e942e9ab994de019bcc2a9/si96.gif si96 si96.gif gif 1100 19 251 ALTIMG 1-s2.0-S0191261516302648-si97.gif https://s3-eu-west-1.amazonaws.com/prod-ucs-content-store-eu-west/content/pii:S0191261516302648/STRIPIN/image/gif/4e2a25a798f184f8db1866d67beafe0b/si97.gif https://s3.amazonaws.com/prod-ucs-content-store-us-east/content/pii:S0191261516302648/STRIPIN/image/gif/4e2a25a798f184f8db1866d67beafe0b/si97.gif si97 si97.gif gif 567 15 148 ALTIMG 1-s2.0-S0191261516302648-si98.gif https://s3-eu-west-1.amazonaws.com/prod-ucs-content-store-eu-west/content/pii:S0191261516302648/STRIPIN/image/gif/9d7cffb440daa3c4bbf61616b9584dde/si98.gif https://s3.amazonaws.com/prod-ucs-content-store-us-east/content/pii:S0191261516302648/STRIPIN/image/gif/9d7cffb440daa3c4bbf61616b9584dde/si98.gif si98 si98.gif gif 882 26 171 ALTIMG 1-s2.0-S0191261516302648-si99.gif https://s3-eu-west-1.amazonaws.com/prod-ucs-content-store-eu-west/content/pii:S0191261516302648/STRIPIN/image/gif/a1bd17a62a1216f4068112ae192f944d/si99.gif https://s3.amazonaws.com/prod-ucs-content-store-us-east/content/pii:S0191261516302648/STRIPIN/image/gif/a1bd17a62a1216f4068112ae192f944d/si99.gif si99 si99.gif gif 946 17 287 ALTIMG 1-s2.0-S0191261516302648-si101.gif https://s3-eu-west-1.amazonaws.com/prod-ucs-content-store-eu-west/content/pii:S0191261516302648/STRIPIN/image/gif/b98b27e16ce08c9cae5abcc63cbbf981/si101.gif https://s3.amazonaws.com/prod-ucs-content-store-us-east/content/pii:S0191261516302648/STRIPIN/image/gif/b98b27e16ce08c9cae5abcc63cbbf981/si101.gif si101 si101.gif gif 312 16 67 ALTIMG 1-s2.0-S0191261516302648-si102.gif https://s3-eu-west-1.amazonaws.com/prod-ucs-content-store-eu-west/content/pii:S0191261516302648/STRIPIN/image/gif/8212ad04fc75639617d0b2be7026cf98/si102.gif https://s3.amazonaws.com/prod-ucs-content-store-us-east/content/pii:S0191261516302648/STRIPIN/image/gif/8212ad04fc75639617d0b2be7026cf98/si102.gif si102 si102.gif gif 466 16 102 ALTIMG 1-s2.0-S0191261516302648-si103.gif https://s3-eu-west-1.amazonaws.com/prod-ucs-content-store-eu-west/content/pii:S0191261516302648/STRIPIN/image/gif/1284c2cc859c13dfc0af9643335e606a/si103.gif https://s3.amazonaws.com/prod-ucs-content-store-us-east/content/pii:S0191261516302648/STRIPIN/image/gif/1284c2cc859c13dfc0af9643335e606a/si103.gif si103 si103.gif gif 476 20 104 ALTIMG 1-s2.0-S0191261516302648-si104.gif https://s3-eu-west-1.amazonaws.com/prod-ucs-content-store-eu-west/content/pii:S0191261516302648/STRIPIN/image/gif/b2e5ff664ff3f9ba7df93d1f762a61df/si104.gif https://s3.amazonaws.com/prod-ucs-content-store-us-east/content/pii:S0191261516302648/STRIPIN/image/gif/b2e5ff664ff3f9ba7df93d1f762a61df/si104.gif si104 si104.gif gif 481 16 109 ALTIMG 1-s2.0-S0191261516302648-si105.gif https://s3-eu-west-1.amazonaws.com/prod-ucs-content-store-eu-west/content/pii:S0191261516302648/STRIPIN/image/gif/1a95a1fab4a3a86245226aa34c8fe71b/si105.gif https://s3.amazonaws.com/prod-ucs-content-store-us-east/content/pii:S0191261516302648/STRIPIN/image/gif/1a95a1fab4a3a86245226aa34c8fe71b/si105.gif si105 si105.gif gif 531 16 114 ALTIMG 1-s2.0-S0191261516302648-si106.gif https://s3-eu-west-1.amazonaws.com/prod-ucs-content-store-eu-west/content/pii:S0191261516302648/STRIPIN/image/gif/667a267b80c01cf07abf7ebae59820c5/si106.gif https://s3.amazonaws.com/prod-ucs-content-store-us-east/content/pii:S0191261516302648/STRIPIN/image/gif/667a267b80c01cf07abf7ebae59820c5/si106.gif si106 si106.gif gif 755 40 176 ALTIMG 1-s2.0-S0191261516302648-si107.gif https://s3-eu-west-1.amazonaws.com/prod-ucs-content-store-eu-west/content/pii:S0191261516302648/STRIPIN/image/gif/b40ba29ee9c2a8989b99d2143eafbb90/si107.gif https://s3.amazonaws.com/prod-ucs-content-store-us-east/content/pii:S0191261516302648/STRIPIN/image/gif/b40ba29ee9c2a8989b99d2143eafbb90/si107.gif si107 si107.gif gif 670 16 175 ALTIMG 1-s2.0-S0191261516302648-si108.gif https://s3-eu-west-1.amazonaws.com/prod-ucs-content-store-eu-west/content/pii:S0191261516302648/STRIPIN/image/gif/40f3d00c77fbd6ff7189ec98d4b39643/si108.gif https://s3.amazonaws.com/prod-ucs-content-store-us-east/content/pii:S0191261516302648/STRIPIN/image/gif/40f3d00c77fbd6ff7189ec98d4b39643/si108.gif si108 si108.gif gif 261 16 50 ALTIMG 1-s2.0-S0191261516302648-si109.gif https://s3-eu-west-1.amazonaws.com/prod-ucs-content-store-eu-west/content/pii:S0191261516302648/STRIPIN/image/gif/fab7b5e5ff9df0a6aa3443e912ba746e/si109.gif https://s3.amazonaws.com/prod-ucs-content-store-us-east/content/pii:S0191261516302648/STRIPIN/image/gif/fab7b5e5ff9df0a6aa3443e912ba746e/si109.gif si109 si109.gif gif 256 15 54 ALTIMG 1-s2.0-S0191261516302648-si11.gif https://s3-eu-west-1.amazonaws.com/prod-ucs-content-store-eu-west/content/pii:S0191261516302648/STRIPIN/image/gif/5942002ea59a3b1c2089ae409002cd81/si11.gif https://s3.amazonaws.com/prod-ucs-content-store-us-east/content/pii:S0191261516302648/STRIPIN/image/gif/5942002ea59a3b1c2089ae409002cd81/si11.gif si11 si11.gif gif 358 16 75 ALTIMG 1-s2.0-S0191261516302648-si111.gif https://s3-eu-west-1.amazonaws.com/prod-ucs-content-store-eu-west/content/pii:S0191261516302648/STRIPIN/image/gif/a724af2fb9b023ac14e8c5c24df0689c/si111.gif https://s3.amazonaws.com/prod-ucs-content-store-us-east/content/pii:S0191261516302648/STRIPIN/image/gif/a724af2fb9b023ac14e8c5c24df0689c/si111.gif si111 si111.gif gif 499 16 115 ALTIMG 1-s2.0-S0191261516302648-si112.gif https://s3-eu-west-1.amazonaws.com/prod-ucs-content-store-eu-west/content/pii:S0191261516302648/STRIPIN/image/gif/bb7fdf4eea780de30daab4551a1c4401/si112.gif https://s3.amazonaws.com/prod-ucs-content-store-us-east/content/pii:S0191261516302648/STRIPIN/image/gif/bb7fdf4eea780de30daab4551a1c4401/si112.gif si112 si112.gif gif 470 19 104 ALTIMG 1-s2.0-S0191261516302648-si113.gif https://s3-eu-west-1.amazonaws.com/prod-ucs-content-store-eu-west/content/pii:S0191261516302648/STRIPIN/image/gif/1544ca362baf3ad2bd9a86ab5a3376d3/si113.gif https://s3.amazonaws.com/prod-ucs-content-store-us-east/content/pii:S0191261516302648/STRIPIN/image/gif/1544ca362baf3ad2bd9a86ab5a3376d3/si113.gif si113 si113.gif gif 489 16 109 ALTIMG 1-s2.0-S0191261516302648-si12.gif https://s3-eu-west-1.amazonaws.com/prod-ucs-content-store-eu-west/content/pii:S0191261516302648/STRIPIN/image/gif/933322e9fa5b9bb1f684f74c8d1b4602/si12.gif https://s3.amazonaws.com/prod-ucs-content-store-us-east/content/pii:S0191261516302648/STRIPIN/image/gif/933322e9fa5b9bb1f684f74c8d1b4602/si12.gif si12 si12.gif gif 252 17 35 ALTIMG TRB 1742 S0191-2615(16)30264-8 10.1016/j.trb.2017.01.016 Elsevier Ltd Fig. 1 A standard network of signalized intersections along with the notation used. The nodes denote the intersections. For a link \u2113 \u2208 L , \u03c3(\u2113) denotes the signal that serves \u2113 and \u03c4(\u2113) denotes the signal immediately upstream of link \u2113. Entry links E are shown as dashed links. For all \u2113 \u2208 E , \u03c4 ( \u2113 ) = \u03f5 where the symbol \u03f5 denotes the absence of an upstream signal. There is no need to model links that exit the network. Fig. 1 Fig. 2 (a) A standard four-way intersection s with incoming links 1,2,3,4. The cycle time is divided among the incoming links according to the green splits at the intersection, which are assumed fixed. The phase offset \u03b8s \u2208 [0, 1) for the intersection is a design parameter. (b) Green splits when each link is activated sequentially where time sweeps in a counter-clockwise direction, completing one rotation each cycle period (assumed to be T = 1 ). The green/dark regions denote the time intervals when a link is activated and queued vehicles are able to move through the intersection. (c) Green splits when links 1 and 2 are activated simultaneously, then links 3 and 4 are activated simultaneously. Without loss of generality, we take \u03b3 1 = \u03b3 2 = 0 and \u03b3 3 = \u03b3 4 = 0.5 . (For interpretation of the references to colour in this figure legend, the reader is referred to the web version of this article.) Fig. 2 Fig. 3 Sinusoidal approximations of arrivals and departures. (a) A particular approximation of the arrival process on an entry link. The actual arrival process for link \u2113 \u2208 E is a pulse train, which is approximated with a sinusoid. (b) The sinusoidal approximation of the departure process at any link \u2113 \u2208 L . The amplitude is required to match A\u2113 by the periodicity assumption, and the phase offset \u03b8 \u03c3(\u2113) is a design parameter. Fig. 3 Fig. 4 Grid network case study with 9 intersections, 8 entry links, and 16 non-entry links as proposed in Gartner et al. (1975). Fig. 4 Fig. 5 Huntington Dr./Colorado Blvd. arterial corridor in Arcadia, California. The case study consists of 50 links and 13 signalized intersections. Fig. 5 Table 1 Parameters for the periodic, sinusoidal approximation of arrivals, departures, and queues. Table 1 Parameter Fraction of cycle time Cycle time T = 1 Phase offset of s \u2208 S \u03b8s Offset of arrival on \u2113 \u2208 L \u03c6 \u2113 Green split offset of \u2113 \u2208 L \u03b3\u2113 Activation offset of \u2113 \u2208 L \u03b8 \u03c3 ( \u2113 ) + \u03b3 \u2113 Queueing offset of \u2113 \u2208 L \u03be\u2113 Travel time of \u2113 \u2208 L \u03bb\u2113 Table 2 Incoming flow for grid network. All traffic is assume to travel straight through intersections so that there are no left or right turns. Table 2 Link ID Flow [veh/sec] 117 0.175 118 0.175 119 0.152 120 0.152 121 0.12 122 0.11 123 0.25 124 0.22 Table 3 Results for grid network case study and comparison to results obtained in Gartner et al. (1975). Table 3 Link ID Travel time Link Offset [sec] Peak queue [veh] Average queue [veh] [sec] Gartner SDP Gartner SDP Gartner SDP 101 18.59 21.2 17.3 3 2 0.77 0.61 102 24.79 27.6 26.4 3 2 0.75 0.62 103 18.59 63.6 69.3 13 12 6.69 6.70 104 14.61 16.4 10.7 2 2 0.68 0.68 105 24.79 46.4 59.6 11 13 3.21 5.15 106 19.48 33.6 20.4 14 2 2.99 0.67 107 14.61 17.2 13.6 2 2 0.83 0.83 108 19.48 25.2 21.2 5 2 1.64 0.82 109 28.41 23.6 32.4 2 4 1.04 1.16 110 24.35 56.4 47.6 9 3 3.28 0.92 111 15.62 28.4 8.2 9 3 2.81 1.67 112 13.39 51.6 71.8 9 3 3.70 1.16 113 24.35 18.8 a 19.6 2 2 0.77 1.14 114 13.39 50.8 a 68.9 10 6 4.04 2.91 115 28.41 42.4 27.2 10 4 2.73 1.61 116 15.62 20.8 12.0 5 3 1.85 1.67 Mean 6.81 4.06 2.36 1.77 Improvement 40.4% 25.1% a The collection of link offsets reported in Gartner et al. (1975) is not physically realizable, that is, there does not exist a set of intersection offsets that gives rise to all of the specified offsets simultaneously. To correct this error, we report slightly modified link offsets for links 113 and 114 that result in a realizable collection of link offsets. Table 4 Results for the Huntington Dr./Colorado Blvd. arterial corridor case study. Table 4 Metric Baseline Optimized Improvement Mean of peak queue lengths a , b [veh] 17.14 12.47 27.2% Mean of avg. queue lengths b [veh] 5.12 3.72 27.4% Avg. time in network [s] 127.9 116.6 8.9% a To account for stochastic fluctuations in the simulation arising from the randomly realized turn rations, the peak queue is defined to be the queue length that is surpassed by the queue process only one percent of the time. b The summation is over L \u2216 E as noted in Section 6. \u2606 This work was supported in part by California Department of Transportation (Caltrans) and in part by NSF Grant CNS-1446145. Offset optimization in signalized traffic networks via semidefinite relaxation Samuel Coogan \u204e a scoogan@ucla.edu Eric Kim b eskim@eecs.berkeley.edu Gabriel Gomes c gomes@path.berkeley.edu Murat Arcak b arcak@eecs.berkeley.edu Pravin Varaiya b varaiya@eecs.berkeley.edu a Electrical Engineering Department, University of California, Los Angeles Electrical Engineering Department University of California Los Angeles b Department of Electrical Engineering and Computer Sciences, University of California, Berkeley Department of Electrical Engineering and Computer Sciences University of California Berkeley c Partners for Advanced Transportation Technology, University of California, Berkeley Partners for Advanced Transportation Technology University of California Berkeley \u204e Corresponding author. Highlights \u2022 An approach for optimizing intersection offsets in arterial networks is proposed. \u2022 The optimization approach is posed as a convex program for reducing link queues. \u2022 The approach can accommodate networks with arbitrary topology and scales well with network size. \u2022 Two supporting case studies are provided. Abstract We study the problem of selecting offsets of the traffic signals in a network of signalized intersections to reduce queues of vehicles at all intersections. The signals in the network have a common cycle time and a fixed timing plan. It is assumed that the exogenous demands are constant or periodic with the same period as the cycle time and the intersections are under-saturated. The resulting queuing processes are periodic. These periodic processes are approximated by sinusoids. The sinusoidal approximation leads to an analytical expression of the queue lengths at every intersection as a function of the demands and the vector of offsets. The optimum offset vector is the solution of a quadratically constrained quadratic program (QCQP), which is solved via its convex semidefinite relaxation. Unlike existing techniques, our approach accommodates networks with arbitrary topology and scales well with network size. We illustrate the result in two case studies. The first is an academic example previously proposed in the literature, and the second case study consists of an arterial corridor network in Arcadia, California. 1 Introduction Systematic approaches to selecting the parameters of traffic signal controllers\u2014cycle time, green times, and intersection-to-intersection offsets\u2014have been studied for several decades Allsop (1971); Korsak (1973). Here we focus on the problem of selecting offsets for a network of signalized intersections to allow platoons of vehicles to move through the network with the least hindrance by red lights, a problem that has been considered at least since the development of SIGOP Traffic Research Corporation (1966), one of the first computer programs for signal timing. In SIGOP, link delays are modeled as a parabolic function, and random simulations are used to determine incremental adjustments to signal offsets, which provides no guarantees of optimality. Many existing algorithms for offset optimization focus on one- or two-way arterial roads (Little et al., 1981; Gomes, 2015). Perhaps the first algorithm developed for general networks was the Combination Method (Allsop, 1968; Gartner and Little, 1975), in which link delay functions were combined into a network delay function using a set of network reduction rules. The method can be reformulated in terms of Dynamic Programming. As Allsop (1968) notes, its computation and memory requirements grow rapidly. The mixed-integer formulation of the offset optimization problem was presented in Little et al. (1981), later generalized to grid networks in Gartner and Stamatiadis (2002) by adding a \u201cloop constraint\u201d, and further extended in Gartner and Stamatiadis (2004) to provide computational advantages via a network decomposition technique. These methods suffer from the computational burden of mixed-integer programs and may not scale well. The approach in Gomes (2015) optimizes offsets given a probability distribution of vehicle arrivals at each intersection but only considers two-way arterials and does not explicitly account for turning traffic. In the offset optimization algorithms referenced above, the \u2018link delay function\u2019 or LDF of every link is given as part of the data. The LDF for a link \u2113 is the delay (travel time over the link plus the queuing delay) expressed as a function \u03b4\u2113 (\u03c9\u2113 ) of the relative offset \u03c9\u2113 of the signals at the two ends of the link. It is assumed that this delay is independent of the relative offsets of all other links. Since the delay depends on the time profile of the vehicle flow over the link and since that profile in turn depends on the other offsets, it follows that \u03b4\u2113 (\u03c9\u2113 ) is a function only of the average link flow. For different levels of (average) demand, the delay will be different. An expression for the LDF assuming that the flow has the profile of a rectangular pulse is derived in Gartner et al. (1975). Lastly, Wong (1995) derives expressions for the gradient of the delay based on the TRANSYT model for use in optimizing signal timing parameters, including offsets Wong (1996). In this paper, we formulate the objective of the offset optimization problem as that of minimizing the queues at all intersections in the network, rather than of minimizing the sum of link delay functions. We approximate the flow of vehicles arriving at and departing from traffic signals as sinusoidal functions of time. The flows give rise to sinusoidal queues for which we derive closed-form analytical expressions. The problem of minimizing the average queue lengths at intersections is a non-convex, quadratically constrained quadratic program (QCQP) that is well-known to be amenable to semidefinite relaxation (Luo et al., 2010). It seems to be a coincidence that this QCQP formulation and its relaxation are mathematically analogous to recent approaches to the optimal power flow problem (Low, 2014) and the angular synchronization problem (Bandeira et al., 2014; Singer, 2011). We first apply our technique to an academic case study of a grid network with nine signalized intersections proposed in Gartner et al. (1975). Based on simulations of the network, our optimization approach reduces mean peak queue length by 40.4% and reduces mean average queue length by 25.1% compared to parameters calculated in Gartner et al. (1975). We then consider a case study arterial corridor network in Arcadia, California which is part of the Connected Corridors project at UC Berkeley (Analysis, modeling, and simulation workshop at Caltrans D7, 0000). The network contains thirteen signalized intersections, and simulation results show that our offset optimization technique reduces queue lengths by 27% and travel time by 8.9%. While these case studies are of modest size, the semidefinite formulation proposed here easily accommodates networks with up to approximately one hundred intersections. The paper is organized as follows. Section 2 introduces notational preliminaries. Section 3 presents the problem formulation and Section 4 proposes an approach to modeling traffic flow and queue evolution using sinusoids. This approach leads to the offset optimization problem studied in Section 5. We consider two case studies in Section 6 and provide concluding remarks in Section 7. This paper significantly extends the results reported in the conference version (Coogan et al., 2015) by formulating the model and our approach in the complex domain using phasor notation, which clarifies our main results, and also provides a second case study comparing our approach to previous results in the literature. 2 Preliminaries We define R \u2265 0 = { x \u2208 R \u2223 x \u2265 0 } . For complex number z \u2208 C , z* is the complex conjugate of z and \u211c{z} denotes the real part of z. We denote the imaginary unit by i. For a matrix M \u2208 C n \u00d7 m , rank(M) denotes the rank of M and MH denotes the conjugate transpose of M. If M is square, then Tr(M) denotes the trace of M. If M = M H and z H M z \u2265 0 for all z \u2208 C n , then M is positive semidefinite, denoted by M \u227d 0. M[j, k] denotes the (j, k)th entry of M. For an index set S , { x s } s \u2208 S denotes a collection of elements indexed by S . If x s \u2208 R or x s \u2208 C for each s \u2208 S , we identify { x s } s \u2208 S with the vector x \u2208 R | S | or x \u2208 C | S | for some fixed enumeration of S . 3 Problem formulation We consider a traffic network consisting of a set S of signalized intersections and a set L of links. A subset E \u2282 L of links are entry links and direct exogenous traffic onto the network. The remaining links are non-entry links. Let \u03c3 : L \u2192 S map each link to the signal that serves the queue on that link, that is, \u03c3 ( \u2113 ) = s \u2208 S if and only if signal s serves the queue on link \u2113. Symmetrically, let \u03c4 : L \u2192 S \u222a \u03f5 map each link to the signal immediately upstream of the link where the symbol \u03f5 denotes that no upstream signal exists; that is, signal \u03c4(\u2113) controls the flow of vehicles to link \u2113 and we have \u03c4 ( \u2113 ) = \u03f5 if and only if \u2113 \u2208 E . See Fig. 1 for an illustration of the notation. We emphasize that the network may contain loops. Each signal at an intersection employs a fixed time control strategy whereby a repeating sequence of nonconflicting links are activated for a fixed amount of time. The length of time of this sequence is the cycle time of the intersection which we take to be 1 time unit: Assumption 1 Common cycle time All signalized intersections have common cycle time T = 1 . Table 1 collects notation for parameters introduced subsequently that arise from this fixed cycle time. Each link \u2113 \u2208 L possesses a queue with length q \u2113 ( t ) \u2208 R \u2265 0 that evolves over time. We adopt a fluid queue model so that the queue length, arrivals, and departures are real-valued functions. Specifically, vehicles arrive at a queue from upstream links or from outside the network according to an arrival process a\u2113 (t) and depart the queue according to a departure process d\u2113 (t) which depends on the fixed time control of the signal. We describe how these processes are approximated under certain periodicity assumptions in Section 4. The queue length q\u2113 (t) then obeys the dynamics q \u02d9 \u2113 ( t ) = a \u2113 ( t ) \u2212 d \u2113 ( t ) . During a cycle, we assume that each link is activated for one contiguous interval of time (modulo a cycle length) during which vehicles depart the queue. For a signal s \u2208 S , the activation durations (i.e., green times) for the upstream links { \u2113 \u2223 \u03c3 ( \u2113 ) = s } and their sequencing are assumed to be fixed. The phase offset \u03b8s \u2208 [0, 1) for signal s \u2208 S is the offset, as a fraction of the cycle length, of the activation sequence from some global clock and is the design parameter considered here. For each link \u2113 \u2208 L , let the green split \u03b3\u2113 \u2264 [0, 1) be the time difference of the midpoint of the activation time for link \u2113 and the beginning of the offset time \u03b8 \u03c3(\u2113) 1 1 We adopt a definition of green split that slightly differs from standard definitions by defining green split with respect to the midpoint of activation windows. Our motivation for doing so is that we seek to align the midpoints of the windows of green time from the upstream to downstream signal along each link to reduce queuing. . Here, we assume that the activation time includes the yellow time and any \u201call red\u201d period. It follows that t = n + ( \u03b8 s + \u03b3 \u2113 ) for n = 0 , 1, 2, \u2026 are the time instants of the midpoint of the activation times for each link \u2113 with \u03c3 ( \u2113 ) = s . Define (1) z s = e i 2 \u03c0 \u03b8 s \u2200 s \u2208 L \u222a \u03f5 so that, instead of considering \u03b8s \u2208 [0, 1), we equivalently consider z s \u2208 C satisfying | z s | = 1 . Without loss of generality, we interpret \u03b8 \u03f5 = 0 , that is, the offset of the entry links aligns with the global clock. Example Consider signal s \u2208 S with four input links 1,2,3, and 4 as in Fig. 2 (a). A possible set of green splits is shown in Fig. 2 (b). The green bands indicate the time interval, within one period, during which each link is activated. In the top image of Fig. 2 (b), one may imagine a line sweeping counter-clockwise at a rate of one revolution per cycle time T = 1 starting from the 0 angle. When this line reaches an angle of 2\u03c0\u03b8s, a new cycle begins at the intersection. The green portion of the innermost ring indicates when link 1 is activated, etc. This signaling pattern may be found in, e.g., a four-way signaling scheme in which only one link is activated at any given time. Now suppose that links L p r i = { 1 , 2 } are activated simultaneously during the primaryphase, and then links L s e c = { 3 , 4 } are activated simultaneously during the secondaryphase as in Fig. 2 (c). This is a commonly encountered situation in which the signal consists of two phases for the two directions of travel. Without loss of generality, we assume that \u03b3 1 = \u03b3 2 = 0 . An important observation for this common case is that, regardless of the length of the green splits, we have \u03b3 3 = \u03b3 4 = 0.5 . For \u2113 , k \u2208 L , let the turn ratio \u03b2\u2113k \u2208 [0, 1] denote the fraction of vehicles that are routed to link k upon exiting link \u2113. We assume the turn ratios are given and fixed, a standard modeling assumption since turn ratios can be inferred from measured traffic flow Muralidharan et al. (2016). Clearly, \u03b2\u2113k \u2260 0 only if \u03c3 ( \u2113 ) = \u03c4 ( k ) , and (2) \u2211 k \u2208 L \u03b2 \u2113 k \u2264 1 \u2200 \u2113 \u2208 L where strict inequality in (2) implies that a fraction of the vehicles departing link \u2113 are routed off the network via an unmodeled link. We remark that our formulation is general enough to accommodate, e.g., turn pocket lanes by introducing additional links for these lanes. 4 Sinusoidal approximation of arrivals, departures, and queues To address the signal coordination problem discussed above, we assume the arrival and departure processes satisfy a periodicity assumption: Assumption 2 Periodicity assumption The network is in periodic steady state so that all arrivals, departures, and queues are periodic with period T = 1 . The analysis of a standard queuing model of the network shows that if it is under-saturated under periodic exogenous arrivals with the same period as the cycle time, then the network converges to a periodic steady state (Muralidharan et al., 2015). Thus the Periodicity Assumption is reasonable. In our problem formulation we will approximate the arrival and departure processes at a queue as sinusoids of appropriate amplitude and phase shift. An enormous advantage of the sinusoidal approximation is that sinusoidal flows from several upstream links combine into a single sinusoidal flow with appropriate magnitude and phase. In a related approach, Gartner and Deshpande rely on the periodicity assumption to calculate a Fourier series approximation to the assumed periodic link delay function based on simulated values for the link delay (Gartner and Deshpande, 2009). Here, we use the periodicity assumption to derive a tractable formulation of the offset optimization problem and then use simulation results to validate our approach. 4.1 Entry links For each \u2113 \u2208 E , we assume that the arrival of vehicles to the queue on link \u2113 at signal \u03c3(\u2113) is approximated by the function (3) a \u2113 ( t ) = A \u2113 + \u03b1 \u2113 cos ( 2 \u03c0 ( t \u2212 \u03c6 \u2113 ) ) for constants A\u2113 and \u03b1\u2113 satisfying 0 \u2264 \u03b1\u2113 \u2264 A\u2113 and \u03c6 \u2113 \u2208 [0, 1). The constant A\u2113 is the average arrival rate of vehicles to the queue on link \u2113; \u03b1\u2113 allows for periodic fluctuation in the arrival rate; \u03c6 \u2113 is the offset of the periodic arrival of vehicles to the queue on link \u2113 and includes the travel time of link \u2113. Define (4) a \u2113 = \u03b1 \u2113 e \u2212 i 2 \u03c0 \u03c6 \u2113 so that, in phasor notation, a \u2113 ( t ) = A \u2113 + \u211c { a \u2113 e i 2 \u03c0 t } . When A \u2113 = \u03b1 \u2113 , a\u2113 (t) approximates a periodic pulse arrival, denoted by a ^ \u2113 ( t ) as in Fig. 3 (a), which is often used to model the arrival of vehicle platoons. If the periodic pulse has amplitude h\u2113 and duration \u03b4\u2113 , we take A \u2113 = h \u2113 \u03b4 \u2113 so that \u222b 0 1 a \u2113 ( t ) d t = \u222b 0 1 a ^ \u2113 ( t ) d t = h \u2113 \u03b4 \u2113 . In this case, \u03c6 \u2113 is the midpoint of the arrival pulse. The departure process d\u2113 (t) for entry link \u2113 \u2208 E is determined by the signal at intersection \u03c3 ( \u2113 ) \u2208 S and must satisfy \u222b 0 1 d \u2113 ( t ) d t = \u222b 0 1 a \u2113 ( t ) d t by the Periodicity Assumption. We approximate the departure process as a shifted sinusoid so that, for all \u2113 \u2208 E , (5) d \u2113 ( t ) = A \u2113 ( 1 + cos ( 2 \u03c0 [ t \u2212 ( \u03b8 \u03c3 ( \u2113 ) + \u03b3 \u2113 ) ] ) ) (6) = A \u2113 + \u211c { d \u2113 z \u03c3 ( \u2113 ) * e i 2 \u03c0 t } for d \u2113 : = A \u2113 e \u2212 i 2 \u03c0 \u03b3 \u2113 where, as defined above, ( \u03b8 \u03c3 ( \u2113 ) + \u03b3 \u2113 ) denotes the activation offset of link \u2113 as determined by the phase offset of signal \u03c3(\u2113) and the green split of link \u2113; see Fig. 3(b). We assume that all links have adequate capacity for upstream traffic and thus do not consider blocking of traffic by downstream congestion. 4.2 Non-entry links For each link \u2113 \u2208 L \u2216 E , let \u03bb\u2113 denote the travel time of link \u2113, that is, the time it takes for a vehicle to travel along a link and join a downstream queue. We adopt a vertical queueing model as in Gartner et al. (1975); Varaiya (2013) and therefore assume the travel time is constant. When the link length is long as compared to the average queue length, this is a reasonable approximation. The approximate arrival process for the queue on link \u2113 \u2208 L \u2216 E is then (7) a \u2113 ( t ) = \u2211 k \u2208 L \u03b2 k \u2113 d k ( t \u2212 \u03bb \u2113 ) = A \u2113 + \u211c { a \u2113 z \u03c4 ( \u2113 ) * e i 2 \u03c0 t } where (8) A \u2113 = \u2211 k \u2208 L \u03b2 k \u2113 A k (9) a \u2113 = e \u2212 i 2 \u03c0 \u03bb \u2113 \u2211 k \u2208 L \u03b2 k \u2113 d \u2113 = : \u03b1 \u2113 e \u2212 i 2 \u03c0 \u03c6 \u2113 . In (7), we use the fact that \u03c3 ( k ) = \u03c4 ( \u2113 ) for any k, \u2113 such that \u03b2k\u2113 \u2260 0, and in (9), we define \u03b1\u2113 and \u03c6 \u2113 so that a \u2113 = \u03b1 \u2113 e \u2212 i 2 \u03c0 \u03c6 \u2113 . Because the departure processes at upstream links are assumed sinusoidal with period T, we obtain a sinusoidal arrival process with period T as seen in (7) that naturally and implicitly accounts for traffic arriving from multiple upstream movements, e.g., through movements and turning movements. The combined effects of vehicle platoons departing from multiple movements arriving on link \u2113 are therefore captured in the parameters A\u2113 and a \u2113 . Under the periodicity assumption, the actual arrival and departure processes are periodic. By approximating arrivals and departures as sinusoids, we may interpret our approach as considering only the fundamental harmonic of the true processes. This is a natural formulation for the offset optimization problem because there is only one variable to tune at each intersection, namely, the intersection\u2019s offset. The approximate departure process for each non-entry link \u2113 \u2208 L \u2216 E is as described above for entry links. In summary, for each link \u2113 \u2208 L , we approximate the arrival and departure process as (10) d \u2113 ( t ) = A \u2113 + \u211c { d \u2113 z \u03c3 ( \u2113 ) * e i 2 \u03c0 t } , d \u2113 = A \u2113 e \u2212 i 2 \u03c0 \u03b3 \u2113 (11) a \u2113 ( t ) = A \u2113 + \u211c { a \u2113 z \u03c4 ( \u2113 ) * e i 2 \u03c0 t } , a \u2113 = \u03b1 \u2113 e \u2212 i 2 \u03c0 \u03c6 \u2113 where A\u2113, \u03b1\u2113, \u03b3\u2113 , and \u03c6 \u2113 do not depend on the offsets { \u03b8 s } s \u2208 S , that is, a \u2113 and d \u2113 are fixed quantities obtained from the problem data independent of the optimization variables z s for s \u2208 S . 4.3 Queueing process The approximate queueing process q(t) that results from the sinusoidal approximation of arrivals and departures satisfies (12) q \u02d9 \u2113 ( t ) = a \u2113 ( t ) \u2212 d \u2113 ( t ) = \u211c { ( a \u2113 z \u03c4 ( \u2113 ) * \u2212 d \u2113 z \u03c3 ( \u2113 ) * ) e i 2 \u03c0 t } = Q \u2113 cos ( 2 \u03c0 ( t \u2212 \u03be \u2113 ) ) where (13) Q \u2113 2 = | a \u2113 z \u03c4 ( \u2113 ) * \u2212 d \u2113 z \u03c3 ( \u2113 ) * | = A \u2113 2 + \u03b1 \u2113 2 \u2212 2 A \u2113 \u03b1 \u2113 cos ( 2 \u03c0 ( \u03b8 \u03c4 ( \u2113 ) + \u03c6 \u2113 ) \u2212 2 \u03c0 ( \u03b8 \u03c3 ( \u2113 ) + \u03b3 \u2113 ) ) and \u03be\u2113 is the offset of the queueing process; here, we do not require an explicit expression for \u03be\u2113 . It follows by integration that q \u2113 ( t ) = 1 2 \u03c0 Q \u2113 sin ( 2 \u03c0 ( t \u2212 \u03be \u2113 ) ) + C \u2113 where C\u2113 is the average queue length on link \u2113. Under the assumption that all queues are emptied in each cycle, which is the case if the demand is strictly feasible (Muralidharan et al., 2015; Varaiya, 2013), we have C \u2113 = Q \u2113 / ( 2 \u03c0 ) . 4.4 Performance metric For link \u2113 \u2208 L , consider the performance metric J \u2113 \u225c Q \u2113 2 . J\u2113 is an approximate measure of the squared average queue length on link \u2113 and the maximum squared queue length on link \u2113 up to a constant factor. Since A\u2113, \u03b1\u2113 do not depend on the signal offsets, minimizing J\u2113 is equivalent to maximizing the normalized reward function (14) R \u2113 = A \u2113 \u03b1 \u2113 cos ( 2 \u03c0 ( \u03b8 \u03c4 ( \u2113 ) + \u03c6 \u2113 ) \u2212 2 \u03c0 ( \u03b8 \u03c3 ( \u2113 ) + \u03b3 \u2113 ) ) (15) = \u211c { d \u2113 a \u2113 * z \u03c4 ( \u2113 ) z \u03c3 ( \u2113 ) * } . The interpretation of maximizing R\u2113 is clear: for each link, we wish to minimize the difference between the arrival offset ( \u03b8 \u03c4 ( \u2113 ) + \u03c6 \u2113 ) and the departure offset ( \u03b8 \u03c3 ( \u2113 ) + \u03b3 \u2113 ) . Choosing \u03b8 \u03c3 ( \u2113 ) + \u03b3 \u2113 = \u03b8 \u03c4 ( \u2113 ) + \u03c6 \u2113 optimizes the offset of signals \u03c3(\u2113) and \u03c4(\u2113) from the perspective of reducing the queue length on link \u2113; the difficulty arises in choosing the offsets for all signals simultaneously, as it is generally not possible to maximize R\u2113 for all \u2113 \u2208 L . Efficiently computing an optimal tradeoff is addressed in the next section. 5 Optimizing traffic signal offsets 5.1 Offset optimization problem and a convex relaxation We propose \u2211 \u2113 \u2208 L R \u2113 as the global objective function for the network and thus pose the following by substituting (14): Offset optimization problem: (16) maximize z s \u2208 C , s \u2208 S \u222a \u03f5 \u2211 \u2113 \u2208 L \u211c { d \u2113 a \u2113 * z \u03c4 ( \u2113 ) z \u03c3 ( \u2113 ) * } (17) subject to | z s | = 1 for all s \u2208 S \u222a \u03f5 . The constraint | z s | = 1 ensures there exists offset \u03b8s such that z s = e i 2 \u03c0 \u03b8 s , thus optimizing over z s for s \u2208 S subject to | z s | = 1 is equivalent to optimizing over the offset variables \u03b8s \u2208 [0, 1) for s \u2208 S . In Sections 3 and 4, we have assumed \u03b8 \u03f5 = 0 . Here, we include \u03b8 \u03f5 as a decision variable in the optimization problem for convenience; this is clearly acceptable since the objective function in (16) is invariant to a shift of all \u03b8s , s \u2208 S \u222a \u03f5 . In particular, given a solution to (16), we may shift all phases by the nonzero \u03b8 \u03f5 to obtain an alternative solution as is done below in (23) 2 2 Note that the \u201cloop constraint\u201d, which requires the sum of offset differences along any cycle in the network to sum to an integer multiple of the cycle time (Gartner and Stamatiadis, 2002), is automatically satisfied by our choice of z. . The optimization problem (16) and (17) is a quadratically constrained, quadratic optimization problem (QCQP). To see this, let 3 3 The set L s \u2192 u may have cardinality greater than one if, e.g., we model turn pocket lanes with additional links as remarked above. L s \u2192 u = { \u2113 \u2208 L \u2223 \u03c4 ( \u2113 ) = s and \u03c3 ( \u2113 ) = u } be the set of links connecting intersection s to u and define W \u2208 C ( | S | + 1 ) \u00d7 ( | S | + 1 ) elementwise as follows: (18) W [ u , s ] = 1 2 ( \u2211 \u2113 \u2208 L s \u2192 u d \u2113 a \u2113 * + \u2211 \u2113 \u2208 L u \u2192 s d \u2113 * a \u2113 ) . Note that W is Hermitian, that is, W = W H . Let z = { z s } s \u2208 S \u222a \u03f5 so that (19) \u2211 \u2113 \u2208 L \u211c { d \u2113 a \u2113 * z \u03c4 ( \u2113 ) z \u03c3 ( \u2113 ) * } = z H W z . In general, the QCQP in (16) and (17) is not convex; the nonconvexity arises from both the cost function z H W z and the constraints | z s | = 1 which can be written as z H M s z = 1 where M s \u2208 C ( | S | + 1 ) \u00d7 ( | S | + 1 ) and satisfies M s [ s , s ] = 1 and M s [ s , u ] = 0 for s \u2260 u. Here, we suggest a standard relaxation for approximately solving (16) using invariance of the trace operator under cyclic permutations so that z H W z = Tr ( z H W z ) = Tr ( W zz H ) . We thus consider the following convex, semidefinite program (SDP) over Z \u2208 C ( | S | + 1 ) \u00d7 ( | S | + 1 ) : (20) maximize Z Tr ( W Z ) (21) subject to Z [ s , s ] = 1 , s \u2208 S \u222a \u03f5 (22) Z \u2ab0 0 A positive semidefinite matrix Z is factorable as Z = z z H if and only if rank ( Z ) = 1 . Thus, a solution Z \u22c6 of (20)\u2013(22) provides a solution z \u22c6 to (16) and (17) for which Z \u2606 = z \u2606 ( z \u2606 ) H if and only if rank ( Z \u2606 ) = 1 . There exist known cases for which this condition holds. For example, it is known that certain sparsity structure in W implies rank ( Z \u2606 ) = 1 and therefore leads to exact recovery of an optimal solution (Sojoudi and Lavaei, 2014). Sparsity in W translates to topological requirements on the traffic network. For instance, if the sparsity structure in W corresponds to a tree graph, then there exists a rank-one solution to (20)\u2013(22) (Sojoudi and Lavaei, 2014). In traffic networks, a tree structure means that there are no cycles in the undirected network obtained by ignoring the directionality of the traffic flow and removing duplicate links between intersections. Furthermore, for cases when the optimal Z \u22c6 is not rank-one, there exists randomized techniques for obtaining a feasible solution to (16) and (17) that is guaranteed to be close to optimal in expectation. For example, So et al. (2007) proposes a technique for estimating a solution based on the Cholesky factorization of Z \u22c6. Remarkably, for many problems of practical interest, it has been empirically observed that there exists a rank-one solution to (20)\u2013(22) even in cases which are not known to guarantee this rank condition (Bandeira et al., 2014), and thus we obtain an optimal solution to the offset optimization problem. In both case studies below, we obtain a solution that is rank-one and therefore exactly recover an optimal solution to the original offset optimization problem in (16) and (17). Let z \u2606 = { z \u2606 s } s \u2208 S \u222a \u03f5 be the result of solving (20)\u2013(22) obtained either as an exact solution to (16) and (17) if Z \u22c6 is rank-one or as an approximate solution otherwise. Then we obtain intersection offsets as (23) \u03b8 s = 1 2 \u03c0 ( \u2220 z \u2606 s \u2212 \u2220 z \u2606 \u03f5 ) where \u2220 denotes angle (in radians) in the complex plane. If there exists s \u2208 S \u222a \u03f5 such that W [ s , u ] = W [ u , s ] = 0 for all u \u2208 S , then z s does not appear in the objective of (16) and the decision variables z s may be removed from the optimization problem prior to the convex relaxation. For example, if \u03b1 \u2113 = 0 for all \u2113 \u2208 E , as is in the case studies below where vehicles are assumed to arrive at entry links as a steady stream, then z \u03f5 may be removed from the optimization problem and we can arbitrarily take \u2220 z \u2606 \u03f5 = 0 in (23). 6 Case studies We provide two case studies. The first case study considers the grid network proposed in Gartner et al. (1975), and we compare our results to those reported there. The second case study considers a real arterial corridor in Arcadia, California. 6.1 Grid network We first consider the grid network shown in Fig. 4 . This example appears in Gartner et al. (1975) and consists of 9 intersection, 8 entry links, and 16 non-entry links. In Gartner et al. (1975), it is assumed that all traffic moves straight at intersections and there are no turns, and we adopt the same assumption here in order for our results to be comparable to those reported in Gartner et al. (1975). We note that our methodology would apply without any modification to the case with turning traffic. Table 2 contains the traffic flow at the entry links. In Gartner et al. (1975), the offsets are optimized using a mixed integer formulation with the goal of minimizing a weighted sum of link performance functions which is intended to capture the average delay per vehicle in the network. The performance function is approximated with a piecewise linear function, and the mixed integer optimization framework implies that the methodology does not scale well. Here, we compare the results reported in Gartner et al. (1975) with results obtained using the offset optimization scheme proposed above. As it is assumed that traffic at the entry links arrives at the network in a steady stream, we have that \u03b1 \u2113 = 0 for all \u2113 \u2208 E , and A\u2113 is equal to the average flow in Table 2. We thus omit z \u03f5 from the optimization problem as remarked above. The cycle time of the network is 80 s. We solve the convex semidefinite optimization problem (20)\u2013(22) using the python package CVXOPT Andersen et al. (2015) which returns an optimal Z \u22c6 in 27.4 ms on a standard laptop. For this case study, CVXOPT returned Z \u22c6 such that rank ( Z \u2606 ) = 1 , that is, we are able to obtain a global solution to the original nonconvex problem (16) and (17) by factoring Z \u2606 = z \u2606 ( z \u2606 ) H . This solution is optimal with respect to the performance metric and cost function defined in (14)\u2013(17). SDP solvers such as CVXOPT use standard interior point algorithms to obtain the optimal solution in polynomial time. In Table 3 , we report the results of our optimization and compare to the results in Gartner et al. (1975). Because each link receives flow upstream from only one link, it is possible to define a link offset that is the difference between the time of activation of a link at an intersection and the time of activation for the same direction of traffic at the upstream link. We measure link offset with respect to the midpoint of the green times at each intersection. In Gartner et al. (1975), the link offset is measured with respect to the beginning of the green time, thus the link offsets in Table 3 for \u201cGartner\u201d differ from the numbers in Gartner et al. (1975) but represent the same collection of signal offsets. The green times for each link are found in Gartner et al. (1975). To obtain good traffic progression, we desire the link offsets to be close to the travel times for each link. To compare our results with the results in Gartner et al. (1975), we simulate the network using the PointQ simulator (Lioris et al., 2014), a mesoscopic simulation environment developed at UC Berkeley. The simulator is event driven and models individual vehicles in the network. In the simulation, each vehicle travels along the links and joins finite capacity queues at intersections. If a link\u2019s capacity is exceeded, the vehicle is held at the preceding queue, and thus our simulator captures queue spillback effects. In addition, vehicles move through intersections at a specified saturation rate when queues are served. For this case study, we use the saturation rates and green times reported in Gartner et al. (1975). The interarrival time for vehicles at entry links is determined by the flows in Table 2. In Table 3, we report the link offset, peak queue length, and average queue length for each non-entry link in the network using the offsets from Gartner et al. (1975) under the heading \u201cGartner\u201d and using the offsets obtained with our optimization strategy under the heading \u201cSDP\u201d. Note that, because vehicles arrive as a steady stream at entry links, the peak and average queues of entry links are unaffected by the choice of offsets. The offset optimization approach proposed in this paper improves the mean peak queue by 40.4% and the mean average queue by 25.1%. By adopting the assumptions in Gartner et al. (1975), we are able to compare our results to those in the literature, however these assumptions are restrictive. In the next case study, we consider an actual traffic network for which real data are available. 6.2 Arterial corridor in Arcadia, California We next consider the Huntington Dr./Colorado Blvd. arterial corridor in Arcadia, California shown in Fig. 5 that is adjacent to Interstate 210. The network comprises 50 links and 13 signalized intersections. Traffic demand and empirical turn ratios were obtained from several sources as part of the Connected Corridors project at UC Berkeley Analysis, modeling, and simulation workshop at Caltrans D7. The signalized intersections operate with fixed-time policies and hence with fixed green splits. In actuality, 11 of the 13 signalized intersections possess a common cycle time of 120 s; the remaining two intersections operate with cycle times of 90 s and 145 s. Our analysis requires a common cycle time for all intersections, and thus we have scaled the fixed green splits for these two intersections so that all signalized intersections operate with a common cycle time of 120 s for our study. We refer to this scenario, where phase offsets are obtained from given phase plans, as the baseline scenario in Table 4 . Twenty-seven of the 50 links constitute the two-way arterial along Huntington Dr. and Colorado Blvd. to the entry ramp of I-210 along Michillinda Avenue. The remaining links direct exogenous traffic onto the network at intersections and constitute E . The exogenous flows for the two entry links corresponding to the main arterial are 1100 vehicles per hour (vph) and 2000 vph. The exogenous flows for the remaining 21 entry links range from 93 vph to 969 vph with an average of 443 vph. Moreover, the turning ratio of traffic that turns onto the main arterial corridor from other entry links ranges from 7% to 93%, and thus this additional traffic is significant. Therefore, traditional techniques that aim only to maximum the greenband along the arterial, such as Gomes (2015), are insufficient for this case study. We assume vehicles arrive as a steady stream to all links \u2113 \u2208 E , that is, \u03b1 \u2113 = 0 for all \u2113 \u2208 E and thus remove z \u03f5 from the optimization problem. We solve (20)\u2013(22) using the MATLAB-based CVX package (Grant and Boyd, 2014), which returns an optimal Z \u22c6 in 0.37 s on a standard laptop (we could also use CVXOPT, as in the previous case study). As in the previous case study, CVX returned Z \u22c6 such that rank ( Z \u2606 ) = 1 so that we are able to obtain an exact solution to (16) and (17) with the factorization Z \u2606 = z \u2606 ( z \u2606 ) H . Unlike the previous case study, we are guaranteed to obtain an optimal Z \u22c6 that is rank-one because the underlying graph structure is acyclic for which the relaxation has been shown to be exact (Sojoudi and Lavaei, 2014); as remarked above, when determining the \u201cunderlying graph structure\u201d, we only consider the existence of a link between a pair of signals and not the direction of travel. In Table 4, we refer to the scenario where phase offsets are the optimized phase offsets as the optimized scenario. To evaluate the performance of the optimized phase offsets, we again simulate the network using the PointQ simulator. Vehicles execute turn movements which are randomly realized according to fixed turn ratios. The simulation is run for a sufficiently long time period so that stochastic fluctuations are negligible. Results of this simulation are shown in Table 4. We see an improvement of approximately 27% for both the mean peak queue lengths and the mean average queue lengths on links L \u2216 E . 7 Conclusions We have developed a scalable approximation algorithm to the offset optimization problem in arbitrary network topologies. Despite the simplifying assumptions in the problem formulation, the case study simulations demonstrated a significant reduction in the queue lengths. Future work will investigate robust and stochastic generalizations which are important when considering, for example, a distribution of travel times for each link. In addition, a weighted objective function may be used to, e.g., encourage short queues on short links to prevent congestion and is another direction for future research. Additionally, we will consider accommodating different cycle lengths throughout the network. For example, it is natural to consider the case when each cycle time is an integer multiple of some common cycle time. Furthermore, while standard implementations of SDP solvers are able to accommodate on the order of 100 intersections, larger networks require alternative techniques. Future research will apply new algorithms for solving low-rank semidefinite programs and will further study distributed optimization methods such as ADMM (Boyd et al., 2011) that will allow our approach to apply at city-wide scales. Reducing queue lengths is the explicit performance metric employed in this paper and results in a number of direct benefits (e.g., reduced emissions and likelihood of accidents due to reduced speed oscillations, and reduced \u201cwasted green time\u201d caused by downstream congestion that blocks flow). Reduced queue lengths also afford proximate improvement in other metrics. For example, in the arterial corridor case study, the offset optimization procedure results in decreased travel time of nearly 9% for all vehicles in the network. Future research will further investigate the connection between offset optimization and additional metrics, particularly as it relates to the \u201cbandwidth\u201d maximization problem (Gomes, 2015). References Allsop, 1968 R.E. Allsop Selection of offsets to minimize delay to traffic in a network controlled by fixed-time signals Transp. Sci. 2 1 1968 1 13 Allsop, 1971 R.E. Allsop Delay-minimizing settings for fixed-time traffic signals at a single road junction IMA J. Appl. Math. 8 2 1971 164 185 Andersen, Dahl, Vandenberghe, 2015 M. Andersen J. Dahl L. Vandenberghe CVXOPT: a python package for convex optimization 2015 Cvxopt.org Analysis, modeling, and simulation workshop at Caltrans D7 Analysis, modeling, and simulation workshop at Caltrans D7. www.connected-corridors.berkeley.edu/analysis-modeling-and-simulation-workshop-caltrans-d7-0. Bandeira, Boumal, Singer Bandeira, A. S., Boumal, N., Singer, A., 2014. Tightness of the maximum likelihood semidefinite relaxation for angular synchronization. arXiv preprint, arXiv:1411.3272. Boyd, Parikh, Chu, Peleato, Eckstein, 2011 S. Boyd N. Parikh E. Chu B. Peleato J. Eckstein Distributed optimization and statistical learning via the alternating direction method of multipliers Found. Trends Mach. Learn. 3 1 2011 1 122 Coogan, Gomes, Kim, Arcak, Varaiya, 2015 S. Coogan G. Gomes E. Kim M. Arcak P. Varaiya Offset optimization for a network of signalized intersections via semidefinite relaxation IEEE Conference on Decision and Control 2015 2187 2192 Gartner, Little, 1975 N. Gartner J. Little The generalized combination method for area traffic control Transp. Res. Rec. 1975 58 69 Gartner, Stamatiadis, 2002 N. Gartner C. Stamatiadis Arterial-based control of traffic flow in urban grid networks Math. Comput. Model. 35 2002 657 671 Gartner, Stamatiadis, 2004 N. Gartner C. Stamatiadis Progression optimization featuring arterial and route based priority signal networks J. Intell. Transp. Syst. Technol. Plann. Oper. 8:2 2004 77 86 Gartner, Deshpande, 2009 N.H. Gartner R. Deshpande Harmonic analysis and optimization of traffic signal systems Transportation and Traffic Theory 2009: Golden Jubilee 2009 Springer 345 364 Gartner, Little, Gabbay, 1975 N.H. Gartner J.D. Little H. Gabbay Optimization of traffic signal settings by mixed-integer linear programming: part i: the network coordination problem Transp. Sci. 9 4 1975 321 343 Gomes, 2015 G. Gomes Bandwidth maximization using vehicle arrival functions IEEE Trans. Intell. Transp. Syst. 16 4 2015 1977 1988 10.1109/TITS.2014.2387731 Grant, Boyd Grant, M., Boyd, S., 2014. CVX: Matlab software for disciplined convex programming, version 2.1. http://cvxr.com/cvx. Korsak, 1973 A. Korsak An algorithm for globally-optimal nonlinear-cost multidimensional flows in networks and some special applications Oper. Res. 21 1 1973 225 239 Lioris, Kurzhanskiy, Triantafyllos, Varaiya Lioris, J., Kurzhanskiy, A., Triantafyllos, D., Varaiya, P., 2014. Control experiments for a network of signalized intersections using the \u2018.Q\u2019. 12th IFAC-IEEE Workshop on Discrete Event Systems, Ecole Normale Superieure de Cachan, France. Little, Kelson, Gartner, 1981 J. Little M. Kelson N. Gartner MAXBAND: a versatile program for setting signals on arteries and triangular networks Transp. Res. Rec. 795 1981 Low, 2014 S. Low Convex relaxation of optimal power flow part i: formulations and equivalence IEEE Trans. Control Netw. Syst. 1 1 2014 15 27 10.1109/TCNS.2014.2309732 Luo, Ma, So, Ye, Zhang, 2010 Z.-Q. Luo W.-K. Ma A.-C. So Y. Ye S. Zhang Semidefinite relaxation of quadratic optimization problems Sig. Process. Mag. IEEE 27 3 2010 20 34 Muralidharan, Coogan, Flores, Varaiya, 2016 A. Muralidharan S. Coogan C. Flores P. Varaiya Management of intersections with multi-modal high-resolution data Transp. Res. Part C 68 2016 101 112 Muralidharan, Pedarsani, Varaiya, 2015 A. Muralidharan R. Pedarsani P. Varaiya Analysis of fixed-time control Transp. Res. Part B 73 0 2015 81 90 http://dx.doi.org/10.1016/j.trb.2014.12.002 Singer, 2011 A. Singer Angular synchronization by eigenvectors and semidefinite programming Appl. Comput. Harmon. Anal. 30 2011 20 36 So, Zhang, Ye, 2007 A.M.-C. So J. Zhang Y. Ye On approximating complex quadratic optimization problems via semidefinite programming relaxations Math. Program. 110 1 2007 93 110 Sojoudi, Lavaei, 2014 S. Sojoudi J. Lavaei Exactness of semidefinite relaxations for nonlinear optimization problems with underlying graph structure SIAM J. Optim. 24 4 2014 1746 1778 10.1137/130915261 Traffic Research Corporation, 1966 Traffic Research Corporation SIGOP: Traffic Signal Optimization Program: A Computer Program to Calculate Optimum Coordination in a Grid Network of Synchronized Traffic Signals 1966 Traffic Research Corp. Varaiya, 2013 P. Varaiya The max-pressure controller for arbitrary networks of signalized intersections Advances in Dynamic Network Modeling in Complex Transportation Systems 2013 Springer 27 66 Wong, 1995 S. Wong Derivatives of performance index for the traffic model from TRANSYT Transp. Res. B 29B 5 1995 303 327 Wong, 1996 S. Wong Group-based optimization of signal timings using the TRANSYT traffic model Transp. Res. B 30 3 1996 217 244", "scopus-id": "85012097947", "coredata": {"eid": "1-s2.0-S0191261516302648", "dc:description": "Abstract We study the problem of selecting offsets of the traffic signals in a network of signalized intersections to reduce queues of vehicles at all intersections. The signals in the network have a common cycle time and a fixed timing plan. It is assumed that the exogenous demands are constant or periodic with the same period as the cycle time and the intersections are under-saturated. The resulting queuing processes are periodic. These periodic processes are approximated by sinusoids. The sinusoidal approximation leads to an analytical expression of the queue lengths at every intersection as a function of the demands and the vector of offsets. The optimum offset vector is the solution of a quadratically constrained quadratic program (QCQP), which is solved via its convex semidefinite relaxation. Unlike existing techniques, our approach accommodates networks with arbitrary topology and scales well with network size. We illustrate the result in two case studies. The first is an academic example previously proposed in the literature, and the second case study consists of an arterial corridor network in Arcadia, California.", "openArchiveArticle": "false", "prism:coverDate": "2017-06-30", "openaccessUserLicense": null, "prism:aggregationType": "Journal", "prism:url": "https://api.elsevier.com/content/article/pii/S0191261516302648", "dc:creator": [{"@_fa": "true", "$": "Coogan, Samuel"}, {"@_fa": "true", "$": "Kim, Eric"}, {"@_fa": "true", "$": "Gomes, Gabriel"}, {"@_fa": "true", "$": "Arcak, Murat"}, {"@_fa": "true", "$": "Varaiya, Pravin"}], "link": [{"@_fa": "true", "@rel": "self", "@href": "https://api.elsevier.com/content/article/pii/S0191261516302648"}, {"@_fa": "true", "@rel": "scidir", "@href": "https://www.sciencedirect.com/science/article/pii/S0191261516302648"}], "dc:format": "application/json", "openaccessType": null, "pii": "S0191-2615(16)30264-8", "prism:volume": "100", "prism:publisher": "Elsevier Ltd.", "dc:title": "Offset optimization in signalized traffic networks via semidefinite relaxation", "prism:copyright": "\u00a9 2017 Elsevier Ltd. All rights reserved.", "openaccess": "0", "prism:issn": "01912615", "openaccessArticle": "false", "prism:publicationName": "Transportation Research Part B: Methodological", "openaccessSponsorType": null, "prism:pageRange": "82-92", "prism:endingPage": "92", "prism:coverDisplayDate": "June 2017", "prism:doi": "10.1016/j.trb.2017.01.016", "prism:startingPage": "82", "dc:identifier": "doi:10.1016/j.trb.2017.01.016", "openaccessSponsorName": null}, "objects": {"object": [{"@category": "thumbnail", "@height": "134", "@width": "219", "@_fa": "true", "$": "https://api.elsevier.com/content/object/eid/1-s2.0-S0191261516302648-gr1.sml?httpAccept=%2A%2F%2A", "@multimediatype": "GIF image file", "@type": "IMAGE-THUMBNAIL", "@size": "7244", "@ref": "gr1", "@mimetype": "image/gif"}, {"@category": "thumbnail", "@height": "101", "@width": "219", "@_fa": "true", "$": "https://api.elsevier.com/content/object/eid/1-s2.0-S0191261516302648-gr2.sml?httpAccept=%2A%2F%2A", "@multimediatype": "GIF image file", "@type": "IMAGE-THUMBNAIL", "@size": "9032", "@ref": "gr2", "@mimetype": "image/gif"}, {"@category": "thumbnail", "@height": "140", "@width": "219", "@_fa": "true", "$": "https://api.elsevier.com/content/object/eid/1-s2.0-S0191261516302648-gr3.sml?httpAccept=%2A%2F%2A", "@multimediatype": "GIF image file", "@type": "IMAGE-THUMBNAIL", "@size": "6931", "@ref": "gr3", "@mimetype": "image/gif"}, {"@category": "thumbnail", "@height": "164", "@width": "164", "@_fa": "true", "$": "https://api.elsevier.com/content/object/eid/1-s2.0-S0191261516302648-gr4.sml?httpAccept=%2A%2F%2A", "@multimediatype": "GIF image file", "@type": "IMAGE-THUMBNAIL", "@size": "7448", "@ref": "gr4", "@mimetype": "image/gif"}, {"@category": "thumbnail", "@height": "81", "@width": "219", "@_fa": "true", "$": "https://api.elsevier.com/content/object/eid/1-s2.0-S0191261516302648-gr5.sml?httpAccept=%2A%2F%2A", "@multimediatype": "GIF image file", "@type": "IMAGE-THUMBNAIL", "@size": "10322", "@ref": "gr5", "@mimetype": "image/gif"}, {"@category": "standard", "@height": "150", "@width": "244", "@_fa": "true", "$": "https://api.elsevier.com/content/object/eid/1-s2.0-S0191261516302648-gr1.jpg?httpAccept=%2A%2F%2A", "@multimediatype": "JPEG image file", "@type": "IMAGE-DOWNSAMPLED", "@size": "11819", "@ref": "gr1", "@mimetype": "image/jpeg"}, {"@category": "standard", "@height": "302", "@width": "654", "@_fa": "true", "$": "https://api.elsevier.com/content/object/eid/1-s2.0-S0191261516302648-gr2.jpg?httpAccept=%2A%2F%2A", "@multimediatype": "JPEG image file", "@type": "IMAGE-DOWNSAMPLED", "@size": "51510", "@ref": "gr2", "@mimetype": "image/jpeg"}, {"@category": "standard", "@height": "240", "@width": "375", "@_fa": "true", "$": "https://api.elsevier.com/content/object/eid/1-s2.0-S0191261516302648-gr3.jpg?httpAccept=%2A%2F%2A", "@multimediatype": "JPEG image file", "@type": "IMAGE-DOWNSAMPLED", "@size": "19830", "@ref": "gr3", "@mimetype": "image/jpeg"}, {"@category": "standard", "@height": "280", "@width": "280", "@_fa": "true", "$": "https://api.elsevier.com/content/object/eid/1-s2.0-S0191261516302648-gr4.jpg?httpAccept=%2A%2F%2A", "@multimediatype": "JPEG image file", "@type": "IMAGE-DOWNSAMPLED", "@size": "19976", "@ref": "gr4", "@mimetype": "image/jpeg"}, {"@category": "standard", "@height": "208", "@width": "563", "@_fa": "true", "$": "https://api.elsevier.com/content/object/eid/1-s2.0-S0191261516302648-gr5.jpg?httpAccept=%2A%2F%2A", "@multimediatype": "JPEG image file", "@type": "IMAGE-DOWNSAMPLED", "@size": "30193", "@ref": "gr5", "@mimetype": "image/jpeg"}, {"@category": "high", "@height": "662", "@width": "1080", "@_fa": "true", "$": "https://api.elsevier.com/content/object/eid/1-s2.0-S0191261516302648-gr1_lrg.jpg?httpAccept=%2A%2F%2A", "@multimediatype": "JPEG image file", "@type": "IMAGE-HIGH-RES", "@size": "54302", "@ref": "gr1", "@mimetype": "image/jpeg"}, {"@category": "high", "@height": "1338", "@width": "2897", "@_fa": "true", "$": "https://api.elsevier.com/content/object/eid/1-s2.0-S0191261516302648-gr2_lrg.jpg?httpAccept=%2A%2F%2A", "@multimediatype": "JPEG image file", "@type": "IMAGE-HIGH-RES", "@size": "360122", "@ref": "gr2", "@mimetype": "image/jpeg"}, {"@category": "high", "@height": "1063", "@width": "1661", "@_fa": "true", "$": "https://api.elsevier.com/content/object/eid/1-s2.0-S0191261516302648-gr3_lrg.jpg?httpAccept=%2A%2F%2A", "@multimediatype": "JPEG image file", "@type": "IMAGE-HIGH-RES", "@size": "120895", "@ref": "gr3", "@mimetype": "image/jpeg"}, {"@category": "high", "@height": "1240", "@width": "1240", "@_fa": "true", "$": "https://api.elsevier.com/content/object/eid/1-s2.0-S0191261516302648-gr4_lrg.jpg?httpAccept=%2A%2F%2A", "@multimediatype": "JPEG image file", "@type": "IMAGE-HIGH-RES", "@size": "113742", "@ref": "gr4", "@mimetype": "image/jpeg"}, {"@category": "high", "@height": "922", "@width": "2492", "@_fa": "true", "$": "https://api.elsevier.com/content/object/eid/1-s2.0-S0191261516302648-gr5_lrg.jpg?httpAccept=%2A%2F%2A", "@multimediatype": "JPEG image file", "@type": "IMAGE-HIGH-RES", "@size": "251733", "@ref": "gr5", "@mimetype": "image/jpeg"}, {"@category": "thumbnail", "@height": "14", "@width": "45", "@_fa": "true", "$": "https://api.elsevier.com/content/object/eid/1-s2.0-S0191261516302648-si10.gif?httpAccept=%2A%2F%2A", "@multimediatype": "GIF image file", "@type": "ALTIMG", "@size": "235", "@ref": "si10", "@mimetype": "image/gif"}, {"@category": "thumbnail", "@height": "13", "@width": "14", "@_fa": "true", "$": "https://api.elsevier.com/content/object/eid/1-s2.0-S0191261516302648-si20.gif?httpAccept=%2A%2F%2A", "@multimediatype": "GIF image file", "@type": "ALTIMG", "@size": "151", "@ref": "si20", "@mimetype": "image/gif"}, {"@category": "thumbnail", "@height": "13", "@width": "114", "@_fa": "true", "$": "https://api.elsevier.com/content/object/eid/1-s2.0-S0191261516302648-si30.gif?httpAccept=%2A%2F%2A", "@multimediatype": "GIF image file", "@type": "ALTIMG", "@size": "400", "@ref": "si30", "@mimetype": "image/gif"}, {"@category": "thumbnail", "@height": "16", "@width": "58", "@_fa": "true", "$": "https://api.elsevier.com/content/object/eid/1-s2.0-S0191261516302648-si40.gif?httpAccept=%2A%2F%2A", "@multimediatype": "GIF image file", "@type": "ALTIMG", "@size": "233", "@ref": "si40", "@mimetype": "image/gif"}, {"@category": "thumbnail", "@height": "17", "@width": "72", "@_fa": "true", "$": "https://api.elsevier.com/content/object/eid/1-s2.0-S0191261516302648-si60.gif?httpAccept=%2A%2F%2A", "@multimediatype": "GIF image file", "@type": "ALTIMG", "@size": "351", "@ref": "si60", "@mimetype": "image/gif"}, {"@category": "thumbnail", "@height": "24", "@width": "564", "@_fa": "true", "$": "https://api.elsevier.com/content/object/eid/1-s2.0-S0191261516302648-si70.gif?httpAccept=%2A%2F%2A", "@multimediatype": "GIF image file", "@type": "ALTIMG", "@size": "2212", "@ref": "si70", "@mimetype": "image/gif"}, {"@category": "thumbnail", "@height": "41", "@width": "275", "@_fa": "true", "$": "https://api.elsevier.com/content/object/eid/1-s2.0-S0191261516302648-si80.gif?httpAccept=%2A%2F%2A", "@multimediatype": "GIF image file", "@type": "ALTIMG", "@size": "1634", "@ref": "si80", "@mimetype": "image/gif"}, {"@category": "thumbnail", "@height": "16", "@width": "101", "@_fa": "true", "$": "https://api.elsevier.com/content/object/eid/1-s2.0-S0191261516302648-si90.gif?httpAccept=%2A%2F%2A", "@multimediatype": "GIF image file", "@type": "ALTIMG", "@size": "440", "@ref": "si90", "@mimetype": "image/gif"}, {"@category": "thumbnail", "@height": "16", "@width": "51", "@_fa": "true", "$": "https://api.elsevier.com/content/object/eid/1-s2.0-S0191261516302648-si1.gif?httpAccept=%2A%2F%2A", "@multimediatype": "GIF image file", "@type": "ALTIMG", "@size": "251", "@ref": "si1", "@mimetype": "image/gif"}, {"@category": "thumbnail", "@height": "15", "@width": "69", "@_fa": "true", "$": "https://api.elsevier.com/content/object/eid/1-s2.0-S0191261516302648-si50.gif?httpAccept=%2A%2F%2A", "@multimediatype": "GIF image file", "@type": "ALTIMG", "@size": "306", "@ref": "si50", "@mimetype": "image/gif"}, {"@category": "thumbnail", "@height": "18", "@width": "34", "@_fa": "true", "$": "https://api.elsevier.com/content/object/eid/1-s2.0-S0191261516302648-si100.gif?httpAccept=%2A%2F%2A", "@multimediatype": "GIF image file", "@type": "ALTIMG", "@size": "259", "@ref": "si100", "@mimetype": "image/gif"}, {"@category": "thumbnail", "@height": "15", "@width": "72", "@_fa": "true", "$": "https://api.elsevier.com/content/object/eid/1-s2.0-S0191261516302648-si110.gif?httpAccept=%2A%2F%2A", "@multimediatype": "GIF image file", "@type": "ALTIMG", "@size": "296", "@ref": "si110", "@mimetype": "image/gif"}, {"@category": "thumbnail", "@height": "17", "@width": "177", "@_fa": "true", "$": "https://api.elsevier.com/content/object/eid/1-s2.0-S0191261516302648-si13.gif?httpAccept=%2A%2F%2A", "@multimediatype": "GIF image file", "@type": "ALTIMG", "@size": "659", "@ref": "si13", "@mimetype": "image/gif"}, {"@category": "thumbnail", "@height": "16", "@width": "50", "@_fa": "true", "$": "https://api.elsevier.com/content/object/eid/1-s2.0-S0191261516302648-si14.gif?httpAccept=%2A%2F%2A", "@multimediatype": "GIF image file", "@type": "ALTIMG", "@size": "256", "@ref": "si14", "@mimetype": "image/gif"}, {"@category": "thumbnail", "@height": "16", "@width": "87", "@_fa": "true", "$": "https://api.elsevier.com/content/object/eid/1-s2.0-S0191261516302648-si15.gif?httpAccept=%2A%2F%2A", "@multimediatype": "GIF image file", "@type": "ALTIMG", "@size": "422", "@ref": "si15", "@mimetype": "image/gif"}, {"@category": "thumbnail", "@height": "16", "@width": "73", "@_fa": "true", "$": "https://api.elsevier.com/content/object/eid/1-s2.0-S0191261516302648-si16.gif?httpAccept=%2A%2F%2A", "@multimediatype": "GIF image file", "@type": "ALTIMG", "@size": "351", "@ref": "si16", "@mimetype": "image/gif"}, {"@category": "thumbnail", "@height": "17", "@width": "58", "@_fa": "true", "$": "https://api.elsevier.com/content/object/eid/1-s2.0-S0191261516302648-si17.gif?httpAccept=%2A%2F%2A", "@multimediatype": "GIF image file", "@type": "ALTIMG", "@size": "294", "@ref": "si17", "@mimetype": "image/gif"}, {"@category": "thumbnail", "@height": "16", "@width": "18", "@_fa": "true", "$": "https://api.elsevier.com/content/object/eid/1-s2.0-S0191261516302648-si18.gif?httpAccept=%2A%2F%2A", "@multimediatype": "GIF image file", "@type": "ALTIMG", "@size": "167", "@ref": "si18", "@mimetype": "image/gif"}, {"@category": "thumbnail", "@height": "16", "@width": "52", "@_fa": "true", "$": "https://api.elsevier.com/content/object/eid/1-s2.0-S0191261516302648-si19.gif?httpAccept=%2A%2F%2A", "@multimediatype": "GIF image file", "@type": "ALTIMG", "@size": "313", "@ref": "si19", "@mimetype": "image/gif"}, {"@category": "thumbnail", "@height": "13", "@width": "12", "@_fa": "true", "$": "https://api.elsevier.com/content/object/eid/1-s2.0-S0191261516302648-si2.gif?httpAccept=%2A%2F%2A", "@multimediatype": "GIF image file", "@type": "ALTIMG", "@size": "144", "@ref": "si2", "@mimetype": "image/gif"}, {"@category": "thumbnail", "@height": "16", "@width": "53", "@_fa": "true", "$": "https://api.elsevier.com/content/object/eid/1-s2.0-S0191261516302648-si21.gif?httpAccept=%2A%2F%2A", "@multimediatype": "GIF image file", "@type": "ALTIMG", "@size": "277", "@ref": "si21", "@mimetype": "image/gif"}, {"@category": "thumbnail", "@height": "16", "@width": "53", "@_fa": "true", "$": "https://api.elsevier.com/content/object/eid/1-s2.0-S0191261516302648-si22.gif?httpAccept=%2A%2F%2A", "@multimediatype": "GIF image file", "@type": "ALTIMG", "@size": "265", "@ref": "si22", "@mimetype": "image/gif"}, {"@category": "thumbnail", "@height": "16", "@width": "49", "@_fa": "true", "$": "https://api.elsevier.com/content/object/eid/1-s2.0-S0191261516302648-si23.gif?httpAccept=%2A%2F%2A", "@multimediatype": "GIF image file", "@type": "ALTIMG", "@size": "250", "@ref": "si23", "@mimetype": "image/gif"}, {"@category": "thumbnail", "@height": "16", "@width": "63", "@_fa": "true", "$": "https://api.elsevier.com/content/object/eid/1-s2.0-S0191261516302648-si24.gif?httpAccept=%2A%2F%2A", "@multimediatype": "GIF image file", "@type": "ALTIMG", "@size": "321", "@ref": "si24", "@mimetype": "image/gif"}, {"@category": "thumbnail", "@height": "16", "@width": "49", "@_fa": "true", "$": "https://api.elsevier.com/content/object/eid/1-s2.0-S0191261516302648-si3.gif?httpAccept=%2A%2F%2A", "@multimediatype": "GIF image file", "@type": "ALTIMG", "@size": "254", "@ref": "si3", "@mimetype": "image/gif"}, {"@category": "thumbnail", "@height": "16", "@width": "63", "@_fa": "true", "$": "https://api.elsevier.com/content/object/eid/1-s2.0-S0191261516302648-si25.gif?httpAccept=%2A%2F%2A", "@multimediatype": "GIF image file", "@type": "ALTIMG", "@size": "307", "@ref": "si25", "@mimetype": "image/gif"}, {"@category": "thumbnail", "@height": "13", "@width": "14", "@_fa": "true", "$": "https://api.elsevier.com/content/object/eid/1-s2.0-S0191261516302648-si26.gif?httpAccept=%2A%2F%2A", "@multimediatype": "GIF image file", "@type": "ALTIMG", "@size": "149", "@ref": "si26", "@mimetype": "image/gif"}, {"@category": "thumbnail", "@height": "14", "@width": "51", "@_fa": "true", "$": "https://api.elsevier.com/content/object/eid/1-s2.0-S0191261516302648-si27.gif?httpAccept=%2A%2F%2A", "@multimediatype": "GIF image file", "@type": "ALTIMG", "@size": "248", "@ref": "si27", "@mimetype": "image/gif"}, {"@category": "thumbnail", "@height": "13", "@width": "87", "@_fa": "true", "$": "https://api.elsevier.com/content/object/eid/1-s2.0-S0191261516302648-si28.gif?httpAccept=%2A%2F%2A", "@multimediatype": "GIF image file", "@type": "ALTIMG", "@size": "322", "@ref": "si28", "@mimetype": "image/gif"}, {"@category": "thumbnail", "@height": "16", "@width": "106", "@_fa": "true", "$": "https://api.elsevier.com/content/object/eid/1-s2.0-S0191261516302648-si29.gif?httpAccept=%2A%2F%2A", "@multimediatype": "GIF image file", "@type": "ALTIMG", "@size": "434", "@ref": "si29", "@mimetype": "image/gif"}, {"@category": "thumbnail", "@height": "17", "@width": "92", "@_fa": "true", "$": "https://api.elsevier.com/content/object/eid/1-s2.0-S0191261516302648-si31.gif?httpAccept=%2A%2F%2A", "@multimediatype": "GIF image file", "@type": "ALTIMG", "@size": "476", "@ref": "si31", "@mimetype": "image/gif"}, {"@category": "thumbnail", "@height": "17", "@width": "170", "@_fa": "true", "$": "https://api.elsevier.com/content/object/eid/1-s2.0-S0191261516302648-si32.gif?httpAccept=%2A%2F%2A", "@multimediatype": "GIF image file", "@type": "ALTIMG", "@size": "700", "@ref": "si32", "@mimetype": "image/gif"}, {"@category": "thumbnail", "@height": "16", "@width": "109", "@_fa": "true", "$": "https://api.elsevier.com/content/object/eid/1-s2.0-S0191261516302648-si33.gif?httpAccept=%2A%2F%2A", "@multimediatype": "GIF image file", "@type": "ALTIMG", "@size": "460", "@ref": "si33", "@mimetype": "image/gif"}, {"@category": "thumbnail", "@height": "17", "@width": "135", "@_fa": "true", "$": "https://api.elsevier.com/content/object/eid/1-s2.0-S0191261516302648-si34.gif?httpAccept=%2A%2F%2A", "@multimediatype": "GIF image file", "@type": "ALTIMG", "@size": "487", "@ref": "si34", "@mimetype": "image/gif"}, {"@category": "thumbnail", "@height": "16", "@width": "51", "@_fa": "true", "$": "https://api.elsevier.com/content/object/eid/1-s2.0-S0191261516302648-si35.gif?httpAccept=%2A%2F%2A", "@multimediatype": "GIF image file", "@type": "ALTIMG", "@size": "238", "@ref": "si35", "@mimetype": "image/gif"}, {"@category": "thumbnail", "@height": "2", "@width": "21", "@_fa": "true", "$": "https://api.elsevier.com/content/object/eid/1-s2.0-S0191261516302648-si36.gif?httpAccept=%2A%2F%2A", "@multimediatype": "GIF image file", "@type": "ALTIMG", "@size": "51", "@ref": "si36", "@mimetype": "image/gif"}, {"@category": "thumbnail", "@height": "16", "@width": "71", "@_fa": "true", "$": "https://api.elsevier.com/content/object/eid/1-s2.0-S0191261516302648-si37.gif?httpAccept=%2A%2F%2A", "@multimediatype": "GIF image file", "@type": "ALTIMG", "@size": "321", "@ref": "si37", "@mimetype": "image/gif"}, {"@category": "thumbnail", "@height": "21", "@width": "187", "@_fa": "true", "$": "https://api.elsevier.com/content/object/eid/1-s2.0-S0191261516302648-si38.gif?httpAccept=%2A%2F%2A", "@multimediatype": "GIF image file", "@type": "ALTIMG", "@size": "663", "@ref": "si38", "@mimetype": "image/gif"}, {"@category": "thumbnail", "@height": "16", "@width": "52", "@_fa": "true", "$": "https://api.elsevier.com/content/object/eid/1-s2.0-S0191261516302648-si39.gif?httpAccept=%2A%2F%2A", "@multimediatype": "GIF image file", "@type": "ALTIMG", "@size": "266", "@ref": "si39", "@mimetype": "image/gif"}, {"@category": "thumbnail", "@height": "16", "@width": "70", "@_fa": "true", "$": "https://api.elsevier.com/content/object/eid/1-s2.0-S0191261516302648-si4.gif?httpAccept=%2A%2F%2A", "@multimediatype": "GIF image file", "@type": "ALTIMG", "@size": "315", "@ref": "si4", "@mimetype": "image/gif"}, {"@category": "thumbnail", "@height": "16", "@width": "56", "@_fa": "true", "$": "https://api.elsevier.com/content/object/eid/1-s2.0-S0191261516302648-si41.gif?httpAccept=%2A%2F%2A", "@multimediatype": "GIF image file", "@type": "ALTIMG", "@size": "268", "@ref": "si41", "@mimetype": "image/gif"}, {"@category": "thumbnail", "@height": "19", "@width": "98", "@_fa": "true", "$": "https://api.elsevier.com/content/object/eid/1-s2.0-S0191261516302648-si42.gif?httpAccept=%2A%2F%2A", "@multimediatype": "GIF image file", "@type": "ALTIMG", "@size": "440", "@ref": "si42", "@mimetype": "image/gif"}, {"@category": "thumbnail", "@height": "16", "@width": "100", "@_fa": "true", "$": "https://api.elsevier.com/content/object/eid/1-s2.0-S0191261516302648-si43.gif?httpAccept=%2A%2F%2A", "@multimediatype": "GIF image file", "@type": "ALTIMG", "@size": "428", "@ref": "si43", "@mimetype": "image/gif"}, {"@category": "thumbnail", "@height": "16", "@width": "69", "@_fa": "true", "$": "https://api.elsevier.com/content/object/eid/1-s2.0-S0191261516302648-si44.gif?httpAccept=%2A%2F%2A", "@multimediatype": "GIF image file", "@type": "ALTIMG", "@size": "314", "@ref": "si44", "@mimetype": "image/gif"}, {"@category": "thumbnail", "@height": "16", "@width": "103", "@_fa": "true", "$": "https://api.elsevier.com/content/object/eid/1-s2.0-S0191261516302648-si45.gif?httpAccept=%2A%2F%2A", "@multimediatype": "GIF image file", "@type": "ALTIMG", "@size": "470", "@ref": "si45", "@mimetype": "image/gif"}, {"@category": "thumbnail", "@height": "41", "@width": "159", "@_fa": "true", "$": "https://api.elsevier.com/content/object/eid/1-s2.0-S0191261516302648-si46.gif?httpAccept=%2A%2F%2A", "@multimediatype": "GIF image file", "@type": "ALTIMG", "@size": "780", "@ref": "si46", "@mimetype": "image/gif"}, {"@category": "thumbnail", "@height": "17", "@width": "255", "@_fa": "true", "$": "https://api.elsevier.com/content/object/eid/1-s2.0-S0191261516302648-si47.gif?httpAccept=%2A%2F%2A", "@multimediatype": "GIF image file", "@type": "ALTIMG", "@size": "990", "@ref": "si47", "@mimetype": "image/gif"}, {"@category": "thumbnail", "@height": "20", "@width": "111", "@_fa": "true", "$": "https://api.elsevier.com/content/object/eid/1-s2.0-S0191261516302648-si48.gif?httpAccept=%2A%2F%2A", "@multimediatype": "GIF image file", "@type": "ALTIMG", "@size": "476", "@ref": "si48", "@mimetype": "image/gif"}, {"@category": "thumbnail", "@height": "19", "@width": "185", "@_fa": "true", "$": "https://api.elsevier.com/content/object/eid/1-s2.0-S0191261516302648-si49.gif?httpAccept=%2A%2F%2A", "@multimediatype": "GIF image file", "@type": "ALTIMG", "@size": "806", "@ref": "si49", "@mimetype": "image/gif"}, {"@category": "thumbnail", "@height": "13", "@width": "48", "@_fa": "true", "$": "https://api.elsevier.com/content/object/eid/1-s2.0-S0191261516302648-si5.gif?httpAccept=%2A%2F%2A", "@multimediatype": "GIF image file", "@type": "ALTIMG", "@size": "192", "@ref": "si5", "@mimetype": "image/gif"}, {"@category": "thumbnail", "@height": "17", "@width": "39", "@_fa": "true", "$": "https://api.elsevier.com/content/object/eid/1-s2.0-S0191261516302648-si51.gif?httpAccept=%2A%2F%2A", "@multimediatype": "GIF image file", "@type": "ALTIMG", "@size": "279", "@ref": "si51", "@mimetype": "image/gif"}, {"@category": "thumbnail", "@height": "15", "@width": "78", "@_fa": "true", "$": "https://api.elsevier.com/content/object/eid/1-s2.0-S0191261516302648-si52.gif?httpAccept=%2A%2F%2A", "@multimediatype": "GIF image file", "@type": "ALTIMG", "@size": "372", "@ref": "si52", "@mimetype": "image/gif"}, {"@category": "thumbnail", "@height": "26", "@width": "242", "@_fa": "true", "$": "https://api.elsevier.com/content/object/eid/1-s2.0-S0191261516302648-si53.gif?httpAccept=%2A%2F%2A", "@multimediatype": "GIF image file", "@type": "ALTIMG", "@size": "1052", "@ref": "si53", "@mimetype": "image/gif"}, {"@category": "thumbnail", "@height": "16", "@width": "73", "@_fa": "true", "$": "https://api.elsevier.com/content/object/eid/1-s2.0-S0191261516302648-si54.gif?httpAccept=%2A%2F%2A", "@multimediatype": "GIF image file", "@type": "ALTIMG", "@size": "377", "@ref": "si54", "@mimetype": "image/gif"}, {"@category": "thumbnail", "@height": "26", "@width": "199", "@_fa": "true", "$": "https://api.elsevier.com/content/object/eid/1-s2.0-S0191261516302648-si55.gif?httpAccept=%2A%2F%2A", "@multimediatype": "GIF image file", "@type": "ALTIMG", "@size": "901", "@ref": "si55", "@mimetype": "image/gif"}, {"@category": "thumbnail", "@height": "22", "@width": "328", "@_fa": "true", "$": "https://api.elsevier.com/content/object/eid/1-s2.0-S0191261516302648-si56.gif?httpAccept=%2A%2F%2A", "@multimediatype": "GIF image file", "@type": "ALTIMG", "@size": "1279", "@ref": "si56", "@mimetype": "image/gif"}, {"@category": "thumbnail", "@height": "24", "@width": "178", "@_fa": "true", "$": "https://api.elsevier.com/content/object/eid/1-s2.0-S0191261516302648-si57.gif?httpAccept=%2A%2F%2A", "@multimediatype": "GIF image file", "@type": "ALTIMG", "@size": "811", "@ref": "si57", "@mimetype": "image/gif"}, {"@category": "thumbnail", "@height": "19", "@width": "118", "@_fa": "true", "$": "https://api.elsevier.com/content/object/eid/1-s2.0-S0191261516302648-si58.gif?httpAccept=%2A%2F%2A", "@multimediatype": "GIF image file", "@type": "ALTIMG", "@size": "479", "@ref": "si58", "@mimetype": "image/gif"}, {"@category": "thumbnail", "@height": "17", "@width": "90", "@_fa": "true", "$": "https://api.elsevier.com/content/object/eid/1-s2.0-S0191261516302648-si59.gif?httpAccept=%2A%2F%2A", "@multimediatype": "GIF image file", "@type": "ALTIMG", "@size": "442", "@ref": "si59", "@mimetype": "image/gif"}, {"@category": "thumbnail", "@height": "17", "@width": "94", "@_fa": "true", "$": "https://api.elsevier.com/content/object/eid/1-s2.0-S0191261516302648-si6.gif?httpAccept=%2A%2F%2A", "@multimediatype": "GIF image file", "@type": "ALTIMG", "@size": "335", "@ref": "si6", "@mimetype": "image/gif"}, {"@category": "thumbnail", "@height": "17", "@width": "67", "@_fa": "true", "$": "https://api.elsevier.com/content/object/eid/1-s2.0-S0191261516302648-si61.gif?httpAccept=%2A%2F%2A", "@multimediatype": "GIF image file", "@type": "ALTIMG", "@size": "340", "@ref": "si61", "@mimetype": "image/gif"}, {"@category": "thumbnail", "@height": "41", "@width": "379", "@_fa": "true", "$": "https://api.elsevier.com/content/object/eid/1-s2.0-S0191261516302648-si62.gif?httpAccept=%2A%2F%2A", "@multimediatype": "GIF image file", "@type": "ALTIMG", "@size": "1681", "@ref": "si62", "@mimetype": "image/gif"}, {"@category": "thumbnail", "@height": "41", "@width": "119", "@_fa": "true", "$": "https://api.elsevier.com/content/object/eid/1-s2.0-S0191261516302648-si63.gif?httpAccept=%2A%2F%2A", "@multimediatype": "GIF image file", "@type": "ALTIMG", "@size": "651", "@ref": "si63", "@mimetype": "image/gif"}, {"@category": "thumbnail", "@height": "41", "@width": "275", "@_fa": "true", "$": "https://api.elsevier.com/content/object/eid/1-s2.0-S0191261516302648-si64.gif?httpAccept=%2A%2F%2A", "@multimediatype": "GIF image file", "@type": "ALTIMG", "@size": "1158", "@ref": "si64", "@mimetype": "image/gif"}, {"@category": "thumbnail", "@height": "16", "@width": "98", "@_fa": "true", "$": "https://api.elsevier.com/content/object/eid/1-s2.0-S0191261516302648-si65.gif?httpAccept=%2A%2F%2A", "@multimediatype": "GIF image file", "@type": "ALTIMG", "@size": "451", "@ref": "si65", "@mimetype": "image/gif"}, {"@category": "thumbnail", "@height": "19", "@width": "112", "@_fa": "true", "$": "https://api.elsevier.com/content/object/eid/1-s2.0-S0191261516302648-si66.gif?httpAccept=%2A%2F%2A", "@multimediatype": "GIF image file", "@type": "ALTIMG", "@size": "476", "@ref": "si66", "@mimetype": "image/gif"}, {"@category": "thumbnail", "@height": "24", "@width": "370", "@_fa": "true", "$": "https://api.elsevier.com/content/object/eid/1-s2.0-S0191261516302648-si67.gif?httpAccept=%2A%2F%2A", "@multimediatype": "GIF image file", "@type": "ALTIMG", "@size": "1372", "@ref": "si67", "@mimetype": "image/gif"}, {"@category": "thumbnail", "@height": "24", "@width": "352", "@_fa": "true", "$": "https://api.elsevier.com/content/object/eid/1-s2.0-S0191261516302648-si68.gif?httpAccept=%2A%2F%2A", "@multimediatype": "GIF image file", "@type": "ALTIMG", "@size": "1350", "@ref": "si68", "@mimetype": "image/gif"}, {"@category": "thumbnail", "@height": "16", "@width": "57", "@_fa": "true", "$": "https://api.elsevier.com/content/object/eid/1-s2.0-S0191261516302648-si69.gif?httpAccept=%2A%2F%2A", "@multimediatype": "GIF image file", "@type": "ALTIMG", "@size": "342", "@ref": "si69", "@mimetype": "image/gif"}, {"@category": "thumbnail", "@height": "17", "@width": "109", "@_fa": "true", "$": "https://api.elsevier.com/content/object/eid/1-s2.0-S0191261516302648-si7.gif?httpAccept=%2A%2F%2A", "@multimediatype": "GIF image file", "@type": "ALTIMG", "@size": "451", "@ref": "si7", "@mimetype": "image/gif"}, {"@category": "thumbnail", "@height": "24", "@width": "636", "@_fa": "true", "$": "https://api.elsevier.com/content/object/eid/1-s2.0-S0191261516302648-si71.gif?httpAccept=%2A%2F%2A", "@multimediatype": "GIF image file", "@type": "ALTIMG", "@size": "2445", "@ref": "si71", "@mimetype": "image/gif"}, {"@category": "thumbnail", "@height": "24", "@width": "272", "@_fa": "true", "$": "https://api.elsevier.com/content/object/eid/1-s2.0-S0191261516302648-si72.gif?httpAccept=%2A%2F%2A", "@multimediatype": "GIF image file", "@type": "ALTIMG", "@size": "1145", "@ref": "si72", "@mimetype": "image/gif"}, {"@category": "thumbnail", "@height": "17", "@width": "112", "@_fa": "true", "$": "https://api.elsevier.com/content/object/eid/1-s2.0-S0191261516302648-si73.gif?httpAccept=%2A%2F%2A", "@multimediatype": "GIF image file", "@type": "ALTIMG", "@size": "535", "@ref": "si73", "@mimetype": "image/gif"}, {"@category": "thumbnail", "@height": "21", "@width": "68", "@_fa": "true", "$": "https://api.elsevier.com/content/object/eid/1-s2.0-S0191261516302648-si74.gif?httpAccept=%2A%2F%2A", "@multimediatype": "GIF image file", "@type": "ALTIMG", "@size": "390", "@ref": "si74", "@mimetype": "image/gif"}, {"@category": "thumbnail", "@height": "18", "@width": "375", "@_fa": "true", "$": "https://api.elsevier.com/content/object/eid/1-s2.0-S0191261516302648-si75.gif?httpAccept=%2A%2F%2A", "@multimediatype": "GIF image file", "@type": "ALTIMG", "@size": "1426", "@ref": "si75", "@mimetype": "image/gif"}, {"@category": "thumbnail", "@height": "21", "@width": "157", "@_fa": "true", "$": "https://api.elsevier.com/content/object/eid/1-s2.0-S0191261516302648-si76.gif?httpAccept=%2A%2F%2A", "@multimediatype": "GIF image file", "@type": "ALTIMG", "@size": "791", "@ref": "si76", "@mimetype": "image/gif"}, {"@category": "thumbnail", "@height": "17", "@width": "89", "@_fa": "true", "$": "https://api.elsevier.com/content/object/eid/1-s2.0-S0191261516302648-si77.gif?httpAccept=%2A%2F%2A", "@multimediatype": "GIF image file", "@type": "ALTIMG", "@size": "457", "@ref": "si77", "@mimetype": "image/gif"}, {"@category": "thumbnail", "@height": "16", "@width": "175", "@_fa": "true", "$": "https://api.elsevier.com/content/object/eid/1-s2.0-S0191261516302648-si78.gif?httpAccept=%2A%2F%2A", "@multimediatype": "GIF image file", "@type": "ALTIMG", "@size": "641", "@ref": "si78", "@mimetype": "image/gif"}, {"@category": "thumbnail", "@height": "20", "@width": "65", "@_fa": "true", "$": "https://api.elsevier.com/content/object/eid/1-s2.0-S0191261516302648-si79.gif?httpAccept=%2A%2F%2A", "@multimediatype": "GIF image file", "@type": "ALTIMG", "@size": "378", "@ref": "si79", "@mimetype": "image/gif"}, {"@category": "thumbnail", "@height": "13", "@width": "45", "@_fa": "true", "$": "https://api.elsevier.com/content/object/eid/1-s2.0-S0191261516302648-si8.gif?httpAccept=%2A%2F%2A", "@multimediatype": "GIF image file", "@type": "ALTIMG", "@size": "235", "@ref": "si8", "@mimetype": "image/gif"}, {"@category": "thumbnail", "@height": "17", "@width": "313", "@_fa": "true", "$": "https://api.elsevier.com/content/object/eid/1-s2.0-S0191261516302648-si81.gif?httpAccept=%2A%2F%2A", "@multimediatype": "GIF image file", "@type": "ALTIMG", "@size": "1025", "@ref": "si81", "@mimetype": "image/gif"}, {"@category": "thumbnail", "@height": "20", "@width": "85", "@_fa": "true", "$": "https://api.elsevier.com/content/object/eid/1-s2.0-S0191261516302648-si82.gif?httpAccept=%2A%2F%2A", "@multimediatype": "GIF image file", "@type": "ALTIMG", "@size": "374", "@ref": "si82", "@mimetype": "image/gif"}, {"@category": "thumbnail", "@height": "15", "@width": "52", "@_fa": "true", "$": "https://api.elsevier.com/content/object/eid/1-s2.0-S0191261516302648-si83.gif?httpAccept=%2A%2F%2A", "@multimediatype": "GIF image file", "@type": "ALTIMG", "@size": "252", "@ref": "si83", "@mimetype": "image/gif"}, {"@category": "thumbnail", "@height": "14", "@width": "74", "@_fa": "true", "$": "https://api.elsevier.com/content/object/eid/1-s2.0-S0191261516302648-si84.gif?httpAccept=%2A%2F%2A", "@multimediatype": "GIF image file", "@type": "ALTIMG", "@size": "321", "@ref": "si84", "@mimetype": "image/gif"}, {"@category": "thumbnail", "@height": "16", "@width": "41", "@_fa": "true", "$": "https://api.elsevier.com/content/object/eid/1-s2.0-S0191261516302648-si85.gif?httpAccept=%2A%2F%2A", "@multimediatype": "GIF image file", "@type": "ALTIMG", "@size": "239", "@ref": "si85", "@mimetype": "image/gif"}, {"@category": "thumbnail", "@height": "16", "@width": "322", "@_fa": "true", "$": "https://api.elsevier.com/content/object/eid/1-s2.0-S0191261516302648-si86.gif?httpAccept=%2A%2F%2A", "@multimediatype": "GIF image file", "@type": "ALTIMG", "@size": "1046", "@ref": "si86", "@mimetype": "image/gif"}, {"@category": "thumbnail", "@height": "15", "@width": "153", "@_fa": "true", "$": "https://api.elsevier.com/content/object/eid/1-s2.0-S0191261516302648-si87.gif?httpAccept=%2A%2F%2A", "@multimediatype": "GIF image file", "@type": "ALTIMG", "@size": "598", "@ref": "si87", "@mimetype": "image/gif"}, {"@category": "thumbnail", "@height": "68", "@width": "319", "@_fa": "true", "$": "https://api.elsevier.com/content/object/eid/1-s2.0-S0191261516302648-si88.gif?httpAccept=%2A%2F%2A", "@multimediatype": "GIF image file", "@type": "ALTIMG", "@size": "1888", "@ref": "si88", "@mimetype": "image/gif"}, {"@category": "thumbnail", "@height": "16", "@width": "73", "@_fa": "true", "$": "https://api.elsevier.com/content/object/eid/1-s2.0-S0191261516302648-si89.gif?httpAccept=%2A%2F%2A", "@multimediatype": "GIF image file", "@type": "ALTIMG", "@size": "333", "@ref": "si89", "@mimetype": "image/gif"}, {"@category": "thumbnail", "@height": "13", "@width": "47", "@_fa": "true", "$": "https://api.elsevier.com/content/object/eid/1-s2.0-S0191261516302648-si9.gif?httpAccept=%2A%2F%2A", "@multimediatype": "GIF image file", "@type": "ALTIMG", "@size": "229", "@ref": "si9", "@mimetype": "image/gif"}, {"@category": "thumbnail", "@height": "41", "@width": "239", "@_fa": "true", "$": "https://api.elsevier.com/content/object/eid/1-s2.0-S0191261516302648-si91.gif?httpAccept=%2A%2F%2A", "@multimediatype": "GIF image file", "@type": "ALTIMG", "@size": "1287", "@ref": "si91", "@mimetype": "image/gif"}, {"@category": "thumbnail", "@height": "20", "@width": "75", "@_fa": "true", "$": "https://api.elsevier.com/content/object/eid/1-s2.0-S0191261516302648-si92.gif?httpAccept=%2A%2F%2A", "@multimediatype": "GIF image file", "@type": "ALTIMG", "@size": "412", "@ref": "si92", "@mimetype": "image/gif"}, {"@category": "thumbnail", "@height": "19", "@width": "159", "@_fa": "true", "$": "https://api.elsevier.com/content/object/eid/1-s2.0-S0191261516302648-si93.gif?httpAccept=%2A%2F%2A", "@multimediatype": "GIF image file", "@type": "ALTIMG", "@size": "653", "@ref": "si93", "@mimetype": "image/gif"}, {"@category": "thumbnail", "@height": "16", "@width": "95", "@_fa": "true", "$": "https://api.elsevier.com/content/object/eid/1-s2.0-S0191261516302648-si94.gif?httpAccept=%2A%2F%2A", "@multimediatype": "GIF image file", "@type": "ALTIMG", "@size": "414", "@ref": "si94", "@mimetype": "image/gif"}, {"@category": "thumbnail", "@height": "16", "@width": "98", "@_fa": "true", "$": "https://api.elsevier.com/content/object/eid/1-s2.0-S0191261516302648-si95.gif?httpAccept=%2A%2F%2A", "@multimediatype": "GIF image file", "@type": "ALTIMG", "@size": "460", "@ref": "si95", "@mimetype": "image/gif"}, {"@category": "thumbnail", "@height": "19", "@width": "251", "@_fa": "true", "$": "https://api.elsevier.com/content/object/eid/1-s2.0-S0191261516302648-si96.gif?httpAccept=%2A%2F%2A", "@multimediatype": "GIF image file", "@type": "ALTIMG", "@size": "1100", "@ref": "si96", "@mimetype": "image/gif"}, {"@category": "thumbnail", "@height": "15", "@width": "148", "@_fa": "true", "$": "https://api.elsevier.com/content/object/eid/1-s2.0-S0191261516302648-si97.gif?httpAccept=%2A%2F%2A", "@multimediatype": "GIF image file", "@type": "ALTIMG", "@size": "567", "@ref": "si97", "@mimetype": "image/gif"}, {"@category": "thumbnail", "@height": "26", "@width": "171", "@_fa": "true", "$": "https://api.elsevier.com/content/object/eid/1-s2.0-S0191261516302648-si98.gif?httpAccept=%2A%2F%2A", "@multimediatype": "GIF image file", "@type": "ALTIMG", "@size": "882", "@ref": "si98", "@mimetype": "image/gif"}, {"@category": "thumbnail", "@height": "17", "@width": "287", "@_fa": "true", "$": "https://api.elsevier.com/content/object/eid/1-s2.0-S0191261516302648-si99.gif?httpAccept=%2A%2F%2A", "@multimediatype": "GIF image file", "@type": "ALTIMG", "@size": "946", "@ref": "si99", "@mimetype": "image/gif"}, {"@category": "thumbnail", "@height": "16", "@width": "67", "@_fa": "true", "$": "https://api.elsevier.com/content/object/eid/1-s2.0-S0191261516302648-si101.gif?httpAccept=%2A%2F%2A", "@multimediatype": "GIF image file", "@type": "ALTIMG", "@size": "312", "@ref": "si101", "@mimetype": "image/gif"}, {"@category": "thumbnail", "@height": "16", "@width": "102", "@_fa": "true", "$": "https://api.elsevier.com/content/object/eid/1-s2.0-S0191261516302648-si102.gif?httpAccept=%2A%2F%2A", "@multimediatype": "GIF image file", "@type": "ALTIMG", "@size": "466", "@ref": "si102", "@mimetype": "image/gif"}, {"@category": "thumbnail", "@height": "20", "@width": "104", "@_fa": "true", "$": "https://api.elsevier.com/content/object/eid/1-s2.0-S0191261516302648-si103.gif?httpAccept=%2A%2F%2A", "@multimediatype": "GIF image file", "@type": "ALTIMG", "@size": "476", "@ref": "si103", "@mimetype": "image/gif"}, {"@category": "thumbnail", "@height": "16", "@width": "109", "@_fa": "true", "$": "https://api.elsevier.com/content/object/eid/1-s2.0-S0191261516302648-si104.gif?httpAccept=%2A%2F%2A", "@multimediatype": "GIF image file", "@type": "ALTIMG", "@size": "481", "@ref": "si104", "@mimetype": "image/gif"}, {"@category": "thumbnail", "@height": "16", "@width": "114", "@_fa": "true", "$": "https://api.elsevier.com/content/object/eid/1-s2.0-S0191261516302648-si105.gif?httpAccept=%2A%2F%2A", "@multimediatype": "GIF image file", "@type": "ALTIMG", "@size": "531", "@ref": "si105", "@mimetype": "image/gif"}, {"@category": "thumbnail", "@height": "40", "@width": "176", "@_fa": "true", "$": "https://api.elsevier.com/content/object/eid/1-s2.0-S0191261516302648-si106.gif?httpAccept=%2A%2F%2A", "@multimediatype": "GIF image file", "@type": "ALTIMG", "@size": "755", "@ref": "si106", "@mimetype": "image/gif"}, {"@category": "thumbnail", "@height": "16", "@width": "175", "@_fa": "true", "$": "https://api.elsevier.com/content/object/eid/1-s2.0-S0191261516302648-si107.gif?httpAccept=%2A%2F%2A", "@multimediatype": "GIF image file", "@type": "ALTIMG", "@size": "670", "@ref": "si107", "@mimetype": "image/gif"}, {"@category": "thumbnail", "@height": "16", "@width": "50", "@_fa": "true", "$": "https://api.elsevier.com/content/object/eid/1-s2.0-S0191261516302648-si108.gif?httpAccept=%2A%2F%2A", "@multimediatype": "GIF image file", "@type": "ALTIMG", "@size": "261", "@ref": "si108", "@mimetype": "image/gif"}, {"@category": "thumbnail", "@height": "15", "@width": "54", "@_fa": "true", "$": "https://api.elsevier.com/content/object/eid/1-s2.0-S0191261516302648-si109.gif?httpAccept=%2A%2F%2A", "@multimediatype": "GIF image file", "@type": "ALTIMG", "@size": "256", "@ref": "si109", "@mimetype": "image/gif"}, {"@category": "thumbnail", "@height": "16", "@width": "75", "@_fa": "true", "$": "https://api.elsevier.com/content/object/eid/1-s2.0-S0191261516302648-si11.gif?httpAccept=%2A%2F%2A", "@multimediatype": "GIF image file", "@type": "ALTIMG", "@size": "358", "@ref": "si11", "@mimetype": "image/gif"}, {"@category": "thumbnail", "@height": "16", "@width": "115", "@_fa": "true", "$": "https://api.elsevier.com/content/object/eid/1-s2.0-S0191261516302648-si111.gif?httpAccept=%2A%2F%2A", "@multimediatype": "GIF image file", "@type": "ALTIMG", "@size": "499", "@ref": "si111", "@mimetype": "image/gif"}, {"@category": "thumbnail", "@height": "19", "@width": "104", "@_fa": "true", "$": "https://api.elsevier.com/content/object/eid/1-s2.0-S0191261516302648-si112.gif?httpAccept=%2A%2F%2A", "@multimediatype": "GIF image file", "@type": "ALTIMG", "@size": "470", "@ref": "si112", "@mimetype": "image/gif"}, {"@category": "thumbnail", "@height": "16", "@width": "109", "@_fa": "true", "$": "https://api.elsevier.com/content/object/eid/1-s2.0-S0191261516302648-si113.gif?httpAccept=%2A%2F%2A", "@multimediatype": "GIF image file", "@type": "ALTIMG", "@size": "489", "@ref": "si113", "@mimetype": "image/gif"}, {"@category": "thumbnail", "@height": "17", "@width": "35", "@_fa": "true", "$": "https://api.elsevier.com/content/object/eid/1-s2.0-S0191261516302648-si12.gif?httpAccept=%2A%2F%2A", "@multimediatype": "GIF image file", "@type": "ALTIMG", "@size": "252", "@ref": "si12", "@mimetype": "image/gif"}]}, "link": {"@rel": "abstract", "@href": "https://api.elsevier.com/content/abstract/scopus_id/85012097947"}}