{"originalText": "serial JL 271728 291210 291772 291817 31 Transportation Research Part B: Methodological TRANSPORTATIONRESEARCHPARTBMETHODOLOGICAL 2017-05-12 2017-05-12 2017-05-12 2017-05-12 2017-05-12T21:40:58 1-s2.0-S0191261517304125 S0191-2615(17)30412-5 S0191261517304125 10.1016/S0191-2615(17)30412-5 S300 S300.1 HEAD-ONLY 1-s2.0-S0191261517X00039 2017-05-12T19:10:58.998768-04:00 0 0 20170601 20170630 2017 2017-05-12T23:41:30.440337Z rawtext articleinfo articletitlenorm cid cids contenttype copyright crossmark dateloaded dateloadedtxt datesearch datesort dateupdated dco docsubtype doctype doi eid ewtransactionid hubeid indexeddate issn issnnorm itemstage itemtransactionid itemweight openaccess openarchive pg pgfirst pii piinorm pubdateend pubdatestart pubdatetxt pubyr sortorder srctitle srctitlenorm srctype ssids alllist content subj suppl tomb volfirst volissue volumelist webpdf webpdfpagecount yearnav articletitle 0191-2615 01912615 false 100 100 C Volume 100 1 IFC IFC 201706 June 2017 2017-06-01 2017-06-30 2017 simple-article edb EDITORIALBOARD 2019-05-12T00:00:00.000Z UnderEmbargo http://creativecommons.org/licenses/by-nc-nd/4.0/ item S0191-2615(17)30412-5 S0191261517304125 1-s2.0-S0191261517304125 10.1016/S0191-2615(17)30412-5 271728 2017-05-12T18:41:30.440337-04:00 2017-06-01 2017-06-30 1-s2.0-S0191261517304125-main.pdf https://s3-eu-west-1.amazonaws.com/prod-ucs-content-store-eu-west/content/pii:S0191261517304125/MAIN/application/pdf/01b97dc1587944105b43b1272f8e97b4/main.pdf https://s3.amazonaws.com/prod-ucs-content-store-us-east/content/pii:S0191261517304125/MAIN/application/pdf/01b97dc1587944105b43b1272f8e97b4/main.pdf main.pdf pdf true 108257 MAIN 1 1-s2.0-S0191261517304125-main_1.png https://s3-eu-west-1.amazonaws.com/prod-ucs-content-store-eu-west/content/pii:S0191261517304125/PREVIEW/image/png/3e524867d1753e01ccac8c3fe7ef0f5c/main_1.png https://s3.amazonaws.com/prod-ucs-content-store-us-east/content/pii:S0191261517304125/PREVIEW/image/png/3e524867d1753e01ccac8c3fe7ef0f5c/main_1.png main_1.png png 72767 849 656 IMAGE-WEB-PDF 1 Transportation Research an international journal Part B: Methodological Editor-in-Chief Hai Yang Department of Civil and Environmental Engineering, The Hong Kong University of Science and Technology, Clear Water Bay, Kowloon, Hong Kong, China; e-mail: cehyang@ust.uk Past Editor-in-Chief Fred L. Mannering Founding Editor Frank A. Haight Associate Editors Richard Arnott Department of Economics, 4106 Sproul Hall, University of California, Riverside, CA 92521, USA e-mail: richard.arnott@ucr.edu Chandra Bhat Department of Civil Engineering, Ernest Cockrell Jr. Hall, 6.810, The University of Texas, Austin 78712, USA e-mail: bhat@mail.utexas.edu James Campbell College of Business Administration, University of Missouri - St. Louis, St. Louis, MO 63121, USA e-mail: campbell@umsl.edu Michael Cassidy Department of Civil Engineering and Institute of Transportation Studies, University of California, Berkeley, CA 94720, USA e-mail: cassidy@ce.berkeley.edu Carlos Daganzo Department of Civil Engineering and Institute of Transportation Studies, University of California, Berkeley, CA 94720, USA e-mail: daganzo@ce.berkeley.edu Maged Dessouky University of Southern California, Los Angeles, California, USA Terry Friesz Department of Industrial Engineering, The Pennsylvania State University, University Park, PA 16807 e-mail: tfriesz@psu.edu Fred Mannering School of Civil Engineering, Purdue University, West Lafayette, IN 47906, USA e-mail: flm@purdue.edu Qiang Meng Department of Civil and Environmental Engineering, National University of Singapore, Singapore 117576, Singapore e-mail: ceemq@nus.edu.sg Michael Zhang Department of Civil and Environmental Engineering, University of California, Davis, CA 95616, USA e-mail: hmzhang@ucdavis.edu Robin Lindsey Sauder School of Business, University of British Columbia, 2053 Main Mall, Vancouver, BC V6T 1Z2, Canada Editorial Advisory Board Nicole Adler, Hebrew University, Jerusalem, Israel Soyoung Ahn, Tempe, AZ, USA Xuegang (Jeff) Ban, Troy, NY, USA Hillel Bar-Gera, Be\u00e2\u20ac\u2122er-Sheva, Israel Michael Bell, University of Sydney, Sydney, Australia Vincent van den Berg, VU Amsterdam, Amsterdam, Netherlands Michel Bierlaire, Lausanne, Switzerland Michel Bliemer, NSW, Australia Bruno de Borger, Antwerp, Belgium David Boyce, Evanston, IL Stephen Boyles, The University of Texas at Austin, TX, USA David Brownstone, Irvine, CA, USA Anthony Chen, Logan, UT, USA Elisabetta Cherchi, London, UK Joseph Chow, New York University, New York, USA Benjamin Coifman, Columbus, OH, USA Lili Du, Illinois Institute of Technology, Chicago, USA Lily Elefteriadou, Gainsville, FL, USA Mogens Fosgerau, Bygningstorvet Building Square, Denmark Xiaowen Fu, The University of Sydney, Sydney, Australia Peter Furth, Boston, MA, USA Zhiyu Gao, Beijing Jiaotong University, Beijing, China Vikash V. Gayah, University Park, PA, USA Nikolaos Geroliminis, Lausanne, Switzerland Kostas Goulias, Santa Barbara, CA, USA Jack Haddad, Technion-Israel Institute of Technology, Israel Ke Han, Imperial College London (ICL), London, UK Ingo Hansen, Delft, The Netherlands Martin Hazelton, Palmerston North, New Zealand Stephane Hess, Leeds, UK Serge Hoogendoorn, Delft, The Netherlands Hai-Jun Huang, Beijing, China Wenlong Jin, Irvine, CA, USA Oya Ekin Kara \u00c2\u00b8s an, Bilkent University, Ankara, Turkey Kara Kockelman, Austin, TX, USA Jorge Laval, Atlanta, GA, USA Jean-Patrick Lebaque, Arcueil, France Ludovic Leclercq, Vaulx-en-Velin Cedex, France Baibing Li, Loughborough, UK Xiaopeng Li, University of South Florida, FL, USA Zhichun Li, Huazhong University of Science and Technology, Wuhan, China Cheng-Chang Lin, National Cheng Kung University, Taiwan, ROC Hong K. Lo, Kowloon, Hong Kong Henry X. Liu, Minneapolis, MN, USA Qiang Meng, National University of Singapore, Singapore Elise Miller-Hooks, University of Maryland, College Park, MD, USA Se-Il Mun, Kyoto, Japan Juan Carlos Munoz, Santiago, Chile Yu (Marco) Nie, Evanston, IL, USA Juan de Dios Ortuzar, Santiago, Chile Yanfeng Ouyang, Urbana-Champaign, IL, USA Andrea Papola, Napoli, Italy Michael Patriksson, Gothenburg, Sweden Srinivas Peeta, West Lafayette, IN, USA Abdul R. Pinjari, Tampa, FL, USA Siriphong Lawphongpanich, Gainesville, FL, USA Stef Proost, Leuven, Belgium Luca Quadrifoglio, College Station, TX, USA Amelia Regan, Irvine, CA, USA Jan Dirk Schm\u00c3\u00b6cker, Kyoto University, Kyoto, Japan Venky Shankar, PA, USA Kenneth Small, Irvine, CA, USA Siva Srinivasan, Gainesville, FL, USA Agachi Sumalee, King Mongkut\u00e2\u20ac\u2122s Institute of Technology, Ladkrabang, Bangkok, Thailand Joffre Swait, University of South Australia, Sydney, Australia Wai Yuan Szeto, Pokfulam, Hong Kong Chris Tamp\u00c3\u00a8re, KU Leuven, Heverlee, Belgium Martin Treiber, Technische Universit\u00c3\u00a4t Dresden, Dresden, Germany Satish Ukkusuri, West Lafayette, IN, USA Valentina Vacchiani, University of Bologna, Bologna, Italy Joan Walker, University of California, Berkeley, CA, USA Shuaian Wang, The Hong Kong Polytechnic University, Kowloon, Hong Kong David Watling, Leeds, UK S.C. Wong, Pokfulam, Hong Kong Tao Yao, University Park, PA, USA Yafeng Yin, Gainesville, FL, USA Anming Zhang, Vancouver, Canada Xiaoning Zhang, Shanghai, China Zuduo Zheng, Queensland University of Technology, Brisbane, Australia Xuesong Zhou, Arizona State University, Phoenix, USA Advertising information: If you are interested in advertising or other commercial opportunities please e-mail Commercialsales@elsevier.com and your enquiry will be passed to the correct person who will respond to you within 48 hours. Publication information: Transportation Research: Part B (ISSN 0191-2615). For 2017, volumes 95\u00e2\u20ac\u201c106 (12 issues) are scheduled for publication. Subscription prices are available upon request from the Publisher or from the Elsevier Customer Ser vice Depar tment nearest you or from this journal\u00e2\u20ac\u2122s website (http://www.elsevier.com/locate/trb). Further informa- tion is available on this journal and other Elsevier products through Elsevier\u00e2\u20ac\u2122s website (http://www.elsevier.com). Subscriptions are accepted on a prepaid basis only and are entered on a calendar year basis. Issues are sent by standard mail (surface within Europe, air delivery outside Europe). Priority rates are available upon request. Claims for missing issues should be made within six months of the date of dispatch. Orders, claims, and journal enquiries: please contact the Elsevier Customer Service Department nearest you: St. Louis: Elsevier Customer Service Department, 3251 Riverport Lane, Maryland Heights, MO 63043, USA; phone: (877) 8397126 [toll free within the USA]; (+1) (314) 4478878 [outside the USA]; fax: (+1) (314) 4478077; e-mail: Jour nalCustomerSer vice-usa@elsevier.com Oxford: Elsevier Customer Ser vice Depar tment, The Boulevard, Langford Lane, Kidlington, Oxford OX5 1GB, UK; phone: (+44) (1865) 843434; fax: (+44) (1865) 843970; e-mail: Jour nalsCustomerSer viceEMEA@elsevier.com Tokyo: Elsevier Customer Service Department, 4F Higashi-Azabu, 1-Chome Bldg, 1-9-15 Higashi-Azabu, Minato-ku, Tokyo 106-0044, Japan; phone: (+81) (3) 5561 5037; fax: (+81) (3) 5561 5047; e-mail: Jour nalsCustomerSer viceJapan@elsevier.com Singapore: Elsevier Customer Service Department, 3 Killiney Road, #08-01 Winsland House I, Singapore 239519; phone: (+65) 63490222; fax: (+65) 67331510; e-mail: Jour nalsCustomerSer viceAPAC@elsevier.com , TX, USA Jorge Laval, Atlanta, GA, USA Jean-Patrick Lebaque, Arcueil, France Ludovic Leclercq, Vaulx-en-Velin Cedex, France Baibing Li, Loughborough, UK Xiaopeng Li, University of South Florida, FL, USA Zhichun Li, Huazhong University of Science and Technology, Wuhan, China Cheng-Chang Lin, National Cheng Kung University, Taiwan, ROC Hong K. Lo, Kowloon, Hong Kong Henry X. Liu, Minneapolis, MN, USA Qiang Meng, National University of Singapore, Singapore Elise Miller-Hooks, University of Maryland, College Park, MD, USA Se-Il Mun, Kyoto, Japan Juan Carlos Munoz, Santiago, Chile Yu (Marco) Nie, Evanston, IL, USA Juan de Dios Ortuzar, Sant TRB 80001760 S0191-2615(17)30412-5 10.1016/S0191-2615(17)30412-5 Editorial Board", "coredata": {"eid": "1-s2.0-S0191261517304125", "dc:description": null, "openArchiveArticle": "false", "prism:coverDate": "2017-06-30", "openaccessUserLicense": null, "prism:aggregationType": "Journal", "prism:url": "https://api.elsevier.com/content/article/pii/S0191261517304125", "link": [{"@_fa": "true", "@rel": "self", "@href": "https://api.elsevier.com/content/article/pii/S0191261517304125"}, {"@_fa": "true", "@rel": "scidir", "@href": "https://www.sciencedirect.com/science/article/pii/S0191261517304125"}], "dc:format": "application/json", "openaccessType": null, "pii": "S0191-2615(17)30412-5", "prism:volume": "100", "dc:title": "Editorial Board", "prism:copyright": null, "openaccess": "0", "prism:issn": "01912615", "openaccessArticle": "false", "prism:publicationName": "Transportation Research Part B: Methodological", "openaccessSponsorType": null, "prism:pageRange": "IFC", "prism:coverDisplayDate": "June 2017", "prism:doi": "10.1016/S0191-2615(17)30412-5", "prism:startingPage": "IFC", "dc:identifier": "doi:10.1016/S0191-2615(17)30412-5", "openaccessSponsorName": null}}