{"originalText": "serial JL 271728 291210 291772 291817 31 Transportation Research Part B: Methodological TRANSPORTATIONRESEARCHPARTBMETHODOLOGICAL 2015-03-31 2015-03-31 2015-03-31T20:49:46 1-s2.0-S0191261515000624 S0191-2615(15)00062-4 S0191261515000624 10.1016/S0191-2615(15)00062-4 S300 S300.1 CONTENTS-ENTRY-ONLY 1-s2.0-S0191261515X00026 2015-05-14T05:39:52.915433-04:00 0 0 20150401 20150430 2015 2015-04-01T00:41:19.764931Z rawtext articleinfo articletitlenorm cid cids contenttype copyright crossmark dateloaded dateloadedtxt datesearch datesort dateupdated dco docsubtype doctype doi eid ewtransactionid hubeid indexeddate issn issnnorm itemstage itemtransactionid itemweight openaccess openarchive pg pgfirst pii piinorm pubdateend pubdatestart pubdatetxt pubyr sortorder srctitle srctitlenorm srctype ssids alllist content subj suppl tomb volfirst volissue volumelist webpdf webpdfpagecount yearnav articletitle 0191-2615 01912615 false 74 74 C Volume 74 1 IFC IFC 201504 April 2015 2015-04-01 2015-04-30 2015 simple-article edb Copyright \u00a9 2015 Elsevier Ltd. All rights reserved. EDITORIALBOARD item S0191-2615(15)00062-4 S0191261515000624 1-s2.0-S0191261515000624 10.1016/S0191-2615(15)00062-4 271728 2015-03-31T19:41:19.764931-04:00 2015-04-01 2015-04-30 1-s2.0-S0191261515000624-main.pdf https://s3.amazonaws.com/prod-ucs-content-store-us-east/content/pii:S0191261515000624/MAIN/application/pdf/83228cbf4e177ccb7535cdd7debd0b18/main.pdf https://s3-eu-west-1.amazonaws.com/prod-ucs-content-store-eu-west/content/pii:S0191261515000624/MAIN/application/pdf/83228cbf4e177ccb7535cdd7debd0b18/main.pdf main.pdf pdf true 72601 MAIN 1 1-s2.0-S0191261515000624-main_1.png https://s3.amazonaws.com/prod-ucs-content-store-us-east/content/pii:S0191261515000624/PREVIEW/image/png/3408b2ca17abdc6418fd3fc18fae9fc7/main_1.png https://s3-eu-west-1.amazonaws.com/prod-ucs-content-store-eu-west/content/pii:S0191261515000624/PREVIEW/image/png/3408b2ca17abdc6418fd3fc18fae9fc7/main_1.png main_1.png png 77428 849 656 IMAGE-WEB-PDF 1 Editor-in-Chief HAI YANG Department of Civil and Environmental Engineering, The Hong Kong University of Science and Technology, Clear Water Bay, Kowloon, Hong Kong, China; e-mail: cehyang@ust.uk Transportation Research an international journal Part B: Methodological Associate Editors RICHARD ARNOTT Department of Economics, 4106 Sproul Hall, University of California, Riverside, CA 92521, USA e-mail: richard.arnott@ucr.edu CHANDRA BHAT Department of Civil Engineering, Ernest Cockrell Jr. Hall, 6.810, The University of Texas, Austin 78712, USA e-mail: bhat@mail.utexas.edu CARLOS DAGANZO Department of Civil Engineering and Institute of Transportation Studies, University of California, Berkeley, CA 94720, USA e-mail: daganzo@ce.berkeley.edu MAGED DESSOUKY University of Southern California, Los Angeles, California, USA TERRY FRIESZ Department of Industrial Engineering, The Pennsylvania State University, University Park, PA 16807 e-mail: tfriesz@psu.edu FRED MANNERING School of Civil Engineering, Purdue University, West Lafayette, IN 47906, USA e-mail: flm@purdue.edu MICHAEL ZHANG Department of Civil and Environmental Engineering, University of California, Davis, CA 95616, USA e-mail: hmzhang@ucdavis.edu ROBIN LINDSEY Sauder School of Business, University of British Columbia, 2053 Main Mall, Vancouver, BC V6T 1Z2, Canada Editorial Advisory Board NICOLE ADLER, Hebrew University, Jerusalem, Israel SOYOUNG AHN, Tempe, AZ, USA XUEGANG (JEFF)BAN, Troy, NY, USA HILLEL BAR-GERA, Be\u00e2\u20ac\u2122er-Sheva, Israel MICHAEL BELL, University of Sydney, Sydney, Australia MICHEL BIERLAIRE, Lausanne, Switzerland MICHEL BLIEMER, NSW, Australia BRUNO DE BORGER, Antwerp, Belgium DAVID BOYCE, Evanston, IL DAVID BROWNSTONE, Irvine, CA, USA JAMES CAMPBELL, St. Louis, MO, USA MICHAEL CASSIDY, Berkeley, CA, USA ANTHONY CHEN, Logan, UT, USA ELISABETTA CHERCHI, London, UK BENJAMIN COIFMAN, Columbus, OH, USA LILY ELEFTERIADOU, Gainsville, FL, USA MOGENS FOSGERAU, Bygningstorvet Building Square, Denmark PETER FURTH, Boston, MA, USA ZHIYU GAO, Beijing Jiaotong University, Beijing, China LAURIE A. GARROW, Atlanta, GA, USA VIKASH V. GAYAH, University Park, PA, USA NIKOLAOS GEROLIMINIS, Lausanne, Switzerland KOSTAS GOULIAS, Santa Barbara, CA, USA KE HAN, Imperial College London (ICL), London, UK INGO HANSEN, Delft, The Netherlands MARTIN HAZELTON, Palmerston North, New Zealand STEPHANE HESS, Leeds, UK BENJAMIN HEYDECKER, London, UK SERGE HOOGENDOORN, Delft, The Netherlands HAI-JUN HUANG, Beijing, China WENLONG JIN, Irvine, CA, USA KARA KOCKELMAN, Austin, TX, USA JORGE LAVAL, Atlanta, GA, USA JEAN-PATRICK LEBAQUE, Arcueil, France LUDOVIC LECLERCQ, Vaulx-en-Velin Cedex, France BAIBING LI, Loughborough, UK HONG K. LO, Kowloon, Hong Kong HENRY X. LIU, Minneapolis, MN, USA QIANG MENG, National University of Singapore, Singapore ELISE MILLER-HOOKS, University of Maryland, College Park, MD, USA SE-IL MUN, Kyoto, Japan JUAN CARLOS MUNOZ, Santiago, Chile YU (MARCO)NIE, Evanston, IL, USA JUAN DE DIOS ORTUZAR, Santiago, Chile YANFENG OUYANG, Urbana-Champaign, IL, USA ANDREA PAPOLA, Napoli, Italy MICHAEL PATRIKSSON, Gothenburg, Sweden SRINIVAS PEETA, West Lafayette, IN, USA ABDUL R. PINJARI, Tampa, FL, USA SIRIPHONG LAWPHONGPANICH, Gainesville, FL, USA STEF PROOST, Leuven, Belgium LUCA QUADRIFOGLIO, College Station, TX, USA AMELIA REGAN, Irvine, CA, USA VENKY SHANKAR, PA, USA KENNETH SMALL, Irvine, CA, USA SIVA SRINIVASAN, Gainesville, FL, USA AGACHI SUMALEE, King Mongkut\u00e2\u20ac\u2122s Institute of Technology, Ladkrabang, Bangkok, Thailand JOFFRE SWAIT, University of South Australia, Sydney, Australia WAI YUAN SZETO, Pokfulam, Hong Kong MARTIN TREIBER, Technische Universita\u00c2\u00a8t Dresden, Dresden, Germany SATISH UKKUSURI, West Lafayette, IN, USA JOAN WALKER, University of California, Berkeley, CA, USA DAVID WATLING, Leeds, UK S.C. WONG, Pokfulam, Hong Kong TAO YAO, University Park, PA, USA YAFENG YIN, Gainesville, FL, USA ANMING ZHANG, Vancouver, Canada XIAONING ZHANG, Shanghai, China XURSONG ZHOU, Arizona State University, Phoenix, USA Advertising information: If you are interested in advertising or other commercial opportunities please e-mail Commercialsales@elsevier.com and your enquiry will be passed to the correct person who will respond to you within 48 hours. Publication information: Transportation Research: Part B (ISSN 0191-2615). For 2015, volumes 71\u00e2\u20ac\u201c82 (12 issues) are scheduled for publication. Subscription prices are available upon request from the Publisher or from the Elsevier Customer Service Department nearest you or from this jour- nal\u00e2\u20ac\u2122s website (http://www.elsevier.com/locate/trb). Further information is available on this journal and other Elsevier products through Elsevier\u00e2\u20ac\u2122s website (http://www.elsevier.com). Subscriptions are accepted on a prepaid basis only and are entered on a calendar year basis. Issues are sent by standard mail (surface within Europe, air delivery outside Europe). Priority rates are available upon request. Claims for missing issues should be made within six months of the date of dispatch. Orders, claims, and journal enquiries: please contact the Elsevier Customer Service Department nearest you: St. Louis: Elsevier Customer Service Department, 3251 Riverport Lane, Maryland Heights, MO 63043, USA; phone: (877) 8397126 [toll free within the USA]; (+1) (314) 4478878 [outside the USA]; fax: (+1) (314) 4478077; e-mail: JournalCustomerService-usa@elsevier.com Oxford: Elsevier Customer Service Department, The Boulevard, Langford Lane, Kidlington, Oxford OX5 1GB, UK; phone: (+44) (1865) 843434; fax: (+44) (1865) 843970; e-mail: JournalsCustomerServiceEMEA@elsevier.com Tokyo: Elsevier Customer Service Department, 4F Higashi-Azabu, 1-Chome Bldg, 1-9-15 Higashi-Azabu, Minato-ku, Tokyo 106-0044, Japan; phone: (+81) (3) 5561 5037; fax: (+81) (3) 5561 5047; e-mail: JournalsCustomerServiceJapan@elsevier.com Singapore: Elsevier Customer Service Department, 3 Killiney Road, #08-01 Winsland House I, Singapore 239519; phone: (+65) 63490222; fax: (+65) 67331510; e-mail: JournalsCustomerServiceAPAC@elsevier.com Past Editor-in-Chief FRED L. MANNERING Founding Editor FRANK A. HAIGHT iversity, Beijing, China LAURIE A. GARROW, Atlanta, GA, USA VIKASH V. GAYAH, University Park, PA, USA NIKOLAOS GEROLIMINIS, Lausanne, Switzerland KOSTAS GOULIAS, Santa Barbara, CA, USA KE HAN, Imperial College London (ICL), London, UK INGO HANSEN, Delft, The Netherlands MARTIN HAZELTON, Palmerston North, New Zealand STEPHANE HESS, Leeds, UK BENJAMIN HEYDECKER, London, UK SERGE HOOGENDOORN, Delft, The Netherlands HAI-JUN HUANG, Beijing, China WENLONG JIN, Irvine, CA, USA KARA KOCKELMAN, Austin, TX, USA JORGE LAVAL, Atlanta, GA, USA JEAN-PATRICK LEBAQUE, Arcueil, France LUDOVIC LECLERCQ, Vaulx-en-Velin Cedex, France BAIBING LI, Loughborough, UK HONG K. LO, Kowloon, Hong Kong HENRY X. LIU, Minneapolis, MN, USA QIANG MENG, National University of Singapore, Singapore ELISE MILLER-HOOKS, University of Maryland, College Park, MD, USA SE-IL MUN, Kyoto, Japan JUAN CARLOS MUNOZ, Santiago, Chile YU (MARCO)NIE, Evanston, IL, USA JUAN DE DIOS ORTUZAR, Santiago, Chile YANFENG OUYANG, Urbana-Champaign, IL, USA ANDREA PAPOLA, Napoli, Italy MICHAEL PATRIKSSON, Gothenburg, Sweden SRINIVAS PEETA, West Lafayette, IN, USA ABDUL R. PINJARI, Tampa, FL, USA SIRIPHONG LAWPHONGPANICH, Gainesville, FL, USA STEF PROOST, Leuven, Belgium LUCA QUADRIFOGLIO, College Station, TX, USA AMELIA REGAN, Irvine, CA, USA VENKY SHANKAR, PA, USA KENNETH SMALL, Irvine, CA, USA SIVA SRINIVASAN, Gainesville, FL, USA AGACHI SUMALEE, King Mongkut\u00e2\u20ac\u2122s Institute of Technology, Ladkrabang, Bangkok, Thailand JOFFRE SWAIT, University of South Australia, Sydney, Australia WAI YUAN SZETO, Pokfulam, Hong Kong MARTIN TREIBER, Technische Universita\u00c2\u00a8t Dresden, Dresden, Germany SATISH UKKUSURI, West Lafayette, IN, USA JOAN WALKER, University of California, Berkeley, CA, USA DAVID WATLING, Leeds, UK S.C. WONG, Pokfulam, Hong Kong TAO YAO, University Park, PA, USA YAFENG YIN, Gainesville, FL, USA ANMING ZHANG, Vancouver, Canada XIAONING ZHANG, Shanghai, China XURSONG ZHOU, Arizona State University, Phoenix, USA Advertising information: If you are interested in advertis TRB 80001545 S0191-2615(15)00062-4 10.1016/S0191-2615(15)00062-4 Elsevier Ltd Editorial Board", "coredata": {"eid": "1-s2.0-S0191261515000624", "dc:description": null, "openArchiveArticle": "false", "prism:coverDate": "2015-04-30", "openaccessUserLicense": null, "prism:aggregationType": "Journal", "prism:url": "https://api.elsevier.com/content/article/pii/S0191261515000624", "link": [{"@_fa": "true", "@rel": "self", "@href": "https://api.elsevier.com/content/article/pii/S0191261515000624"}, {"@_fa": "true", "@rel": "scidir", "@href": "https://www.sciencedirect.com/science/article/pii/S0191261515000624"}], "dc:format": "application/json", "openaccessType": null, "pii": "S0191-2615(15)00062-4", "prism:volume": "74", "prism:publisher": "Elsevier Ltd.", "dc:title": "Editorial Board", "prism:copyright": "Copyright \u00a9 2015 Elsevier Ltd. All rights reserved.", "openaccess": "0", "prism:issn": "01912615", "openaccessArticle": "false", "prism:publicationName": "Transportation Research Part B: Methodological", "openaccessSponsorType": null, "prism:pageRange": "IFC", "prism:coverDisplayDate": "April 2015", "prism:doi": "10.1016/S0191-2615(15)00062-4", "prism:startingPage": "IFC", "dc:identifier": "doi:10.1016/S0191-2615(15)00062-4", "openaccessSponsorName": null}}